03007016,3,7,16,"And if the sacrifice of his offering be a vow, or voluntary, it shall be eaten the same day that he presented his sacrifice; on the morrow also the remainder of it shall be eaten;"
03007017,3,7,17,and the remainder of the flesh of the sacrifice on the third day shall be burned with fire.
03007018,3,7,18,"And if [any] of the flesh of the sacrifice of his peace-offering be eaten at all on the third day, it shall not be accepted, it shall not be reckoned to him that hath presented it; it shall be an unclean thing, and the soul that eateth of it shall bear his iniquity."
03007019,3,7,19,"And the flesh that toucheth anything unclean shall not be eaten; it shall be burned with fire. And as to the flesh, all that are clean may eat [the] flesh."
03007020,3,7,20,"But the soul that eateth the flesh of the sacrifice of peace-offering which is for Jehovah, having his uncleanness upon him, that soul shall be cut off from his peoples."
03007021,3,7,21,"And if any one touch anything unclean, the uncleanness of man, or unclean beast, or any unclean abomination, and eat of the flesh of the sacrifice of peace-offering, which is for Jehovah, that soul shall be cut off from his peoples."
03007022,3,7,22,"And Jehovah spoke to Moses, saying,"
03007023,3,7,23,"Speak unto the children of Israel, saying, No fat, of ox, or of sheep, or of goat shall ye eat."
03007024,3,7,24,"But the fat of a dead carcase, and the fat of that which is torn, may be used in any other use; but ye shall in no wise eat it."
03007025,3,7,25,"For whoever eateth the fat of the beast of which men present an offering by fire to Jehovah, the soul that hath eaten shall be cut off from his peoples."
03007026,3,7,26,"And no blood shall ye eat in any of your dwellings, whether it be of fowl or of cattle."
03007027,3,7,27,"Whatever soul it be that eateth any manner of blood, that soul shall be cut off from his peoples."
03007028,3,7,28,"And Jehovah spoke to Moses, saying,"
03007029,3,7,29,"Speak unto the children of Israel, saying, He that presenteth the sacrifice of his peace-offering to Jehovah shall bring his offering to Jehovah of the sacrifice of his peace-offering."
03007030,3,7,30,"His own hands shall bring Jehovah's offerings by fire, the fat with the breast shall he bring: the breast, that it may be waved as a wave-offering before Jehovah."
03007031,3,7,31,And the priest shall burn the fat on the altar; and the breast shall be Aaron's and his sons'.
03007032,3,7,32,And the right shoulder of the sacrifices of your peace-offerings shall ye give as a heave-offering unto the priest.
03007033,3,7,33,"He of the sons of Aaron that presenteth the blood of the peace-offerings, and the fat, shall have the right shoulder for [his] part."
03007034,3,7,34,"For the breast of the wave-offering, and the shoulder of the heave-offering, have I taken of the children of Israel from the sacrifices of their peace-offerings, and have given them unto Aaron the priest and unto his sons from the children of Israel by an everlasting statute."
03007035,3,7,35,"This is [the portion] of the anointing of Aaron and of the anointing of his sons, from Jehovah's offerings by fire, in the day [when] he presented them to serve Jehovah as priests,"
03007036,3,7,36,"which Jehovah commanded to be given them by the children of Israel in the day that he anointed them: [it is] an everlasting statute, throughout their generations."
03007037,3,7,37,"This is the law of the burnt-offering, of the oblation, and of the sin-offering, and of the trespass-offering, and of the consecration-offering, and of the sacrifice of peace-offering,"
03007038,3,7,38,"which Jehovah commanded Moses in mount Sinai, in the day that he commanded the children of Israel to present their offerings to Jehovah, in the wilderness of Sinai."
03008001,3,8,1,"And Jehovah spoke to Moses, saying,"
03008002,3,8,2,"Take Aaron and his sons with him, and the garments and the anointing oil, and the bullock of the sin-offering, and the two rams, and the basket of unleavened [bread];"
03008003,3,8,3,and gather all the assembly together at the entrance of the tent of meeting.
03008004,3,8,4,And Moses did as Jehovah had commanded him; and the assembly was collected at the entrance of the tent of meeting.
03008005,3,8,5,"And Moses said to the assembly, This is the thing which Jehovah has commanded to be done."
03008006,3,8,6,"And Moses brought Aaron near, and his sons, and bathed them with water."
03008007,3,8,7,"And he put upon him the vest and girded him with the girdle, and clothed him with the cloak, and put the ephod on him, and he girded him with the girdle of the ephod, and fastened the ephod on him."
03008008,3,8,8,"And he put the breastplate on it, and put on the breastplate the Urim and the Thummim;"
03008009,3,8,9,"and he put the turban upon his head; and upon the turban, on the front of it, he put the golden plate, the holy diadem; as Jehovah had commanded Moses."
03008010,3,8,10,"And Moses took the anointing oil, and anointed the tabernacle and all that was in it, and hallowed them."
03008011,3,8,11,"And he sprinkled thereof on the altar seven times, and anointed the altar and all its utensils, and the laver and its stand, to hallow them."
03008012,3,8,12,"And he poured of the anointing oil on Aaron's head, and anointed him, to hallow him."
03008013,3,8,13,"And Moses brought Aaron's sons near and clothed them with the vests, and girded them with the girdles, and bound the high caps on them, as Jehovah had commanded Moses."
03008014,3,8,14,And he brought near the bullock for the sin-offering; and Aaron and his sons laid their hands on the head of the bullock for the sin-offering;
03008015,3,8,15,"and he slaughtered [it], and Moses took the blood, and put [it] on the horns of the altar round about with his finger, and cleansed the altar from sin, and the blood he poured at the bottom of the altar, and hallowed it, making atonement for it."
03008016,3,8,16,"And he took all the fat that was on the inwards, and the net of the liver, and the two kidneys, and their fat, and Moses burned [them] on the altar."
03008017,3,8,17,"And the bullock, and its skin, and its flesh, and its dung he burned with fire outside the camp, as Jehovah had commanded Moses."
03008018,3,8,18,And he presented the ram of the burnt-offering; and Aaron and his sons laid their hands on the head of the ram;
03008019,3,8,19,and he slaughtered [it]; and Moses sprinkled the blood on the altar round about.
03008020,3,8,20,"And the ram he cut up into its pieces; and Moses burned the head, and the pieces, and the fat;"
03008021,3,8,21,"and the inwards and the legs he washed in water; and Moses burned the whole ram on the altar: it was a burnt-offering for a sweet odour, it was an offering by fire to Jehovah; as Jehovah had commanded Moses."
03008022,3,8,22,"And he presented the second ram, the ram of consecration; and Aaron and his sons laid their hands on the head of the ram;"
03008023,3,8,23,"and one slaughtered [it]; and Moses took of its blood, and put [it] on the tip of Aaron's right ear, and on the thumb of his right hand, and on the great toe of his right foot;"
03008024,3,8,24,"and he brought Aaron's sons near, and Moses put of the blood on the tip of their right ear, and on the thumb of their right hand, and on the great toe of their right foot; and Moses sprinkled the blood upon the altar round about."
03008025,3,8,25,"And he took the fat, and the fat tail, and all the fat that was on the inwards, and the net of the liver, and the two kidneys and their fat, and the right shoulder;"
03008026,3,8,26,"and out of the basket of unleavened bread that was before Jehovah he took one unleavened cake, and a cake of oiled bread, and one wafer, and put them on the fat and upon the right shoulder;"
03008027,3,8,27,"and he gave all into Aaron's hands, and into his sons' hands, and waved them as a wave-offering before Jehovah."
03008028,3,8,28,"And Moses took them from off their hands, and burned [them] on the altar, over the burnt-offering: they were a consecration-offering for a sweet odour: it was an offering by fire to Jehovah."
03008029,3,8,29,"And Moses took the breast, and waved it as a wave-offering before Jehovah; of the ram of consecration it was Moses' part; as Jehovah had commanded Moses."
03008030,3,8,30,"And Moses took of the anointing oil, and of the blood that was on the altar, and sprinkled [it] on Aaron, on his garments, and on his sons, and on his sons' garments with him; and hallowed Aaron, his garments, and his sons, and his sons' garments with him."
03008031,3,8,31,"And Moses spoke to Aaron and to his sons, Boil the flesh at the entrance of the tent of meeting; and there eat it and the bread that is in the basket of the consecration-offering, as I commanded, saying, Aaron and his sons shall eat it."
03008032,3,8,32,And that which remaineth of the flesh and of the bread shall ye burn with fire.
03008033,3,8,33,"And ye shall not go out from the entrance of the tent of meeting seven days, until the day when the days of your consecration are at an end: for seven days shall ye be consecrated."
03008034,3,8,34,"As he hath done this day, [so] Jehovah hath commanded to do, to make atonement for you."
03008035,3,8,35,"And ye shall abide at the entrance of the tent of meeting day and night seven days, and keep the charge of Jehovah, that ye die not; for so I am commanded."
03008036,3,8,36,And Aaron and his sons did all things that Jehovah had commanded by the hand of Moses.
03009001,3,9,1,"And it came to pass on the eighth day, [that] Moses called Aaron and his sons, and the elders of Israel,"
03009002,3,9,2,"and said to Aaron, Take thee a young calf for a sin-offering, and a ram for a burnt-offering, without blemish, and present [them] before Jehovah;"
03009003,3,9,3,"and to the children of Israel shalt thou speak, saying, Take a buck of the goats for a sin-offering, and a calf and a lamb, yearlings, without blemish, for a burnt-offering;"
03009004,3,9,4,"and a bullock and a ram for a peace-offering, to sacrifice before Jehovah; and an oblation mingled with oil; for to-day Jehovah will appear to you."
03009005,3,9,5,And they brought what Moses commanded before the tent of meeting; and all the assembly approached and stood before Jehovah.
03009006,3,9,6,"And Moses said, This is the thing which Jehovah has commanded that ye should do; and the glory of Jehovah shall appear to you."
03009007,3,9,7,"And Moses said unto Aaron, Go to the altar, and offer thy sin-offering, and thy burnt-offering, and make atonement for thyself, and for the people; and offer the offering of the people, and make atonement for them, as Jehovah has commanded."
03009008,3,9,8,And Aaron went to the altar and slaughtered the calf of the sin-offering which was for himself;
03009009,3,9,9,"and the sons of Aaron presented the blood to him, and he dipped his finger in the blood, and put [it] on the horns of the altar, and poured out the blood at the bottom of the altar."
03009010,3,9,10,"And the fat, and the kidneys, and the net above the liver, of the sin-offering, he burned on the altar, as Jehovah had commanded Moses."
03009011,3,9,11,And the flesh and the skin he burned with fire outside the camp.
03009012,3,9,12,"And he slaughtered the burnt-offering; and Aaron's sons delivered to him the blood, which he sprinkled on the altar round about."
03009013,3,9,13,"And they delivered the burnt-offering to him, in the pieces thereof, and the head; and he burned [them] on the altar."
03009014,3,9,14,"And he washed the inwards and the legs, and burned [them] upon the burnt-offering, on the altar."
03009015,3,9,15,"And he presented the people's offering, and took the goat of the sin-offering which was for the people and slaughtered it, and offered it for sin, as the first."
03009016,3,9,16,And he presented the burnt-offering and offered it according to the ordinance.
03009017,3,9,17,"And he presented the oblation, and took a handful of it, and burned it on the altar, besides the burnt-offering of the morning."
03009018,3,9,18,"And he slaughtered the bullock and the ram of the sacrifice of peace-offering which was for the people. And Aaron's sons delivered to him the blood, and he sprinkled it on the altar round about;"
03009019,3,9,19,"and the pieces of fat of the bullock and of the ram, the fat tail and what covers [the inwards], and the kidneys, and the net of the liver;"
03009020,3,9,20,"and they put the pieces of fat on the breast-pieces, and he burned the pieces of fat on the altar;"
03009021,3,9,21,"and the breast-pieces and the right shoulder Aaron waved as a wave-offering before Jehovah, as Moses had commanded."
03009022,3,9,22,"And Aaron lifted up his hands toward the people and blessed them, and came down after the offering of the sin-offering, and the burnt-offering, and the peace-offering."
03009023,3,9,23,"And Moses and Aaron went into the tent of meeting, and came out and blessed the people; and the glory of Jehovah appeared to all the people."
03009024,3,9,24,"And there went out fire from before Jehovah, and consumed on the altar the burnt-offering, and the pieces of fat; and all the people saw it, and they shouted, and fell on their face."
03010001,3,10,1,"And the sons of Aaron, Nadab and Abihu, took each of them his censer, and put fire in it, and put incense on it, and presented strange fire before Jehovah, which he had not commanded them."
03010002,3,10,2,"And there went out fire from before Jehovah, and devoured them, and they died before Jehovah."
03010003,3,10,3,"And Moses said to Aaron, This is what Jehovah spoke, saying, I will be hallowed in them that come near me, and before all the people I will be glorified. And Aaron was silent."
03010004,3,10,4,"And Moses called Mishael and Elzaphan, the sons of Uzziel the uncle of Aaron, and said to them, Come near, carry your brethren from before the sanctuary out of the camp."
03010005,3,10,5,"And they went near, and carried them in their vests out of the camp, as Moses had said."
03010006,3,10,6,"And Moses said to Aaron, and to Eleazar and to Ithamar his sons, Your heads shall ye not uncover, neither rend your clothes; lest ye die, and lest wrath come on all the assembly; but your brethren, the whole house of Israel, shall bewail the burning which Jehovah hath kindled."
03010007,3,10,7,"And ye shall not go out from the entrance of the tent of meeting, lest ye die; for the anointing oil of Jehovah is upon you. And they did according to the word of Moses."
03010008,3,10,8,"And Jehovah spoke to Aaron, saying,"
03010009,3,10,9,"Thou shalt not drink wine nor strong drink, thou, and thy sons with thee, when ye go into the tent of meeting, lest ye die -- [it is] an everlasting statute throughout your generations,"
03010010,3,10,10,"that ye may put difference between the holy and the unholy, and between unclean and clean,"
03010011,3,10,11,and that ye may teach the children of Israel all the statutes which Jehovah hath spoken to them by the hand of Moses.
03010012,3,10,12,"And Moses spoke to Aaron, and to Eleazar and to Ithamar, his sons that were left, Take the oblation that is left of Jehovah's offerings by fire, and eat it with unleavened bread beside the altar; for it is most holy."
03010013,3,10,13,"And ye shall eat it in a holy place, because it is thy due, and thy sons' due, of Jehovah's offerings by fire; for so I am commanded."
03010014,3,10,14,"And the breast of the wave-offering, and the shoulder of the heave-offering shall ye eat in a clean place, thou, and thy sons, and thy daughters with thee; for [as] thy due, and thy sons' due, are they given of the sacrifices of peace-offerings of the children of Israel."
03010015,3,10,15,"The shoulder of the heave-offering and the breast of the wave-offering shall they bring, with the fire-offering of the pieces of fat, to wave [them] as a wave-offering before Jehovah; and they shall be thine, and thy sons' with thee, for an everlasting statute, as Jehovah has commanded."
03010016,3,10,16,"And Moses diligently sought the goat of the sin-offering, and behold, it was burnt up: then he was wroth with Eleazar and Ithamar, the sons of Aaron that were left, saying,"
03010017,3,10,17,"Why have ye not eaten the sin-offering in a holy place? for it is most holy, and he has given it to you that ye might bear the iniquity of the assembly, to make atonement for them before Jehovah."
03010018,3,10,18,"Lo, its blood was not brought in within the sanctuary: ye should certainly have eaten it in the sanctuary, as I commanded."
03010019,3,10,19,"And Aaron said to Moses, Behold, to-day have they presented their sin-offering and their burnt-offering before Jehovah; and such things have befallen me; and had I to-day eaten the sin-offering, would it have been good in the sight of Jehovah?"
03010020,3,10,20,And Moses heard it; and it was good in his sight.
03011001,3,11,1,"And Jehovah spoke to Moses and to Aaron, saying to them,"
03011002,3,11,2,"Speak unto the children of Israel, saying, These are the animals which ye shall eat of all the beasts which are on the earth."
03011003,3,11,3,"Whatever hath cloven hoofs, and feet quite split open, and cheweth the cud, among the beasts -- that shall ye eat."
03011004,3,11,4,"Only these shall ye not eat of those that chew the cud, or of those with cloven hoofs: the camel, for it cheweth the cud, but hath not cloven hoofs -- it shall be unclean unto you;"
03011005,3,11,5,"and the rock-badger, for it cheweth the cud, but hath not cloven hoofs -- it shall be unclean unto you;"
03011006,3,11,6,"and the hare, for it cheweth the cud, but hath not cloven hoofs -- it shall be unclean unto you;"
03011007,3,11,7,"and the swine, for it hath cloven hoofs, and feet quite split open, but it cheweth not the cud -- it shall be unclean unto you."
03011008,3,11,8,"Of their flesh shall ye not eat, and their carcase shall ye not touch: they shall be unclean unto you."
03011009,3,11,9,"These shall ye eat of all that are in the waters: whatever hath fins and scales in waters, in seas and in rivers, these shall ye eat;"
03011010,3,11,10,"but all that have not fins and scales in seas and in rivers, of all that swarm in the waters, and of every living soul which is in the waters -- they shall be an abomination unto you."
03011011,3,11,11,"They shall be even an abomination unto you: of their flesh shall ye not eat, and their carcase ye shall have in abomination."
03011012,3,11,12,"Whatever in the waters hath no fins and scales, that shall be an abomination unto you."
03011013,3,11,13,"And these shall ye have in abomination of the fowls; they shall not be eaten; an abomination shall they be: the eagle, and the ossifrage, and the sea-eagle,"
03011014,3,11,14,"and the falcon, and the kite, after its kind;"
03011015,3,11,15,every raven after its kind;
03011016,3,11,16,"and the female ostrich and the male ostrich, and the sea-gull, and the hawk, after its kind;"
03011017,3,11,17,"and the owl, and the gannet, and the ibis,"
03011018,3,11,18,"and the swan, and the pelican, and the carrion vulture,"
03011019,3,11,19,"and the stork; the heron after its kind, and the hoopoe, and the bat."
03011020,3,11,20,Every winged crawling thing that goeth upon all four shall be an abomination unto you.
03011021,3,11,21,Yet these shall ye eat of every winged crawling thing that goeth upon all four: those which have legs above their feet with which to leap upon the earth.
03011022,3,11,22,"These shall ye eat of them: the arbeh after its kind, and the solam after its kind, and the hargol after its kind, and the hargab after its kind."
03011023,3,11,23,But every winged crawling thing that hath four feet shall be an abomination unto you.
03011024,3,11,24,And by these ye shall make yourselves unclean; whoever toucheth their carcase shall be unclean until the even.
03011025,3,11,25,"And whoever carrieth [ought] of their carcase shall wash his garments, and be unclean until the even."
03011026,3,11,26,"Every beast that hath cloven hoofs, but not feet quite split open, nor cheweth the cud, shall be unclean unto you: every one that toucheth them shall be unclean."
03011027,3,11,27,"And whatever goeth on its paws, among all manner of beasts that go upon all four, those are unclean unto you: whoever toucheth their carcase shall be unclean until the even."
03011028,3,11,28,"And he that carrieth their carcase shall wash his garments, and be unclean until the even: they shall be unclean unto you."
03011029,3,11,29,"And these shall be unclean unto you among the crawling things which crawl on the earth: the mole, and the field-mouse, and the lizard, after its kind;"
03011030,3,11,30,"and the groaning lizard, and the great red lizard, and the climbing lizard, and the chomet, and the chameleon."
03011031,3,11,31,"These shall be unclean unto you among all that crawl: whoever toucheth them when they are dead, shall be unclean until the even."
03011032,3,11,32,"And on whatever any of them when they are dead doth fall, it shall be unclean; all vessels of wood, or garment, or skin, or sack, every vessel wherewith work is done -- it shall be put into water, and be unclean until the even; then shall it be clean."
03011033,3,11,33,And every earthen vessel into which [any] of them falleth -- whatever is in it shall be unclean; and ye shall break it.
03011034,3,11,34,"All food that is eaten on which [such] water hath come shall be unclean; and all drink that is drunk shall be unclean, in every [such] vessel."
03011035,3,11,35,"And everything where upon [any part] of their carcase falleth shall be unclean; oven and hearth shall be broken down: they are unclean, and shall be unclean unto you."
03011036,3,11,36,"Nevertheless, a spring or a well, a quantity of water, shall be clean. But he that toucheth their carcase shall be unclean."
03011037,3,11,37,"And if any part of their carcase fall upon any sowing-seed which is to be sown, it shall be clean;"
03011038,3,11,38,"but if water have been put on the seed, and any part of their carcase fall thereon, it shall be unclean unto you."
03011039,3,11,39,"And if any beast which is to you for food die, he that toucheth the carcase thereof shall be unclean until the even."
03011040,3,11,40,"And he that eateth of its carcase shall wash his garments, and be unclean until the even: he also that carrieth its carcase shall wash his garments, and be unclean until the even."
03011041,3,11,41,And every crawling thing which crawleth on the earth shall be an abomination; it shall not be eaten.
03011042,3,11,42,"Whatever goeth on the belly, and whatever goeth on all four, and all that have a great many feet, of every manner of crawling thing which crawleth on the earth -- these ye shall not eat; for they are an abomination."
03011043,3,11,43,"Ye shall not make yourselves abominable through any crawling thing which crawleth, neither shall ye make yourselves unclean with them, that ye should be defiled thereby."
03011044,3,11,44,"For I am Jehovah your God; and ye shall hallow yourselves, and ye shall be holy; for I am holy; and ye shall not make yourselves unclean through any manner of crawling thing which creepeth on the earth."
03011045,3,11,45,"For I am Jehovah who brought you up out of the land of Egypt, to be your God: ye shall therefore be holy, for I am holy."
03011046,3,11,46,"This is the law of cattle, and of fowl, and of every living soul that moveth in the waters, and of every soul that crawleth on the earth;"
03011047,3,11,47,"to make a difference between the unclean and the clean, and between the beast that is to be eaten and the beast that is not to be eaten."
03012001,3,12,1,"And Jehovah spoke to Moses, saying,"
03012002,3,12,2,"Speak unto the children of Israel, saying, If a woman conceive seed, and bear a male, then she shall be unclean seven days; as in the days of the separation of her infirmity shall she be unclean."
03012003,3,12,3,And on the eighth day shall the flesh of his foreskin be circumcised.
03012004,3,12,4,"And she shall continue thirty-three days in the blood of her cleansing; no holy thing shall she touch, nor come into the sanctuary, until the days of her cleansing are fulfilled."
03012005,3,12,5,"And if she bear a female, then she shall be unclean two weeks, as in her separation; and she shall continue sixty-six days in the blood of her cleansing."
03012006,3,12,6,"And when the days of her cleansing are fulfilled, for a son or for a daughter, she shall bring a yearling lamb for a burnt-offering, and a young pigeon or a turtle-dove for a sin-offering, to the entrance of the tent of meeting, unto the priest."
03012007,3,12,7,"And he shall present it before Jehovah, and make atonement for her; and she shall be clean from the flux of her blood. This is the law for her that hath borne a male or a female."
03012008,3,12,8,"And if her hand cannot find what is sufficient for a sheep, she shall bring two turtle-doves or two young pigeons; one for a burnt-offering, and the other for a sin-offering; and the priest shall make atonement for her; and she shall be clean."
03013001,3,13,1,"And Jehovah spoke to Moses and to Aaron, saying,"
03013002,3,13,2,"When a man shall have in the skin of his flesh a rising or a scab, or bright spot, and it become in the skin of his flesh a sore [as] of leprosy, then he shall be brought unto Aaron the priest, or unto one of his sons the priests."
03013003,3,13,3,"And when the priest looketh on the sore in the skin of the flesh, and the hair in the sore is turned white, and the sore looketh deeper than the skin of his flesh, it is the sore of leprosy; and the priest shall look on him and pronounce him unclean."
03013004,3,13,4,"But if the bright spot be white in the skin of his flesh, and look not deeper than the skin, and the hair thereof be not turned white, the priest shall shut up [him that hath] the sore seven days."
