03022003,3,22,3,"Say unto them, Every one of all your seed, throughout your generations, that approacheth the holy things, which the children of Israel hallow unto Jehovah, having his uncleanness upon him, that soul shall be cut off from before me: I am Jehovah."
03022004,3,22,4,"Whatsoever man of the seed of Aaron is a leper, or hath a flux, he shall not eat of the holy things, until he is clean. And he that toucheth any one that is unclean by a dead person, or a man whose seed of copulation hath passed from him;"
03022005,3,22,5,"or a man that toucheth any crawling thing whereby he becometh unclean, or a man by whom he may become unclean, whatever may be his uncleanness,"
03022006,3,22,6,"-- a person that toucheth any such shall be unclean until even, and shall not eat of the holy things; but he shall bathe his flesh with water,"
03022007,3,22,7,"and when the sun goeth down, he shall be clean, and may afterwards eat of the holy things; for it is his food."
03022008,3,22,8,"Of a dead carcase and what is torn shall he not eat, to make himself unclean therewith: I am Jehovah."
03022009,3,22,9,"And they shall keep my charge, lest they bear sin for it, and die by it, if they profane it: I am Jehovah who do hallow them."
03022010,3,22,10,"And no stranger shall eat the holy thing; the sojourner with the priest, and the hired servant, shall not eat of the holy thing."
03022011,3,22,11,"But if a priest buy any one for money, he may eat of it, and he that is born in his house: they may eat of his food."
03022012,3,22,12,And a priest's daughter who is [married] to a stranger may not eat of the heave-offering of the holy things.
03022013,3,22,13,"But a priest's daughter that becometh a widow, or is divorced, and hath no seed, and returneth unto her father's house, as in her youth, she may eat of her father's food; but no stranger shall eat thereof."
03022014,3,22,14,"And if a man eat of a holy thing through inadvertence, then he shall put the fifth part thereof unto it, and shall give it unto the priest with the holy thing."
03022015,3,22,15,"And they shall not profane the holy things of the children of Israel which they offer unto Jehovah,"
03022016,3,22,16,and cause them to bear the iniquity of trespass when they eat their holy things; for I am Jehovah who do hallow them.
03022017,3,22,17,"And Jehovah spoke to Moses, saying,"
03022018,3,22,18,"Speak unto Aaron, and to his sons, and unto all the children of Israel, and say unto them, Whatever man of the house of Israel, or of the sojourners in Israel, that presenteth his offering for any of his vows, and for any of his voluntary offerings, which they present to Jehovah as a burnt-offering,"
03022019,3,22,19,"it shall be for your acceptance, without blemish, a male of the oxen, of the sheep, and of the goats."
03022020,3,22,20,Nothing that hath a defect shall ye present; for it shall not be acceptable for you.
03022021,3,22,21,"And if any present a sacrifice of peace-offering to Jehovah to accomplish a vow, or a voluntary offering of oxen or small cattle, it shall be without blemish to be accepted: there shall be no defect therein."
03022022,3,22,22,"Blind, or broken, or maimed, or ulcerous, or with itch, or scabbed -- ye shall not present these to Jehovah, nor make an offering by fire of them on the altar to Jehovah."
03022023,3,22,23,"A bullock and a sheep that hath a member too long or too short, that mayest thou offer as a voluntary offering; but as a vow it shall not be accepted."
03022024,3,22,24,"That which is bruised, or crushed, or broken, or cut shall ye not present to Jehovah; neither in your land shall ye do [the like]."
03022025,3,22,25,"Nor from the hand of the stranger shall ye present the bread of your God, of any of these; for their corruption is in them: a defect is in them; they shall not be accepted for you."
03022026,3,22,26,"And Jehovah spoke to Moses, saying,"
03022027,3,22,27,"An ox, or a sheep, or a goat, when it is brought forth, shall be seven days under its dam; and from the eighth day and thenceforth it shall be accepted for an offering by fire to Jehovah."
03022028,3,22,28,"A cow, or sheep -- it and its young shall ye not slaughter in one day."
03022029,3,22,29,"And when ye sacrifice a sacrifice of thanksgiving to Jehovah, ye shall sacrifice it for your acceptance."
03022030,3,22,30,On that day shall it be eaten: ye shall leave none of it until morning: I am Jehovah.
03022031,3,22,31,And ye shall observe my commandments and do them: I am Jehovah.
03022032,3,22,32,"And ye shall not profane my holy name; but I will be hallowed among the children of Israel: I am Jehovah who do hallow you,"
03022033,3,22,33,"who brought you out of the land of Egypt, to be your God: I am Jehovah."
03023001,3,23,1,"And Jehovah spoke to Moses, saying,"
03023002,3,23,2,"Speak unto the children of Israel, and say unto them, [Concerning] the set feasts of Jehovah, which ye shall proclaim as holy convocations -- these are my set feasts."
03023003,3,23,3,"Six days shall work be done; but on the seventh day is the sabbath of rest, a holy convocation; no manner of work shall ye do: it is the sabbath to Jehovah in all your dwellings."
03023004,3,23,4,"These are the set feasts of Jehovah, holy convocations, which ye shall proclaim in their seasons:"
03023005,3,23,5,"In the first month, on the fourteenth of the month, between the two evenings, is the passover to Jehovah."
03023006,3,23,6,And on the fifteenth day of this month is the feast of unleavened bread to Jehovah; seven days shall ye eat unleavened bread.
03023007,3,23,7,On the first day ye shall have a holy convocation: no manner of servile work shall ye do.
03023008,3,23,8,And ye shall present to Jehovah an offering by fire seven days; on the seventh day is a holy convocation: no manner of servile work shall ye do.
03023009,3,23,9,"And Jehovah spoke to Moses, saying,"
03023010,3,23,10,"Speak unto the children of Israel and say unto them, When ye come into the land that I give unto you, and ye reap the harvest thereof, then ye shall bring a sheaf of the first-fruits of your harvest unto the priest."
03023011,3,23,11,"And he shall wave the sheaf before Jehovah, to be accepted for you; on the next day after the sabbath the priest shall wave it."
03023012,3,23,12,"And ye shall offer that day when ye wave the sheaf, a he-lamb without blemish, a yearling, for a burnt-offering to Jehovah;"
03023013,3,23,13,"and the oblation thereof: two tenths of fine flour mingled with oil, an offering by fire to Jehovah for a sweet odour; and the drink-offering thereof, of wine, a fourth part of a hin."
03023014,3,23,14,"And ye shall not eat bread, or roast corn, or green ears, until the same day that ye have brought the offering of your God: [it is] an everlasting statute throughout your generations in all your dwellings."
03023015,3,23,15,"And ye shall count from the morning after the sabbath, from the day that ye brought the sheaf of the wave-offering, seven weeks; they shall be complete;"
03023016,3,23,16,even unto the morning after the seventh sabbath shall ye count fifty days; and ye shall present a new oblation to Jehovah.
03023017,3,23,17,"Out of your dwellings shall ye bring two wave-loaves, of two tenths of fine flour; with leaven shall they be baken; [as] first-fruits to Jehovah."
03023018,3,23,18,"And ye shall present with the bread seven he-lambs without blemish, yearlings, and one young bullock, and two rams: they shall be a burnt-offering to Jehovah with their oblation, and their drink-offerings, an offering by fire of a sweet odour to Jehovah."
03023019,3,23,19,"And ye shall sacrifice one buck of the goats for a sin-offering, and two he-lambs, yearlings, for a sacrifice of peace-offering."
03023020,3,23,20,"And the priest shall wave them with the bread of the first-fruits as a wave-offering before Jehovah, with the two he-lambs; they shall be holy to Jehovah, for the priest."
03023021,3,23,21,And ye shall make proclamation on that same day -- a holy convocation shall it be unto you: no manner of servile work shall ye do: [it is] an everlasting statute in all your dwellings throughout your generations.
03023022,3,23,22,"And when ye reap the harvest of your land, thou shalt not in thy harvest entirely reap the corners of thy field, and the gleaning of thy harvest shalt thou not gather: thou shalt leave them unto the poor and to the stranger: I am Jehovah your God."
03023023,3,23,23,"And Jehovah spoke to Moses, saying,"
03023024,3,23,24,"Speak unto the children of Israel, saying, In the seventh month, on the first of the month, shall ye have a rest, a memorial of blowing of trumpets, a holy convocation."
03023025,3,23,25,No manner of servile work shall ye do; and ye shall present an offering by fire to Jehovah.
03023026,3,23,26,"And Jehovah spoke to Moses, saying,"
03023027,3,23,27,"Also on the tenth of this seventh month is the day of the atonement: a holy convocation shall it be unto you; and ye shall afflict your souls, and present an offering by fire to Jehovah."
03023028,3,23,28,"And ye shall do no manner of work on that same day; for it is a day of atonement, to make atonement for you before Jehovah your God."
03023029,3,23,29,"For every soul that is not afflicted on that same day, shall be cut off from among his peoples."
03023030,3,23,30,"And every soul that doeth any manner of work on that same day, the same soul will I destroy from among his people."
03023031,3,23,31,No manner of work shall ye do: [it is] an everlasting statute throughout your generations in all your dwellings.
03023032,3,23,32,"A sabbath of rest shall it be unto you; and ye shall afflict your souls. On the ninth of the month at even, from even unto even, shall ye celebrate your sabbath."
03023033,3,23,33,"And Jehovah spoke to Moses, saying,"
03023034,3,23,34,"Speak unto the children of Israel, saying, On the fifteenth day of this seventh month is the feast of booths seven days to Jehovah."
03023035,3,23,35,On the first day there shall be a holy convocation: no manner of servile work shall ye do.
03023036,3,23,36,Seven days ye shall present an offering by fire to Jehovah; on the eighth day shall be a holy convocation unto you; and ye shall present an offering by fire to Jehovah: it is a solemn assembly; no manner of servile work shall ye do.
03023037,3,23,37,"These are the set feasts of Jehovah, which ye shall proclaim as holy convocations, to present an offering by fire to Jehovah, a burnt-offering, and an oblation, a sacrifice, and drink-offerings, everything upon its day;"
03023038,3,23,38,"besides the sabbaths of Jehovah, and besides your gifts, and besides all your vows, and besides all your voluntary offerings, which ye give to Jehovah."
03023039,3,23,39,"But on the fifteenth day of the seventh month, when ye have gathered in the produce of the land, ye shall celebrate the feast of Jehovah seven days: on the first day there shall be rest, and on the eighth day there shall be rest."
03023040,3,23,40,"And ye shall take on the first day the fruit of beautiful trees, palm branches and the boughs of leafy trees, and willows of the brook; and ye shall rejoice before Jehovah your God seven days."
03023041,3,23,41,And ye shall celebrate it as a feast to Jehovah seven days in the year: [it is] an everlasting statute throughout your generations; in the seventh month shall ye celebrate it.
03023042,3,23,42,In booths shall ye dwell seven days; all born in Israel shall dwell in booths;
03023043,3,23,43,"that your generations may know that I caused the children of Israel to dwell in booths, when I brought them out of the land of Egypt: I am Jehovah your God."
03023044,3,23,44,And Moses declared the set feasts of Jehovah to the children of Israel.
03024001,3,24,1,"And Jehovah spoke to Moses, saying,"
03024002,3,24,2,"Command the children of Israel that they bring unto thee pure beaten olive oil for the light, to light the lamp continually."
03024003,3,24,3,"Outside the veil of the testimony, in the tent of meeting, shall Aaron dress it from evening to morning before Jehovah continually: [it is] an everlasting statute throughout your generations."
03024004,3,24,4,Upon the pure candlestick shall he arrange the lamps before Jehovah continually.
03024005,3,24,5,"And thou shalt take fine wheaten flour, and bake twelve cakes thereof; each cake shall be of two tenths."
03024006,3,24,6,"And thou shalt set them in two rows, six in a row, upon the pure table before Jehovah."
03024007,3,24,7,"And thou shalt put pure frankincense upon each row; and it shall be a bread of remembrance, an offering by fire to Jehovah."
03024008,3,24,8,"Every sabbath day he shall arrange it before Jehovah continually, on the part of the children of Israel: [it is] an everlasting covenant."
03024009,3,24,9,And it shall be Aaron's and his sons'; and they shall eat it in a holy place; for it is most holy unto him of Jehovah's offerings by fire: [it is] an everlasting statute.
03024010,3,24,10,"And the son of an Israelitish woman -- but withal the son of an Egyptian, -- went out among the children of Israel; and this son of the Israelitess and a man of Israel strove together in the camp;"
03024011,3,24,11,"and the Israelitish woman's son blasphemed the Name, and cursed; and they brought him to Moses. And his mother's name was Shelomith, the daughter of Dibri, of the tribe of Dan."
03024012,3,24,12,"And they confined him, that they might decide at the mouth of Jehovah."
03024013,3,24,13,"And Jehovah spoke to Moses, saying,"
03024014,3,24,14,"Lead the reviler outside the camp; and all that heard [him] shall lay their hands upon his head, and the whole assembly shall stone him."
03024015,3,24,15,"And thou shalt speak unto the children of Israel, saying, Every one when he revileth his God shall bear his sin."
03024016,3,24,16,"And he that blasphemeth the name of Jehovah shall certainly be put to death; all the assembly shall certainly stone him; as well the stranger as he that is home-born, when he blasphemeth the Name, shall be put to death."
03024017,3,24,17,"And if any one smiteth any man mortally, he shall certainly be put to death."
03024018,3,24,18,"And he that smiteth a beast mortally shall make it good, life for life."
03024019,3,24,19,"And if a man cause a blemish in his neighbour, as he hath done, so shall it be done to him;"
03024020,3,24,20,"breach for breach, eye for eye, tooth for tooth: as he hath caused a blemish in a man, so shall it be done to him."
03024021,3,24,21,He that smiteth a beast [mortally] shall make it good; and he that smiteth a man [mortally] shall be put to death.
03024022,3,24,22,"Ye shall have one law: as the stranger, so the home-born; for I am Jehovah your God."
03024023,3,24,23,And Moses spoke to the children of Israel; and they led the reviler outside the camp and stoned him with stones. And the children of Israel did as Jehovah had commanded Moses.
03025001,3,25,1,"And Jehovah spoke to Moses in mount Sinai, saying,"
03025002,3,25,2,"Speak unto the children of Israel and say unto them, When ye come into the land that I will give you, the land shall celebrate a sabbath to Jehovah."
03025003,3,25,3,"Six years shalt thou sow thy field, and six years shalt thou prune thy vineyard, and gather in the produce thereof,"
03025004,3,25,4,"but in the seventh year shall be a sabbath of rest for the land, a sabbath to Jehovah. Thy field shalt thou not sow, and thy vineyard shalt thou not prune."
03025005,3,25,5,"That which springeth up from the scattered seed of thy harvest thou shalt not reap, and the grapes of thine undressed vines thou shalt not gather: a year of rest shall it be for the land."
03025006,3,25,6,"And the sabbath of the land shall be for food for you, for thee, and for thy bondman, and for thy handmaid, and for thy hired servant, and for him that dwelleth as a sojourner with thee, and for thy cattle,"
03025007,3,25,7,and for the beasts that are in thy land: all the produce thereof shall be for food.
03025008,3,25,8,"And thou shalt count seven sabbaths of years, seven times seven years; so that the days of the seven sabbaths of years be unto thee forty-nine years."
03025009,3,25,9,"Then shalt thou cause the loud sound of the trumpet to go forth in the seventh month, on the tenth of the month; on the day of atonement shall ye cause the trumpet to go forth throughout your land."
03025010,3,25,10,"And ye shall hallow the year of the fiftieth year, and proclaim liberty in the land unto all the inhabitants thereof; a [year of] jubilee shall it be unto you, and ye shall return every man unto his possession, and ye shall return every man unto his family;"
03025011,3,25,11,"a year of jubilee shall that fiftieth year be unto you: ye shall not sow, neither reap its aftergrowth, nor gather [the fruit of] its undressed vines."
03025012,3,25,12,For it is the jubilee; it shall be holy unto you; out of the field shall ye eat its produce.
03025013,3,25,13,In this year of the jubilee ye shall return every man unto his possession.
03025014,3,25,14,"And if ye sell ought unto your neighbour, or buy of your neighbour's hand, ye shall not overreach one another."
03025015,3,25,15,"According to the number of years since the jubilee, thou shalt buy of thy neighbour; according to the number of years of the produce, he shall sell unto thee."
03025016,3,25,16,"According to the greater number of the years, thou shalt increase the price thereof; and according to the fewness of years, thou shalt diminish the price of it; for it is the number of crops that he selleth unto thee."
03025017,3,25,17,And ye shall not oppress one another; but thou shalt fear thy God; for I am Jehovah your God.
03025018,3,25,18,"And ye shall do my statutes, and observe mine ordinances and do them: thus shall ye dwell in your land securely."
03025019,3,25,19,"And the land shall yield its fruit, and ye shall eat and be satisfied, and dwell therein securely."
03025020,3,25,20,"And if ye say, What shall we eat in the seventh year? behold, we may not sow, nor gather in our produce;"
03025021,3,25,21,"then I will command my blessing upon you in the sixth year, that it may bring forth produce for three years;"
03025022,3,25,22,"and ye shall sow in the eighth year, and ye shall eat of the old fruit until the ninth year; until her produce come in, ye shall eat the old."
03025023,3,25,23,And the land shall not be sold for ever; for the land is mine; for ye are strangers and sojourners with me.
03025024,3,25,24,And in all the land of your possession ye shall grant a redemption for the land.
03025025,3,25,25,"If thy brother grow poor, and sell of his possession, then shall his redeemer, his nearest relation, come and redeem that which his brother sold."
03025026,3,25,26,"And if the man have no one having right of redemption, and his hand have acquired and found what sufficeth for its redemption,"
03025027,3,25,27,"then shall he reckon the years since the sale thereof, and restore the overplus unto the man to whom he sold it; and so return unto his possession."
03025028,3,25,28,"And if his hand have not found what sufficeth for him to restore it to him, then that which is sold shall remain in the hand of the purchaser, until the year of jubilee; and in the jubilee it shall go out, and he shall return unto his possession."
03025029,3,25,29,"And if any one sell a dwelling-house in a walled city, then he shall have the right of redemption up to the end of the year of the sale thereof; for a full year shall he have the right of redemption."
03025030,3,25,30,"But if it be not redeemed until a whole year is complete, then the house that is in the walled city shall be established for ever to him that bought it, throughout his generations: it shall not go out in the jubilee."
03025031,3,25,31,"But the houses in villages that have no wall round about them shall be reckoned as the fields of the country: they may be redeemed, and they shall go out in the jubilee."
03025032,3,25,32,"But as to the cities of the Levites, the houses in the cities of their possession, the Levites shall have a perpetual right of redemption."
03025033,3,25,33,"And if any one redeem from one of the Levites, then the house that was sold, in the city of his possession, shall go out in the jubilee; for the houses of the cities of the Levites are their possession among the children of Israel."
03025034,3,25,34,And the field of the suburbs of their cities shall not be sold; for it is their perpetual possession.
03025035,3,25,35,"And if thy brother grow poor, and he be fallen into decay beside thee, then thou shalt relieve him, [be he] stranger or sojourner, that he may live beside thee."
03025036,3,25,36,Thou shalt take no usury nor increase of him; and thou shalt fear thy God; that thy brother may live beside thee.
03025037,3,25,37,"Thy money shalt thou not give him upon usury, nor lend him thy victuals for increase."
03025038,3,25,38,"I am Jehovah your God, who brought you forth out of the land of Egypt, to give you the land of Canaan, to be your God."
03025039,3,25,39,"And if thy brother grow poor beside thee, and be sold unto thee, thou shalt not compel him to serve as a bondservant:"
03025040,3,25,40,"as a hired servant, as a sojourner, shall he be with thee; until the year of jubilee shall he serve thee."
03025041,3,25,41,"Then shall he depart from thee, he and his children with him, and shall return unto his own family, and unto the possession of his fathers shall he return."
03025042,3,25,42,"For they are my bondmen, whom I brought forth out of the land of Egypt: they shall not be sold as [men] sell bondmen."
03025043,3,25,43,Thou shalt not rule over him with rigour; and thou shalt fear thy God.
03025044,3,25,44,"And as for thy bondman and thy handmaid whom thou shalt have -- of the nations that are round about you, of them shall ye buy bondmen and handmaids."
03025045,3,25,45,"Moreover of the children of them that dwell as sojourners with you, of them may ye buy, and of their family that is with you, which they beget in your land, and they shall be your possession."
03025046,3,25,46,"And ye shall leave them as an inheritance to your children after you, to inherit them as a possession: these may ye make your bondmen for ever; but as for your brethren, the children of Israel, ye shall not rule over one another with rigour."
03025047,3,25,47,"And if a stranger or sojourner become wealthy beside thee, and thy brother beside him grow poor, and sell himself unto the stranger, who is settled by thee, or to a scion of the stranger's family,"
03025048,3,25,48,after that he is sold there shall be right of redemption for him; one of his brethren may redeem him.
03025049,3,25,49,"Either his uncle or his uncle's son may redeem him, or one of his next relations of his family may redeem him; or if his means be sufficient, he may redeem himself."
03025050,3,25,50,"And he shall reckon with him that bought him from the year that he was sold to him unto the year of jubilee; and the price of his sale shall be according to the number of the years, according to the days of a hired servant shall he be with him."
03025051,3,25,51,"If there are yet many years, according unto them shall he return his redemption [money] out of the money that he was bought for;"
03025052,3,25,52,"and if there remain but few years unto the year of jubilee, then he shall reckon with him; according unto his [remaining] years [of service] shall he give him back his redemption [money]."
03025053,3,25,53,As a hired servant shall he be with him year by year; [his master] shall not rule with rigour over him before thine eyes.
03025054,3,25,54,"And if he be not redeemed in this manner, then he shall go out in the year of jubilee, he and his children with him."
03025055,3,25,55,For the children of Israel are servants unto me; they are my servants whom I brought forth out of the land of Egypt: I am Jehovah your God.
03026001,3,26,1,"Ye shall make yourselves no idols, neither rear you up for yourselves carved image, or statue, nor shall ye set up a figured stone in your land, to bow down unto it; for I am Jehovah your God."
03026002,3,26,2,"Ye shall observe my sabbaths, and my sanctuary shall ye reverence: I am Jehovah."
03026003,3,26,3,"If ye walk in my statutes, and observe my commandments and do them,"
03026004,3,26,4,"then I will give your rain in the season thereof, and the land shall yield its produce, and the trees of the field shall yield their fruit;"
03026005,3,26,5,"and your threshing shall reach unto the vintage, and the vintage shall reach unto the sowing-time; and ye shall eat your bread to the full, and dwell in your land securely."
03026006,3,26,6,"And I will give peace in the land, and ye shall lie down, and none shall make you afraid; and I will put away the evil beasts out of the land; and the sword shall not go through your land."
03026007,3,26,7,"And ye shall chase your enemies, and they shall fall before you by the sword;"
03026008,3,26,8,"and five of you shall chase a hundred, and a hundred of you shall put ten thousand to flight; and your enemies shall fall beside you by the sword."
03026009,3,26,9,"And I will turn my face towards you and make you fruitful, and multiply you, and establish my covenant with you."
03026010,3,26,10,"And ye shall eat old store, and clear away the old because of the new."
03026011,3,26,11,And I will set my habitation among you; and my soul shall not abhor you;
03026012,3,26,12,"and I will walk among you, and will be your God, and ye shall be to me a people."
03026013,3,26,13,"I am Jehovah your God, who brought you forth out of the land of Egypt, that ye should not be their bondmen; and I have broken the bands of your yoke, and made you walk upright."
03026014,3,26,14,"But if ye hearken not unto me, and do not all these commandments,"
03026015,3,26,15,"and if ye shall despise my statutes, and if your soul shall abhor mine ordinances, so that ye do not all my commandments, that ye break my covenant,"
