19001001,19,1,1,"Blessed is the man that walketh not in the counsel of the wicked, and standeth not in the way of sinners, and sitteth not in the seat of scorners;"
19001002,19,1,2,"But his delight is in Jehovah's law, and in his law doth he meditate day and night."
19001003,19,1,3,"And he [is] as a tree planted by brooks of water, which giveth its fruit in its season, and whose leaf fadeth not; and all that he doeth prospereth."
19001004,19,1,4,The wicked are not so; but are as the chaff which the wind driveth away.
19001005,19,1,5,"Therefore the wicked shall not stand in the judgment, nor sinners in the assembly of the righteous."
19001006,19,1,6,"For Jehovah knoweth the way of the righteous, but the way of the wicked shall perish."
19002001,19,2,1,"Why are the nations in tumultuous agitation, and [why] do the peoples meditate a vain thing?"
19002002,19,2,2,"The kings of the earth set themselves, and the princes plot together, against Jehovah and against his anointed:"
19002003,19,2,3,"Let us break their bonds asunder, and cast away their cords from us!"
19002004,19,2,4,"He that dwelleth in the heavens shall laugh, the Lord shall have them in derision."
19002005,19,2,5,"Then will he speak to them in his anger, and in his fierce displeasure will he terrify them:"
19002006,19,2,6,"And *I* have anointed my king upon Zion, the hill of my holiness."
19002007,19,2,7,"I will declare the decree: Jehovah hath said unto me, Thou art my Son; *I* this day have begotten thee."
19002008,19,2,8,"Ask of me, and I will give thee nations for an inheritance, and for thy possession the ends of the earth:"
19002009,19,2,9,"Thou shalt break them with a sceptre of iron, as a potter's vessel thou shalt dash them in pieces."
19002010,19,2,10,"And now, O kings, be ye wise, be admonished, ye judges of the earth."
19002011,19,2,11,"Serve Jehovah with fear, and rejoice with trembling."
19002012,19,2,12,"Kiss the Son, lest he be angry, and ye perish in the way, though his anger burn but a little. Blessed are all who have their trust in him."
19003001,19,3,1,"{A Psalm of David, when he fled from Absalom his son.} Jehovah, how many are they that trouble me, many they that rise up against me!"
19003002,19,3,2,"Many say of my soul, There is no salvation for him in God. Selah."
19003003,19,3,3,"But thou, Jehovah, art a shield about me; my glory, and the lifter up of my head."
19003004,19,3,4,"With my voice will I call to Jehovah, and he will answer me from the hill of his holiness. Selah."
19003005,19,3,5,"I laid me down and slept; I awaked, for Jehovah sustaineth me."
19003006,19,3,6,I will not fear for myriads of the people that have set themselves against me round about.
19003007,19,3,7,"Arise, Jehovah; save me, my God! For thou hast smitten all mine enemies upon the cheekbone, thou hast broken the teeth of the wicked."
19003008,19,3,8,Salvation is of Jehovah; thy blessing is upon thy people. Selah.
19004001,19,4,1,"{To the chief Musician. On stringed instruments. A Psalm of David.} When I call, answer me, O God of my righteousness: in pressure thou hast enlarged me; be gracious unto me, and hear my prayer."
19004002,19,4,2,"Ye sons of men, till when is my glory [to be put] to shame? [How long] will ye love vanity, will ye seek after a lie? Selah."
19004003,19,4,3,But know that Jehovah hath set apart the pious [man] for himself: Jehovah will hear when I call unto him.
19004004,19,4,4,"Be moved with anger, and sin not; meditate in your own hearts upon your bed, and be still. Selah."
19004005,19,4,5,"Offer sacrifices of righteousness, and confide in Jehovah."
19004006,19,4,6,"Many say, Who shall cause us to see good? Lift up upon us the light of thy countenance, O Jehovah."
19004007,19,4,7,"Thou hast put joy in my heart, more than in the time that their corn and their new wine was in abundance."
19004008,19,4,8,"In peace will I both lay me down and sleep; for thou, Jehovah, alone makest me to dwell in safety."
19005001,19,5,1,"{To the chief Musician. Upon Nehiloth. A Psalm of David.} Give ear to my words, O Jehovah; consider my meditation."
19005002,19,5,2,"Hearken unto the voice of my crying, my king and my God; for to thee will I pray."
19005003,19,5,3,"Jehovah, in the morning shalt thou hear my voice; in the morning will I address myself to thee, and will look up."
19005004,19,5,4,For thou art not a ùGod that hath pleasure in wickedness; evil shall not sojourn with thee.
19005005,19,5,5,Insolent fools shall not stand before thine eyes; thou hatest all workers of iniquity.
19005006,19,5,6,Thou wilt destroy them that speak lies: Jehovah abhorreth a man of blood and deceit.
19005007,19,5,7,"But as for me, in the greatness of thy loving-kindness will I enter thy house; I will bow down toward the temple of thy holiness in thy fear."
19005008,19,5,8,"Lead me, Jehovah, in thy righteousness, because of my foes; make thy way plain before me."
19005009,19,5,9,"For there is no certainty in their mouth; their inward part is perversion, their throat is an open sepulchre; they flatter with their tongue."
19005010,19,5,10,"Bring guilt upon them, O God; let them fall by their own counsels: drive them out in the multitude of their transgressions, for they have rebelled against thee."
19005011,19,5,11,"And all that trust in thee shall rejoice: for ever shall they shout joyously, and thou wilt protect them; and they that love thy name shall exult in thee."
19005012,19,5,12,"For thou, Jehovah, wilt bless the righteous [man]; with favour wilt thou surround him as [with] a shield."
19006001,19,6,1,"{To the chief Musician. On stringed instruments, upon Sheminith. A Psalm of David.} Jehovah, rebuke me not in thine anger, and chasten me not in thy hot displeasure."
19006002,19,6,2,"Be gracious unto me, Jehovah, for I am withered; Jehovah, heal me, for my bones tremble."
19006003,19,6,3,"And my soul trembleth exceedingly: and thou, Jehovah, till how long?"
19006004,19,6,4,"Return, Jehovah, free my soul; save me for thy loving-kindness' sake."
19006005,19,6,5,For in death there is no remembrance of thee; in Sheol who shall give thanks unto thee?
19006006,19,6,6,I am wearied with my groaning; all the night make I my bed to swim; I dissolve my couch with my tears.
19006007,19,6,7,Mine eye wasteth away through grief; it hath grown old because of all mine oppressors.
19006008,19,6,8,"Depart from me, all ye workers of iniquity; for Jehovah hath heard the voice of my weeping."
19006009,19,6,9,Jehovah hath heard my supplication; Jehovah receiveth my prayer.
19006010,19,6,10,"All mine enemies shall be ashamed and tremble exceedingly; they will turn, they will be ashamed suddenly."
19007001,19,7,1,"{Shiggaion of David, which he sang to Jehovah, concerning the words of Cush the Benjaminite.} Jehovah my God, in thee have I trusted: save me from all my pursuers, and deliver me;"
19007002,19,7,2,"Lest he tear my soul like a lion, crushing it while there is no deliverer."
19007003,19,7,3,"Jehovah my God, if I have done this, if there be iniquity in my hands;"
19007004,19,7,4,If I have rewarded evil to him that was at peace with me; (indeed I have freed him that without cause oppressed me;)
19007005,19,7,5,"Let the enemy pursue after my soul, and take [it], and let him tread down my life to the earth, and lay my glory in the dust. Selah."
19007006,19,7,6,"Arise, Jehovah, in thine anger; lift thyself up against the raging of mine oppressors, and awake for me: thou hast commanded judgment."
19007007,19,7,7,And the assembly of the peoples shall encompass thee; and for their sakes return thou on high.
19007008,19,7,8,"Jehovah shall minister judgment to the peoples. Judge me, Jehovah, according to my righteousness, and according to mine integrity which is in me."
19007009,19,7,9,"Oh let the wrong of the wicked come to an end, and establish thou the righteous [man]; even thou that triest the hearts and reins, the righteous God."
19007010,19,7,10,"My shield is with God, who saveth the upright in heart."
19007011,19,7,11,"God is a righteous judge, and a ùGod who is indignant all the day."
19007012,19,7,12,"If one turn not, he will sharpen his sword; he hath bent his bow and made it ready,"
19007013,19,7,13,And he hath prepared for him instruments of death; his arrows hath he made burning.
19007014,19,7,14,"Behold, he travaileth with iniquity, yea, he hath conceived mischief, and brought forth falsehood:"
19007015,19,7,15,"He digged a pit, and hollowed it out, and is fallen into the hole that he made."
19007016,19,7,16,"His mischief shall return upon his own head, and his violence shall come down upon his own pate."
19007017,19,7,17,"I will praise Jehovah according to his righteousness, and will sing forth the name of Jehovah the Most High."
19008001,19,8,1,"{To the chief Musician. Upon the Gittith. A Psalm of David.} Jehovah our Lord, how excellent is thy name in all the earth! who hast set thy majesty above the heavens."
19008002,19,8,2,"Out of the mouth of babes and sucklings hast thou established praise because of thine adversaries, to still the enemy and the avenger."
19008003,19,8,3,"When I see thy heavens, the work of thy fingers, the moon and stars, which thou hast established;"
19008004,19,8,4,"What is man, that thou art mindful of him? and the son of man, that thou visitest him?"
19008005,19,8,5,"Thou hast made him a little lower than the angels, and hast crowned him with glory and splendour."
19008006,19,8,6,Thou hast made him to rule over the works of thy hands; thou hast put everything under his feet:
19008007,19,8,7,"Sheep and oxen, all of them, and also the beasts of the field;"
19008008,19,8,8,"The fowl of the heavens, and the fishes of the sea, [whatever] passeth through the paths of the seas."
19008009,19,8,9,"Jehovah our Lord, how excellent is thy name in all the earth!"
19009001,19,9,1,{To the chief Musician. Upon Muthlabben. A Psalm of David.} I will praise Jehovah with my whole heart; I will recount all thy marvellous works.
19009002,19,9,2,"I will be glad and rejoice in thee; I will sing forth thy name, O Most High."
19009003,19,9,3,"When mine enemies turned back, they stumbled and perished at thy presence:"
19009004,19,9,4,"For thou hast maintained my right and my cause. Thou sittest on the throne, judging righteously."
19009005,19,9,5,"Thou hast rebuked the nations, thou hast destroyed the wicked; thou hast put out their name for ever and ever."
19009006,19,9,6,"O enemy! destructions are ended for ever. -- Thou hast also destroyed cities, even the remembrance of them hath perished."
19009007,19,9,7,But Jehovah sitteth for ever; he hath ordained his throne for judgment.
19009008,19,9,8,And it is he that will judge the world with righteousness; he shall execute judgment upon the peoples with equity.
19009009,19,9,9,"And Jehovah will be a refuge to the oppressed one, a refuge in times of distress."
19009010,19,9,10,"And they that know thy name will confide in thee; for thou, Jehovah, hast not forsaken them that seek thee."
19009011,19,9,11,Sing psalms to Jehovah who dwelleth in Zion; tell among the peoples his doings.
19009012,19,9,12,"For when he maketh inquisition for blood, he remembereth them; the cry of the afflicted ones hath he not forgotten."
19009013,19,9,13,"Be gracious unto me, O Jehovah; consider mine affliction from them that hate me, lifting me up from the gates of death:"
19009014,19,9,14,That I may declare all thy praise in the gates of the daughter of Zion. I will be joyful in thy salvation.
19009015,19,9,15,The nations are sunk down in the pit [that] they made; in the net that they hid is their own foot taken.
19009016,19,9,16,Jehovah is known [by] the judgment he hath executed: the wicked is ensnared in the work of his own hands. Higgaion. Selah.
19009017,19,9,17,"The wicked shall be turned into Sheol, all the nations that forget God."
19009018,19,9,18,For the needy one shall not be forgotten alway; the hope of the meek shall not perish for ever.
19009019,19,9,19,"Arise, Jehovah; let not man prevail: let the nations be judged in thy sight."
19009020,19,9,20,"Put them in fear, Jehovah: that the nations may know themselves to be but men. Selah."
19010001,19,10,1,"Why, Jehovah, standest thou afar off? [Why] hidest thou thyself in times of distress?"
19010002,19,10,2,"The wicked, in his pride, doth hotly pursue the afflicted. They shall be taken in the devices that they have imagined."
19010003,19,10,3,"For the wicked boasteth of his soul's desire, and he blesseth the covetous; he contemneth Jehovah."
19010004,19,10,4,"The wicked [saith], in the haughtiness of his countenance, He doth not search out: all his thoughts are, There is no God!"
19010005,19,10,5,"His ways always succeed; thy judgments are far above out of his sight; [as for] all his adversaries, he puffeth at them."
19010006,19,10,6,"He saith in his heart, I shall not be moved; from generation to generation I shall be in no adversity."
19010007,19,10,7,"His mouth is full of cursing, and deceit, and oppression; under his tongue is mischief and iniquity."
19010008,19,10,8,He sitteth in the lurking-places of the villages; in the secret places doth he slay the innocent: his eyes watch for the wretched.
19010009,19,10,9,"He lieth in wait secretly, like a lion in his thicket; he lieth in wait to catch the afflicted: he doth catch the afflicted, drawing him into his net."
19010010,19,10,10,"He croucheth, he boweth down, that the wretched may fall by his strong ones."
19010011,19,10,11,"He saith in his heart, ùGod hath forgotten, he hideth his face, he will never see [it]."
19010012,19,10,12,"Arise, Jehovah; O ùGod, lift up thy hand: forget not the afflicted."
19010013,19,10,13,"Wherefore doth the wicked contemn God? He hath said in his heart, Thou wilt not require [it]."
19010014,19,10,14,"Thou hast seen [it], for thou thyself beholdest trouble and vexation, to requite by thy hand. The wretched committeth himself unto thee; thou hast been the helper of the fatherless."
19010015,19,10,15,"Break thou the arm of the wicked, and as for the evil man, seek out his wickedness [till] thou find none."
19010016,19,10,16,Jehovah is King for ever and ever: the nations have perished out of his land.
19010017,19,10,17,"Jehovah, thou hast heard the desire of the meek, thou hast established their heart: thou causest thine ear to hear,"
19010018,19,10,18,"To do justice to the fatherless and the oppressed one, that the man of the earth may terrify no more."
19011001,19,11,1,"{To the chief Musician. [A Psalm] of David.} In Jehovah have I put my trust: how say ye to my soul, Flee [as] a bird to your mountain?"
19011002,19,11,2,"For behold, the wicked bend the bow, they make ready their arrow upon the string, that they may in darkness shoot at the upright in heart."
19011003,19,11,3,"If the foundations be destroyed, what shall the righteous do?"
19011004,19,11,4,"Jehovah [is] in the temple of his holiness; Jehovah, -- his throne is in the heavens: his eyes behold, his eyelids try the children of men."
19011005,19,11,5,"Jehovah trieth the righteous one; but the wicked, and him that loveth violence, his soul hateth."
19011006,19,11,6,"Upon the wicked he shall rain snares, fire and brimstone; and scorching wind shall be the portion of their cup."
19011007,19,11,7,"For righteous is Jehovah; he loveth righteousness, his countenance doth behold the upright."
19012001,19,12,1,"{To the chief Musician. Upon Sheminith. A Psalm of David.} Save, Jehovah, for the godly man is gone; for the faithful have failed from among the children of men."
19012002,19,12,2,"They speak falsehood every one with his neighbour: [with] flattering lip, with a double heart, do they speak."
19012003,19,12,3,"Jehovah will cut off all flattering lips, the tongue that speaketh proud things,"
19012004,19,12,4,"Who have said, With our tongue will we prevail, our lips are our own: who [is] lord over us?"
19012005,19,12,5,"Because of the oppression of the afflicted, because of the sighing of the needy, now will I arise, saith Jehovah, I will set [him] in safety, at whom they puff."
19012006,19,12,6,"The words of Jehovah are pure words, silver tried in the furnace of earth, purified seven times."
19012007,19,12,7,"Thou, Jehovah, wilt keep them, thou wilt preserve them from this generation for ever."
19012008,19,12,8,"The wicked walk about on every side, when vileness is exalted among the children of men."
19013001,19,13,1,"{To the chief Musician. A Psalm of David.} How long, Jehovah, wilt thou forget me for ever? how long wilt thou hide thy face from me?"
19013002,19,13,2,"How long shall I take counsel in my soul, with sorrow in my heart daily? how long shall mine enemy be exalted over me?"
19013003,19,13,3,"Consider, answer me, O Jehovah my God! lighten mine eyes, lest I sleep the [sleep of] death;"
19013004,19,13,4,"Lest mine enemy say, I have prevailed against him! [lest] mine adversaries be joyful when I am moved."
19013005,19,13,5,"As for me, I have confided in thy loving-kindness; my heart shall be joyful in thy salvation."
19013006,19,13,6,"I will sing unto Jehovah, for he hath dealt bountifully with me."
19014001,19,14,1,"{To the chief Musician. [A Psalm] of David.} The fool hath said in his heart, There is no God. They have corrupted themselves, they have done abominable works: there is none that doeth good."
19014002,19,14,2,"Jehovah looked down from the heavens upon the children of men, to see if there were any that did understand, that did seek God."
19014003,19,14,3,"They have all gone aside, they are together become corrupt: there is none that doeth good, not even one."
19014004,19,14,4,"Have all the workers of iniquity no knowledge, eating up my people [as] they eat bread? They call not upon Jehovah."
19014005,19,14,5,There were they in great fear; for God is in the generation of the righteous.
19014006,19,14,6,"Ye have shamed the counsel of the afflicted, because Jehovah [was] his refuge."
19014007,19,14,7,"Oh that the salvation of Israel were come out of Zion! When Jehovah turneth again the captivity of his people, Jacob shall be glad, Israel shall rejoice."
19015001,19,15,1,"{A Psalm of David.} Jehovah, who shall sojourn in thy tent? who shall dwell in the hill of thy holiness?"
19015002,19,15,2,"He that walketh uprightly, and worketh righteousness, and speaketh the truth from his heart."
19015003,19,15,3,"[He that] slandereth not with his tongue, doeth not evil to his companion, nor taketh up a reproach against his neighbour;"
19015004,19,15,4,"In whose eyes the depraved person is contemned, and who honoureth them that fear Jehovah; who, if he have sworn to his own hurt, changeth it not;"
19015005,19,15,5,"[He that] putteth not out his money to usury, nor taketh reward against the innocent. He that doeth these [things] shall never be moved."
19016001,19,16,1,"{Michtam of David.} Preserve me, O ùGod: for I trust in thee."
19016002,19,16,2,"Thou [my soul] hast said to Jehovah, Thou art the Lord: my goodness [extendeth] not to thee; --"
19016003,19,16,3,"To the saints that are on the earth, and to the excellent [thou hast said], In them is all my delight."
19016004,19,16,4,"Their sorrows shall be multiplied that hasten after another: their drink-offerings of blood will I not offer, and I will not take up their names into my lips."
19016005,19,16,5,Jehovah is the portion of mine inheritance and of my cup: thou maintainest my lot.
19016006,19,16,6,"The lines are fallen unto me in pleasant places; yea, I have a goodly heritage."
19016007,19,16,7,"I will bless Jehovah, who giveth me counsel; even in the nights my reins instruct me."
19016008,19,16,8,"I have set Jehovah continually before me; because [he is] at my right hand, I shall not be moved."
19016009,19,16,9,"Therefore my heart rejoiceth, and my glory exulteth; my flesh moreover shall dwell in hope."
19016010,19,16,10,"For thou wilt not leave my soul to Sheol, neither wilt thou allow thy Holy One to see corruption."
19016011,19,16,11,Thou wilt make known to me the path of life: thy countenance is fulness of joy; at thy right hand are pleasures for evermore.
19017001,19,17,1,"{A Prayer of David.} Hear the right, O Jehovah, attend unto my cry; give ear unto my prayer, which is not out of feigned lips."
19017002,19,17,2,"Let my judgment come forth from thy presence, let thine eyes regard equity."
19017003,19,17,3,"Thou hast proved my heart, thou hast visited me by night; thou hast tried me, thou hast found nothing: my thought goeth not beyond my word."
19017004,19,17,4,"Concerning the works of men, by the word of thy lips I have kept from the paths of the violent [man]."
19017005,19,17,5,"When thou holdest my goings in thy paths, my footsteps slip not."
19017006,19,17,6,"I have called upon thee, for thou answerest me, O ùGod. Incline thine ear unto me, hear my speech."
19017007,19,17,7,"Shew wondrously thy loving-kindnesses, O thou that savest by thy right hand them that trust [in thee] from those that rise up [against them]."
19017008,19,17,8,"Keep me as the apple of the eye, hide me under the shadow of thy wings,"
19017009,19,17,9,"From the wicked that destroy me, my deadly enemies, who compass me about."
19017010,19,17,10,They are enclosed in their own fat; with their mouth they speak proudly.
19017011,19,17,11,"They have now encompassed us in our steps; their eyes have they set, bowing down to the earth."
19017012,19,17,12,"He is like a lion that is greedy of its prey, and as a young lion lurking in secret places."
19017013,19,17,13,"Arise, Jehovah, anticipate him, cast him down: deliver my soul from the wicked, thy sword;"
19017014,19,17,14,"From men [who are] thy hand, O Jehovah, from men of this age: their portion is in [this] life, and their belly thou fillest with thy hid [treasure]; they have their fill of sons, and leave the rest of their [substance] to their children."
19017015,19,17,15,"As for me, I will behold thy face in righteousness; I shall be satisfied, when I awake, with thy likeness."
19018001,19,18,1,"{To the chief Musician. [A Psalm] of David, the servant of Jehovah, who spoke to Jehovah the words of this song in the day that Jehovah had delivered him out of the hand of all his enemies and out of the hand of Saul. And he said,} I will love thee, O Jehovah, my strength."
19018002,19,18,2,"Jehovah is my rock, and my fortress, and my deliverer; my ùGod, my rock, in whom I will trust; my shield, and the horn of my salvation, my high tower."
19018003,19,18,3,"I will call upon Jehovah, who is to be praised: so shall I be saved from mine enemies."
19018004,19,18,4,"The bands of death encompassed me, and torrents of Belial made me afraid."
19018005,19,18,5,"The bands of Sheol surrounded me, the cords of death encountered me."
19018006,19,18,6,"In my distress I called upon Jehovah, and I cried out to my God; he heard my voice out of his temple, and my cry came before him, into his ears."
19018007,19,18,7,"Then the earth shook and quaked, and the foundations of the mountains trembled and shook, because he was wroth."
19018008,19,18,8,"There went up a smoke out of his nostrils, and fire out of his mouth devoured: coals burned forth from it."
19018009,19,18,9,"And he bowed the heavens, and came down; and darkness was under his feet."
19018010,19,18,10,"And he rode upon a cherub and did fly; yea, he flew fast upon the wings of the wind."
19018011,19,18,11,"He made darkness his secret place, his tent round about him: darkness of waters, thick clouds of the skies."
19018012,19,18,12,From the brightness before him his thick clouds passed forth: hail and coals of fire.
19018013,19,18,13,"And Jehovah thundered in the heavens, and the Most High uttered his voice: hail and coals of fire."
19018014,19,18,14,"And he sent his arrows, and scattered [mine enemies]; and he shot forth lightnings, and discomfited them."
19018015,19,18,15,"And the beds of the waters were seen, and the foundations of the world were uncovered at thy rebuke, Jehovah, at the blast of the breath of thy nostrils."
19018016,19,18,16,"He reached forth from above, he took me, he drew me out of great waters:"
19018017,19,18,17,"He delivered me from my strong enemy, and from them that hated me; for they were mightier than I."
19018018,19,18,18,"They encountered me in the day of my calamity, but Jehovah was my stay."
19018019,19,18,19,"And he brought me forth into a large place; he delivered me, because he delighted in me."
19018020,19,18,20,Jehovah hath rewarded me according to my righteousness; according to the cleanness of my hands hath he recompensed me.
19018021,19,18,21,"For I have kept the ways of Jehovah, and have not wickedly departed from my God."
19018022,19,18,22,"For all his ordinances were before me, and I did not put away his statutes from me;"
19018023,19,18,23,"And I was upright with him, and kept myself from mine iniquity."
19018024,19,18,24,"And Jehovah hath recompensed me according to my righteousness, according to the cleanness of my hands in his sight."
19018025,19,18,25,With the gracious thou dost shew thyself gracious; with the upright man thou dost shew thyself upright;
19018026,19,18,26,With the pure thou dost shew thyself pure; and with the perverse thou dost shew thyself contrary.
19018027,19,18,27,For it is thou that savest the afflicted people; but the haughty eyes wilt thou bring down.
19018028,19,18,28,For it is thou that makest my lamp to shine: Jehovah my God enlighteneth my darkness.
19018029,19,18,29,For by thee I have run through a troop; and by my God have I leaped over a wall.
19018030,19,18,30,"As for ùGod, his way is perfect; the word of Jehovah is tried: he is a shield to all that trust in him."
19018031,19,18,31,For who is +God save Jehovah? and who is a rock if not our God?
19018032,19,18,32,"The ùGod who girdeth me with strength, and maketh my way perfect,"
19018033,19,18,33,"Who maketh my feet like hinds' [feet], and setteth me upon my high places;"
19018034,19,18,34,"Who teacheth my hands to war, and mine arms bend a bow of brass;"
