19107030,19,107,30,And they rejoice because they are quiet; and he bringeth them unto their desired haven.
19107031,19,107,31,"Let them give thanks unto Jehovah for his loving-kindness, and for his wondrous works to the children of men;"
19107032,19,107,32,"Let them exalt him also in the congregation of the people, and praise him in the session of the elders."
19107033,19,107,33,"He maketh rivers into a wilderness, and water-springs into dry ground;"
19107034,19,107,34,"A fruitful land into a plain of salt, for the wickedness of them that dwell therein."
19107035,19,107,35,"He maketh the wilderness into a pool of water, and the dry land into water-springs;"
19107036,19,107,36,"And there he maketh the hungry to dwell, and they establish a city of habitation;"
19107037,19,107,37,"And sow fields, and plant vineyards, which yield fruits of increase;"
19107038,19,107,38,"And he blesseth them, so that they are multiplied greatly; and he suffereth not their cattle to decrease."
19107039,19,107,39,"And they are diminished and brought low, through oppression, adversity, and sorrow:"
19107040,19,107,40,"He poureth contempt upon nobles, and causeth them to wander in a pathless waste;"
19107041,19,107,41,"But he secureth the needy one on high from affliction, and maketh [him] families like flocks."
19107042,19,107,42,"The upright shall see it, and rejoice; and all unrighteousness shall stop its mouth."
19107043,19,107,43,"Whoso is wise, let him observe these things, and let them understand the loving-kindnesses of Jehovah."
19108001,19,108,1,"{A Song, a Psalm of David.} My heart is fixed, O God: I will sing, yea, I will sing psalms, even [with] my glory."
19108002,19,108,2,"Awake, lute and harp: I will wake the dawn."
19108003,19,108,3,"I will give thee thanks among the peoples, O Jehovah; of thee will I sing psalms among the nations:"
19108004,19,108,4,"For thy loving-kindness is great above the heavens, and thy truth is unto the clouds."
19108005,19,108,5,"Be thou exalted above the heavens, O God, and thy glory above all the earth."
19108006,19,108,6,"That thy beloved ones may be delivered: save with thy right hand, and answer me."
19108007,19,108,7,"God hath spoken in his holiness: I will exult, I will divide Shechem, and mete out the valley of Succoth."
19108008,19,108,8,"Gilead is mine, Manasseh is mine, and Ephraim is the strength of my head; Judah is my law-giver;"
19108009,19,108,9,Moab is my wash-pot; upon Edom will I cast my sandal; over Philistia will I shout aloud.
19108010,19,108,10,Who will bring me into the strong city? who will lead me unto Edom?
19108011,19,108,11,"[Wilt] not [thou], O God, who didst cast us off? and didst not go forth, O God, with our armies?"
19108012,19,108,12,Give us help from trouble; for vain is man's deliverance.
19108013,19,108,13,Through God we shall do valiantly; and he it is that will tread down our adversaries.
19109001,19,109,1,"{To the chief Musician. Of David. A Psalm.} O God of my praise, be not silent:"
19109002,19,109,2,"For the mouth of the wicked [man] and the mouth of deceit are opened against me: they have spoken against me with a lying tongue,"
19109003,19,109,3,And with words of hatred have they encompassed me; and they fight against me without a cause.
19109004,19,109,4,For my love they are mine adversaries; but I [give myself unto] prayer.
19109005,19,109,5,"And they have rewarded me evil for good, and hatred for my love."
19109006,19,109,6,"Set a wicked [man] over him, and let [the] adversary stand at his right hand;"
19109007,19,109,7,"When he shall be judged, let him go out guilty, and let his prayer become sin;"
19109008,19,109,8,"Let his days be few, let another take his office;"
19109009,19,109,9,"Let his sons be fatherless, and his wife a widow;"
19109010,19,109,10,"Let his sons be vagabonds and beg, and let them seek [their bread] far from their desolate places;"
19109011,19,109,11,"Let the usurer cast the net over all that he hath, and let strangers despoil his labour;"
19109012,19,109,12,"Let there be none to extend kindness unto him, neither let there be any to favour his fatherless children;"
19109013,19,109,13,Let his posterity be cut off; in the generation following let their name be blotted out:
19109014,19,109,14,"Let the iniquity of his fathers be remembered with Jehovah, and let not the sin of his mother be blotted out;"
19109015,19,109,15,"Let them be before Jehovah continually, that he may cut off the memory of them from the earth:"
19109016,19,109,16,"Because he remembered not to shew kindness, but persecuted the afflicted and needy man, and the broken in heart, to slay him."
19109017,19,109,17,And he loved cursing; so let it come unto him. And he delighted not in blessing; and let it be far from him.
19109018,19,109,18,"And he clothed himself with cursing like his vestment; so let it come into his bowels like water, and like oil into his bones;"
19109019,19,109,19,"Let it be unto him as a garment with which he covereth himself, and for a girdle wherewith he is constantly girded."
19109020,19,109,20,"Let this be the reward of mine adversaries from Jehovah, and of them that speak evil against my soul."
19109021,19,109,21,"But do *thou* for me, Jehovah, Lord, for thy name's sake; because thy loving-kindness is good, deliver me:"
19109022,19,109,22,"For I am afflicted and needy, and my heart is wounded within me."
19109023,19,109,23,I am gone like a shadow when it lengtheneth; I am tossed about like the locust;
19109024,19,109,24,"My knees are failing through fasting, and my flesh hath lost its fatness;"
19109025,19,109,25,And I am become a reproach unto them; [when] they look upon me they shake their heads.
19109026,19,109,26,"Help me, Jehovah my God; save me according to thy loving-kindness:"
19109027,19,109,27,"That they may know that this is thy hand; that *thou*, Jehovah, hast done it."
19109028,19,109,28,"Let *them* curse, but bless *thou*; when they rise up, let them be ashamed, and let thy servant rejoice."
19109029,19,109,29,"Let mine adversaries be clothed with confusion, and let them cover themselves with their shame as with a mantle."
19109030,19,109,30,"I will greatly celebrate Jehovah with my mouth; yea, I will praise him among the multitude."
19109031,19,109,31,"For he standeth at the right hand of the needy, to save him from those that judge his soul."
19110001,19,110,1,"{Psalm of David.} Jehovah said unto my Lord, Sit at my right hand, until I put thine enemies [as] footstool of thy feet."
19110002,19,110,2,Jehovah shall send the sceptre of thy might out of Zion: rule in the midst of thine enemies.
19110003,19,110,3,"Thy people shall be willing in the day of thy power, in holy splendour: from the womb of the morning [shall come] to thee the dew of thy youth."
19110004,19,110,4,"Jehovah hath sworn, and will not repent, Thou art priest for ever after the order of Melchisedek."
19110005,19,110,5,The Lord at thy right hand will smite through kings in the day of his anger.
19110006,19,110,6,He shall judge among the nations; he shall fill [all places] with dead bodies; he shall smite through the head over a great country.
19110007,19,110,7,He shall drink of the brook in the way; therefore shall he lift up the head.
19111001,19,111,1,"Hallelujah! I will celebrate Jehovah with [my] whole heart, in the council of the upright, and in the assembly."
19111002,19,111,2,Great are the works of Jehovah; sought out of all that delight in them.
19111003,19,111,3,"His work is majesty and splendour, and his righteousness abideth for ever."
19111004,19,111,4,He hath made his wonders to be remembered: Jehovah is gracious and merciful.
19111005,19,111,5,He hath given meat unto them that fear him; he is ever mindful of his covenant.
19111006,19,111,6,"He hath shewn his people the power of his works, to give them the heritage of the nations."
19111007,19,111,7,The works of his hands are truth and judgment; all his precepts are faithful:
19111008,19,111,8,"Maintained for ever and ever, done in truth and uprightness."
19111009,19,111,9,He sent deliverance unto his people; he hath commanded his covenant for ever: holy and terrible is his name.
19111010,19,111,10,The fear of Jehovah is the beginning of wisdom; a good understanding have all they that do [his precepts]: his praise abideth for ever.
19112001,19,112,1,"Hallelujah! Blessed is the man that feareth Jehovah, that delighteth greatly in his commandments."
19112002,19,112,2,His seed shall be mighty in the land; the generation of the upright shall be blessed.
19112003,19,112,3,Wealth and riches [shall be] in his house; and his righteousness abideth for ever.
19112004,19,112,4,"Unto the upright there ariseth light in the darkness; he is gracious, and merciful, and righteous."
19112005,19,112,5,It is well with the man that is gracious and lendeth; he will sustain his cause in judgment.
19112006,19,112,6,For he shall not be moved for ever: the righteous shall be in everlasting remembrance.
19112007,19,112,7,He shall not be afraid of evil tidings; his heart is fixed confiding in Jehovah;
19112008,19,112,8,"His heart is maintained, he is not afraid, until he see [his desire] upon his oppressors."
19112009,19,112,9,"He scattereth abroad, he giveth to the needy; his righteousness abideth for ever: his horn shall be exalted with honour."
19112010,19,112,10,"The wicked [man] shall see [it] and be vexed; he shall gnash with his teeth, and melt away: the desire of the wicked shall perish."
19113001,19,113,1,"Hallelujah! Praise, ye servants of Jehovah, praise the name of Jehovah."
19113002,19,113,2,"Blessed be the name of Jehovah, from this time forth and for evermore!"
19113003,19,113,3,"From the rising of the sun unto the going down of the same, let Jehovah's name be praised."
19113004,19,113,4,"Jehovah is high above all nations, his glory above the heavens."
19113005,19,113,5,"Who is like unto Jehovah our God, who hath placed his dwelling on high;"
19113006,19,113,6,Who humbleth himself to look on the heavens and on the earth?
19113007,19,113,7,"He raiseth up the poor out of the dust; from the dung-hill he lifteth up the needy,"
19113008,19,113,8,"To set [him] among nobles, among the nobles of his people."
19113009,19,113,9,"He maketh the barren woman to keep house, [as] a joyful mother of sons. Hallelujah!"
19114001,19,114,1,"When Israel went out of Egypt, the house of Jacob from a people of strange language,"
19114002,19,114,2,"Judah was his sanctuary, Israel his dominion."
19114003,19,114,3,"The sea saw it and fled, the Jordan turned back;"
19114004,19,114,4,"The mountains skipped like rams, the hills like lambs."
19114005,19,114,5,"What ailed thee, thou sea, that thou fleddest? thou Jordan, that thou turnedst back?"
19114006,19,114,6,"Ye mountains, that ye skipped like rams? ye hills, like lambs?"
19114007,19,114,7,"Tremble, thou earth, at the presence of the Lord, at the presence of the +God of Jacob,"
19114008,19,114,8,"Who turned the rock into a pool of water, the flint into a fountain of waters."
19115001,19,115,1,"Not unto us, O Jehovah, not unto us, but unto thy name give glory, for thy loving-kindness and for thy truth's sake."
19115002,19,115,2,"Wherefore should the nations say, Where then is their God?"
19115003,19,115,3,But our God is in the heavens: he hath done whatsoever he pleased.
19115004,19,115,4,"Their idols are silver and gold, the work of men's hands:"
19115005,19,115,5,"They have a mouth, and they speak not; eyes have they, and they see not;"
19115006,19,115,6,"They have ears, and they hear not; a nose have they, and they smell not;"
19115007,19,115,7,"They have hands, and they handle not; feet have they, and they walk not; they give no sound through their throat."
19115008,19,115,8,"They that make them are like unto them, -- every one that confideth in them."
19115009,19,115,9,"O Israel, confide thou in Jehovah: he is their help and their shield."
19115010,19,115,10,"House of Aaron, confide in Jehovah: he is their help and their shield."
19115011,19,115,11,"Ye that fear Jehovah, confide in Jehovah: he is their help and their shield."
19115012,19,115,12,"Jehovah hath been mindful of us: he will bless, he will bless the house of Israel; he will bless the house of Aaron;"
19115013,19,115,13,"He will bless them that fear Jehovah, both the small and the great."
19115014,19,115,14,"Jehovah will add unto you more, unto you and unto your children."
19115015,19,115,15,"Ye are blessed of Jehovah, who made the heavens and the earth."
19115016,19,115,16,"The heavens are the heavens of Jehovah, but the earth hath he given to the children of men."
19115017,19,115,17,"The dead praise not Jah, neither any that go down into silence;"
19115018,19,115,18,But *we* will bless Jah from this time forth and for evermore. Hallelujah!
19116001,19,116,1,"I love Jehovah, for he hath heard my voice [and] my supplications;"
19116002,19,116,2,"For he hath inclined his ear unto me, and I will call upon him during [all] my days."
19116003,19,116,3,"The bands of death encompassed me, and the anguish of Sheol took hold of me; I found trouble and sorrow:"
19116004,19,116,4,"Then called I upon the name of Jehovah: I beseech thee, Jehovah, deliver my soul."
19116005,19,116,5,Gracious is Jehovah and righteous; and our God is merciful.
19116006,19,116,6,"Jehovah keepeth the simple: I was brought low, and he saved me."
19116007,19,116,7,"Return unto thy rest, O my soul; for Jehovah hath dealt bountifully with thee."
19116008,19,116,8,"For thou hast delivered my soul from death, mine eyes from tears, my feet from falling."
19116009,19,116,9,I will walk before Jehovah in the land of the living.
19116010,19,116,10,"I believed, therefore have I spoken. As for me, I was greatly afflicted."
19116011,19,116,11,"I said in my haste, All men are liars."
19116012,19,116,12,"What shall I render unto Jehovah, [for] all his benefits toward me?"
19116013,19,116,13,"I will take the cup of salvation, and call upon the name of Jehovah."
19116014,19,116,14,"I will perform my vows unto Jehovah, yea, before all his people."
19116015,19,116,15,Precious in the sight of Jehovah is the death of his saints.
19116016,19,116,16,"Yea, Jehovah! for I am thy servant; I am thy servant, the son of thy handmaid: thou hast loosed my bonds."
19116017,19,116,17,"I will offer to thee the sacrifice of thanksgiving, and will call upon the name of Jehovah."
19116018,19,116,18,"I will perform my vows unto Jehovah, yea, before all his people,"
19116019,19,116,19,"In the courts of Jehovah's house, in the midst of thee, O Jerusalem. Hallelujah!"
19117001,19,117,1,"Praise Jehovah, all ye nations; laud him, all ye peoples;"
19117002,19,117,2,"For his loving-kindness is great toward us, and the truth of Jehovah [endureth] for ever. Hallelujah!"
19118001,19,118,1,Give ye thanks unto Jehovah; for he is good; for his loving-kindness [endureth] for ever.
19118002,19,118,2,"Oh let Israel say, that his loving-kindness [endureth] for ever."
19118003,19,118,3,"Oh let the house of Aaron say, that his loving-kindness [endureth] for ever."
19118004,19,118,4,"Oh let them that fear Jehovah say, that his loving-kindness [endureth] for ever."
19118005,19,118,5,I called upon Jah in distress; Jah answered me [and set me] in a large place.
19118006,19,118,6,"Jehovah is for me, I will not fear; what can man do unto me?"
19118007,19,118,7,Jehovah is for me among them that help me; and I shall see [my desire] upon them that hate me.
19118008,19,118,8,It is better to trust in Jehovah than to put confidence in man;
19118009,19,118,9,It is better to trust in Jehovah than to put confidence in nobles.
19118010,19,118,10,All nations encompassed me; but in the name of Jehovah have I destroyed them.
19118011,19,118,11,"They encompassed me, yea, encompassed me; but in the name of Jehovah have I destroyed them."
19118012,19,118,12,They encompassed me like bees; they are quenched as the fire of thorns: for in the name of Jehovah have I destroyed them.
19118013,19,118,13,Thou hast thrust hard at me that I might fall; but Jehovah helped me.
19118014,19,118,14,"My strength and song is Jah, and he is become my salvation."
19118015,19,118,15,The voice of triumph and salvation is in the tents of the righteous: the right hand of Jehovah doeth valiantly;
19118016,19,118,16,"The right hand of Jehovah is exalted, the right hand of Jehovah doeth valiantly."
19118017,19,118,17,"I shall not die, but live, and declare the works of Jah."
19118018,19,118,18,Jah hath chastened me sore; but he hath not given me over unto death.
19118019,19,118,19,Open to me the gates of righteousness: I will enter into them; Jah will I praise.
19118020,19,118,20,This is the gate of Jehovah: the righteous shall enter therein.
19118021,19,118,21,"I will give thee thanks, for thou hast answered me, and art become my salvation."
19118022,19,118,22,[The] stone which the builders rejected hath become the head of the corner:
19118023,19,118,23,This is of Jehovah; it is wonderful in our eyes.
19118024,19,118,24,This is the day that Jehovah hath made; we will rejoice and be glad in it.
19118025,19,118,25,"Oh save, Jehovah, I beseech thee; Jehovah, I beseech thee, oh send prosperity!"
19118026,19,118,26,Blessed be he that cometh in the name of Jehovah. We have blessed you out of the house of Jehovah.
19118027,19,118,27,"Jehovah is ùGod, and he hath given us light: bind the sacrifice with cords, -- up to the horns of the altar."
19118028,19,118,28,"Thou art my ùGod, and I will give thee thanks; my God, I will exalt thee."
19118029,19,118,29,Give ye thanks unto Jehovah; for he is good; for his loving-kindness [endureth] for ever.
19119001,19,119,1,"ALEPH. Blessed are the perfect in the way, who walk in the law of Jehovah."
19119002,19,119,2,"Blessed are they that observe his testimonies, that seek him with the whole heart;"
19119003,19,119,3,Who also do no unrighteousness: they walk in his ways.
19119004,19,119,4,"Thou hast enjoined thy precepts, to be kept diligently."
19119005,19,119,5,Oh that my ways were directed to keep thy statutes!
19119006,19,119,6,"Then shall I not be ashamed, when I have respect unto all thy commandments."
19119007,19,119,7,"I will give thee thanks with uprightness of heart, when I shall have learned thy righteous judgments."
19119008,19,119,8,I will keep thy statutes: forsake me not utterly.
19119009,19,119,9,BETH. Wherewithal shall a young man cleanse his path? by taking heed according to thy word.
19119010,19,119,10,With my whole heart have I sought thee: let me not wander from thy commandments.
19119011,19,119,11,"Thy ùword have I hid in my heart, that I might not sin against thee."
19119012,19,119,12,"Blessed art thou, Jehovah! teach me thy statutes."
19119013,19,119,13,With my lips have I declared all the judgments of thy mouth.
19119014,19,119,14,"I have rejoiced in the way of thy testimonies, as [much as] in all wealth."
19119015,19,119,15,"I will meditate upon thy precepts, and have respect unto thy paths."
19119016,19,119,16,I delight myself in thy statutes; I will not forget thy word.
19119017,19,119,17,GIMEL. Deal bountifully with thy servant [and] I shall live; and I will keep thy word.
19119018,19,119,18,"Open mine eyes, and I shall behold wondrous things out of thy law."
19119019,19,119,19,I am a stranger in the land; hide not thy commandments from me.
19119020,19,119,20,My soul breaketh for longing after thy judgments at all times.
19119021,19,119,21,"Thou hast rebuked the proud [that are] cursed, who wander from thy commandments."
19119022,19,119,22,Roll off from me reproach and contempt; for I observe thy testimonies.
19119023,19,119,23,Princes also did sit [and] talk together against me: thy servant doth meditate in thy statutes.
19119024,19,119,24,Thy testimonies also are my delight [and] my counsellors.
19119025,19,119,25,DALETH. My soul cleaveth unto the dust: quicken me according to thy word.
19119026,19,119,26,"I have declared my ways, and thou hast answered me: teach me thy statutes."
19119027,19,119,27,"Make me to understand the way of thy precepts, and I will meditate upon thy wondrous works."
19119028,19,119,28,My soul melteth for sadness: strengthen me according to thy word.
19119029,19,119,29,"Remove from me the way of falsehood, and graciously grant me thy law."
19119030,19,119,30,I have chosen the way of faithfulness; thy judgments have I set [before me].
19119031,19,119,31,"I cleave unto thy testimonies; Jehovah, let me not be ashamed."
19119032,19,119,32,I will run the way of thy commandments when thou shalt enlarge my heart.
19119033,19,119,33,"HE. Teach me, O Jehovah, the way of thy statutes, and I will observe it [unto] the end."
19119034,19,119,34,"Give me understanding, and I will observe thy law; and I will keep it with [my] whole heart."
19119035,19,119,35,Make me to walk in the path of thy commandments; for therein do I delight.
19119036,19,119,36,"Incline my heart unto thy testimonies, and not to gain."
19119037,19,119,37,Turn away mine eyes from beholding vanity; quicken me in thy way.
19119038,19,119,38,"Establish thy ùword unto thy servant, who is [devoted] to thy fear."
19119039,19,119,39,Turn away my reproach which I fear; for thy judgments are good.
19119040,19,119,40,"Behold, I have longed after thy precepts: quicken me in thy righteousness."
19119041,19,119,41,"VAU. And let thy loving-kindness come unto me, O Jehovah, -- thy salvation according to thy ùword."
19119042,19,119,42,So shall I have wherewith to answer him that reproacheth me; for I confide in thy word.
19119043,19,119,43,And take not the word of truth utterly out of my mouth; because I have hoped in thy judgments.
19119044,19,119,44,"Then will I keep thy law continually, for ever and ever;"
19119045,19,119,45,"And I will walk at liberty, for I have sought thy precepts;"
19119046,19,119,46,"And I will speak of thy testimonies before kings, and will not be ashamed;"
19119047,19,119,47,"And I will delight myself in thy commandments, which I have loved;"
19119048,19,119,48,"And I will lift up my hands unto thy commandments, which I have loved, and I will meditate in thy statutes."
19119049,19,119,49,"ZAIN. Remember the word for thy servant, upon which thou hast caused me to hope."
19119050,19,119,50,This is my comfort in mine affliction; for thy ùword hath quickened me.
19119051,19,119,51,The proud have derided me beyond measure: I have not declined from thy law.
19119052,19,119,52,"I remembered thy judgments of old, O Jehovah, and have comforted myself."
19119053,19,119,53,Burning indignation hath taken hold upon me because of the wicked who forsake thy law.
19119054,19,119,54,Thy statutes have been my songs in the house of my pilgrimage.
19119055,19,119,55,"I have remembered thy name, O Jehovah, in the night, and have kept thy law."
19119056,19,119,56,"This I have had, because I have observed thy precepts."
19119057,19,119,57,"CHETH. My portion, O Jehovah, I have said, is to keep thy words."
19119058,19,119,58,I have sought thy favour with [my] whole heart: be gracious unto me according to thy ùword.
19119059,19,119,59,"I have thought on my ways, and turned my feet unto thy testimonies."
19119060,19,119,60,"I have made haste, and not delayed, to keep thy commandments."
19119061,19,119,61,The bands of the wicked have wrapped me round: I have not forgotten thy law.
19119062,19,119,62,"At midnight I rise up to give thanks unto thee, because of thy righteous judgments."
19119063,19,119,63,"I am the companion of all that fear thee, and of them that keep thy precepts."
19119064,19,119,64,"The earth, O Jehovah, is full of thy loving-kindness: teach me thy statutes."
19119065,19,119,65,"TETH. Thou hast dealt well with thy servant, O Jehovah, according to thy word."
19119066,19,119,66,Teach me good discernment and knowledge; for I have believed in thy commandments.
19119067,19,119,67,"Before I was afflicted I went astray, but now I keep thy ùword."
19119068,19,119,68,"Thou art good, and doest good; teach me thy statutes."
19119069,19,119,69,The proud have forged falsehood against me: I will observe thy precepts with [my] whole heart.
19119070,19,119,70,"Their heart is as fat as grease: as for me, I delight in thy law."
19119071,19,119,71,"It is good for me that I have been afflicted, that I might learn thy statutes."
19119072,19,119,72,The law of thy mouth is better unto me than thousands of gold and silver.
19119073,19,119,73,"YOD. Thy hands have made me and fashioned me: give me understanding, and I will learn thy commandments."
19119074,19,119,74,"They that fear thee will see me, and rejoice; because I have hoped in thy word."
19119075,19,119,75,"I know, Jehovah, that thy Judgments are righteousness, and that in faithfulness thou hast afflicted me."
19119076,19,119,76,"Oh let thy loving-kindness be for my comfort, according to thy ùword unto thy servant."
19119077,19,119,77,"Let thy tender mercies come unto me, that I may live; for thy law is my delight."
19119078,19,119,78,"Let the proud be ashamed; for they have acted perversely towards me with falsehood: as for me, I meditate in thy precepts."
19119079,19,119,79,"Let those that fear thee turn unto me, and those that know thy testimonies."
19119080,19,119,80,"Let my heart be perfect in thy statutes, that I be not ashamed."
19119081,19,119,81,CAPH. My soul fainteth for thy salvation; I hope in thy word.
19119082,19,119,82,"Mine eyes fail for thy ùword, saying, When wilt thou comfort me?"
19119083,19,119,83,For I am become like a bottle in the smoke; I do not forget thy statutes.
19119084,19,119,84,How many shall be the days of thy servant? when wilt thou execute judgment on them that persecute me?
19119085,19,119,85,"The proud have digged pits for me, which is not according to thy law."
19119086,19,119,86,All thy commandments are faithfulness. They persecute me wrongfully: help thou me.
19119087,19,119,87,"They had almost consumed me upon the earth; but as for me, I forsook not thy precepts."
