02025004,2,25,4,"blue, purple, scarlet, fine linen, goats' hair,"
02025005,2,25,5,"rams' skins dyed red, sea cow hides, acacia wood,"
02025006,2,25,6,"oil for the light, spices for the anointing oil and for the sweet incense,"
02025007,2,25,7,"onyx stones, and stones to be set for the ephod and for the breastplate."
02025008,2,25,8,"Let them make me a sanctuary, that I may dwell among them."
02025009,2,25,9,"According to all that I show you, the pattern of the tent, and the pattern of all of its furniture, even so you shall make it."
02025010,2,25,10,"""They shall make an ark of acacia wood. Its length shall be two and a half cubits, its breadth a cubit and a half, and a cubit and a half its height."
02025011,2,25,11,"You shall overlay it with pure gold. Inside and outside shall you overlay it, and shall make a gold molding around it."
02025012,2,25,12,"You shall cast four rings of gold for it, and put them in its four feet. Two rings shall be on the one side of it, and two rings on the other side of it."
02025013,2,25,13,"You shall make poles of acacia wood, and overlay them with gold."
02025014,2,25,14,You shall put the poles into the rings on the sides of the ark to carry the ark.
02025015,2,25,15,The poles shall be in the rings of the ark. They shall not be taken from it.
02025016,2,25,16,You shall put the testimony which I shall give you into the ark.
02025017,2,25,17,"You shall make a mercy seat of pure gold. Two and a half cubits shall be its length, and a cubit and a half its breadth."
02025018,2,25,18,You shall make two cherubim of hammered gold. You shall make them at the two ends of the mercy seat.
02025019,2,25,19,"Make one cherub at the one end, and one cherub at the other end. You shall make the cherubim on its two ends of one piece with the mercy seat."
02025020,2,25,20,"The cherubim shall spread out their wings upward, covering the mercy seat with their wings, with their faces toward one another. The faces of the cherubim shall be toward the mercy seat."
02025021,2,25,21,"You shall put the mercy seat on top of the ark, and in the ark you shall put the testimony that I will give you."
02025022,2,25,22,"There I will meet with you, and I will tell you from above the mercy seat, from between the two cherubim which are on the ark of the testimony, all that I command you for the children of Israel."
02025023,2,25,23,"""You shall make a table of acacia wood. Two cubits shall be its length, and a cubit its breadth, and one and a half cubits its height."
02025024,2,25,24,"You shall overlay it with pure gold, and make a gold molding around it."
02025025,2,25,25,You shall make a rim of a handbreadth around it. You shall make a golden molding on its rim around it.
02025026,2,25,26,"You shall make four rings of gold for it, and put the rings in the four corners that are on its four feet."
02025027,2,25,27,"the rings shall be close to the rim, for places for the poles to carry the table."
02025028,2,25,28,"You shall make the poles of acacia wood, and overlay them with gold, that the table may be carried with them."
02025029,2,25,29,"You shall make its dishes, its spoons, its ladles, and its bowls to pour out offerings with. Of pure gold shall you make them."
02025030,2,25,30,You shall set bread of the presence on the table before me always.
02025031,2,25,31,"""You shall make a lampstand of pure gold. Of hammered work shall the lampstand be made, even its base, its shaft, its cups, its buds, and its flowers, shall be of one piece with it."
02025032,2,25,32,"There shall be six branches going out of its sides: three branches of the lampstand out of its one side, and three branches of the lampstand out of its other side;"
02025033,2,25,33,"three cups made like almond blossoms in one branch, a bud and a flower; and three cups made like almond blossoms in the other branch, a bud and a flower, so for the six branches going out of the lampstand;"
02025034,2,25,34,"and in the lampstand four cups made like almond blossoms, its buds and its flowers;"
02025035,2,25,35,"and a bud under two branches of one piece with it, and a bud under two branches of one piece with it, and a bud under two branches of one piece with it, for the six branches going out of the lampstand."
02025036,2,25,36,"Their buds and their branches shall be of one piece with it, the whole of it one beaten work of pure gold."
02025037,2,25,37,"You shall make its lamps seven, and they shall light its lamps to give light to the space in front of it."
02025038,2,25,38,Its snuffers and its snuff dishes shall be of pure gold.
02025039,2,25,39,"It shall be made of a talent of pure gold, with all these accessories."
02025040,2,25,40,"See that you make them after their pattern, which has been shown to you on the mountain."
02026001,2,26,1,"""Moreover you shall make the tent with ten curtains; of fine twined linen, and blue, and purple, and scarlet, with cherubim. The work of the skillful workman you shall make them."
02026002,2,26,2,"The length of each curtain shall be twenty-eight cubits, and the breadth of each curtain four cubits: all the curtains shall have one measure."
02026003,2,26,3,Five curtains shall be coupled together one to another; and the other five curtains shall be coupled one to another.
02026004,2,26,4,You shall make loops of blue on the edge of the one curtain from the edge in the coupling; and likewise shall you make in the edge of the curtain that is outmost in the second coupling.
02026005,2,26,5,"You shall make fifty loops in the one curtain, and you shall make fifty loops in the edge of the curtain that is in the second coupling. The loops shall be opposite one to another."
02026006,2,26,6,"You shall make fifty clasps of gold, and couple the curtains one to another with the clasps: and the tent shall be a unit."
02026007,2,26,7,"""You shall make curtains of goats' hair for a covering over the tent: eleven curtains shall you make them."
02026008,2,26,8,"The length of each curtain shall be thirty cubits, and the breadth of each curtain four cubits: the eleven curtains shall have one measure."
02026009,2,26,9,"You shall couple five curtains by themselves, and six curtains by themselves, and shall double over the sixth curtain in the forefront of the tent."
02026010,2,26,10,"You shall make fifty loops on the edge of the one curtain that is outmost in the coupling, and fifty loops on the edge of the curtain which is outmost in the second coupling."
02026011,2,26,11,"You shall make fifty clasps of brass, and put the clasps into the loops, and couple the tent together, that it may be one."
02026012,2,26,12,"The overhanging part that remains of the curtains of the tent, the half curtain that remains, shall hang over the back of the tent."
02026013,2,26,13,"The cubit on the one side, and the cubit on the other side, of that which remains in the length of the curtains of the tent, shall hang over the sides of the tent on this side and on that side, to cover it."
02026014,2,26,14,"You shall make a covering for the tent of rams' skins dyed red, and a covering of sea cow hides above."
02026015,2,26,15,"""You shall make the boards for the tent of acacia wood, standing up."
02026016,2,26,16,"Ten cubits shall be the length of a board, and one and a half cubits the breadth of each board."
02026017,2,26,17,"There shall be two tenons in each board, joined to one another: thus shall you make for all the boards of the tent."
02026018,2,26,18,"You shall make the boards for the tent, twenty boards for the south side southward."
02026019,2,26,19,"You shall make forty sockets of silver under the twenty boards; two sockets under one board for its two tenons, and two sockets under another board for its two tenons."
02026020,2,26,20,"For the second side of the tent, on the north side, twenty boards,"
02026021,2,26,21,"and their forty sockets of silver; two sockets under one board, and two sockets under another board."
02026022,2,26,22,For the far part of the tent westward you shall make six boards.
02026023,2,26,23,Two boards shall you make for the corners of the tent in the far part.
02026024,2,26,24,"They shall be double beneath, and in like manner they shall be entire to the top of it to one ring: thus shall it be for them both; they shall be for the two corners."
02026025,2,26,25,"There shall be eight boards, and their sockets of silver, sixteen sockets; two sockets under one board, and two sockets under another board."
02026026,2,26,26,"""You shall make bars of acacia wood: five for the boards of the one side of the tent,"
02026027,2,26,27,"and five bars for the boards of the other side of the tent, and five bars for the boards of the side of the tent, for the far part westward."
02026028,2,26,28,The middle bar in the midst of the boards shall pass through from end to end.
02026029,2,26,29,"You shall overlay the boards with gold, and make their rings of gold for places for the bars: and you shall overlay the bars with gold."
02026030,2,26,30,You shall set up the tent according to the way that it was shown to you on the mountain.
02026031,2,26,31,"""You shall make a veil of blue, and purple, and scarlet, and fine twined linen, with cherubim. The work of the skillful workman shall it be made."
02026032,2,26,32,"You shall hang it on four pillars of acacia overlaid with gold; their hooks shall be of gold, on four sockets of silver."
02026033,2,26,33,"You shall hang up the veil under the clasps, and shall bring the ark of the testimony in there within the veil: and the veil shall separate the holy place from the most holy for you."
02026034,2,26,34,You shall put the mercy seat on the ark of the testimony in the most holy place.
02026035,2,26,35,"You shall set the table outside the veil, and the lampstand over against the table on the side of the tent toward the south: and you shall put the table on the north side."
02026036,2,26,36,"""You shall make a screen for the door of the Tent, of blue, and purple, and scarlet, and fine twined linen, the work of the embroiderer."
02026037,2,26,37,"You shall make for the screen five pillars of acacia, and overlay them with gold: their hooks shall be of gold: and you shall cast five sockets of brass for them."
02027001,2,27,1,"""You shall make the altar of acacia wood, five cubits long, and five cubits broad; the altar shall be foursquare: and its height shall be three cubits."
02027002,2,27,2,You shall make its horns on its four corners; its horns shall be of one piece with it; and you shall overlay it with brass.
02027003,2,27,3,"You shall make its pots to take away its ashes, its shovels, its basins, its flesh hooks, and its fire pans: all its vessels you shall make of brass."
02027004,2,27,4,You shall make a grating for it of network of brass: and on the net you shall make four brazen rings in its four corners.
02027005,2,27,5,"You shall put it under the ledge around the altar beneath, that the net may reach halfway up the altar."
02027006,2,27,6,"You shall make poles for the altar, poles of acacia wood, and overlay them with brass."
02027007,2,27,7,"Its poles shall be put into the rings, and the poles shall be on the two sides of the altar, when carrying it."
02027008,2,27,8,"Hollow with planks shall you make it: as it has been shown you on the mountain, so shall they make it."
02027009,2,27,9,"""You shall make the court of the tent: for the south side southward there shall be hangings for the court of fine twined linen one hundred cubits long for one side:"
02027010,2,27,10,"and the pillars of it shall be twenty, and their sockets twenty, of brass; the hooks of the pillars and their fillets shall be of silver."
02027011,2,27,11,"Likewise for the north side in length there shall be hangings one hundred cubits long, and the pillars of it twenty, and their sockets twenty, of brass; the hooks of the pillars, and their fillets, of silver."
02027012,2,27,12,"For the breadth of the court on the west side shall be hangings of fifty cubits; their pillars ten, and their sockets ten."
02027013,2,27,13,The breadth of the court on the east side eastward shall be fifty cubits.
02027014,2,27,14,"The hangings for the one side of the gate shall be fifteen cubits; their pillars three, and their sockets three."
02027015,2,27,15,"For the other side shall be hangings of fifteen cubits; their pillars three, and their sockets three."
02027016,2,27,16,"For the gate of the court shall be a screen of twenty cubits, of blue, and purple, and scarlet, and fine twined linen, the work of the embroiderer; their pillars four, and their sockets four."
02027017,2,27,17,"All the pillars of the court round about shall be filleted with silver; their hooks of silver, and their sockets of brass."
02027018,2,27,18,"The length of the court shall be one hundred cubits, and the breadth fifty every where, and the height five cubits, of fine twined linen, and their sockets of brass."
02027019,2,27,19,"All the instruments of the tent in all its service, and all the pins of it, and all the pins of the court, shall be of brass."
02027020,2,27,20,"""You shall command the children of Israel, that they bring to you pure olive oil beaten for the light, to cause a lamp to burn continually."
02027021,2,27,21,"In the tent of meeting, outside the veil which is before the testimony, Aaron and his sons shall keep it in order from evening to morning before Yahweh: it shall be a statute forever throughout their generations on the behalf of the children of Israel."
02028001,2,28,1,"""Bring Aaron your brother, and his sons with him, near to you from among the children of Israel, that he may minister to me in the priest's office, even Aaron, Nadab and Abihu, Eleazar and Ithamar, Aaron's sons."
02028002,2,28,2,"You shall make holy garments for Aaron your brother, for glory and for beauty."
02028003,2,28,3,"You shall speak to all who are wise-hearted, whom I have filled with the spirit of wisdom, that they make Aaron's garments to sanctify him, that he may minister to me in the priest's office."
02028004,2,28,4,"These are the garments which they shall make: a breastplate, and an ephod, and a robe, and a coat of checker work, a turban, and a sash: and they shall make holy garments for Aaron your brother, and his sons, that he may minister to me in the priest's office."
02028005,2,28,5,"They shall take the gold, and the blue, and the purple, and the scarlet, and the fine linen."
02028006,2,28,6,"""They shall make the ephod of gold, of blue, and purple, scarlet, and fine twined linen, the work of the skillful workman."
02028007,2,28,7,"It shall have two shoulder-pieces joined to the two ends of it, that it may be joined together."
02028008,2,28,8,"The skillfully woven band, which is on it, that is on him, shall be like its work and of the same piece; of gold, of blue, and purple, and scarlet, and fine twined linen."
02028009,2,28,9,"You shall take two onyx stones, and engrave on them the names of the children of Israel:"
02028010,2,28,10,"six of their names on the one stone, and the names of the six that remain on the other stone, in the order of their birth."
02028011,2,28,11,"With the work of an engraver in stone, like the engravings of a signet, shall you engrave the two stones, according to the names of the children of Israel: you shall make them to be enclosed in settings of gold."
02028012,2,28,12,"You shall put the two stones on the shoulder-pieces of the ephod, to be stones of memorial for the children of Israel: and Aaron shall bear their names before Yahweh on his two shoulders for a memorial."
02028013,2,28,13,"You shall make settings of gold,"
02028014,2,28,14,"and two chains of pure gold; you make them like cords shall, of braided work: and you shall put the braided chains on the settings."
02028015,2,28,15,"""You shall make a breastplate of judgment, the work of the skillful workman; like the work of the ephod you shall make it; of gold, of blue, and purple, and scarlet, and fine twined linen, shall you make it."
02028016,2,28,16,"It shall be square and folded double; a span{A span is the length from the tip of the thumb to the tip of the little finger when the hand is stretched out (about 9 inches or 22.8 cm.)} shall be its length of it, and a span its breadth."
02028017,2,28,17,"You shall set in it settings of stones, four rows of stones: a row of ruby, topaz, and beryl shall be the first row;"
02028018,2,28,18,"and the second row a turquoise, a sapphire{or, lapis lazuli}, and an emerald;"
02028019,2,28,19,"and the third row a jacinth, an agate, and an amethyst;"
02028020,2,28,20,"and the fourth row a chrysolite, an onyx, and a jasper: they shall be enclosed in gold in their settings."
02028021,2,28,21,"The stones shall be according to the names of the children of Israel, twelve, according to their names; like the engravings of a signet, everyone according to his name, they shall be for the twelve tribes."
02028022,2,28,22,"You shall make on the breastplate chains like cords, of braided work of pure gold."
02028023,2,28,23,"You shall make on the breastplate two rings of gold, and shall put the two rings on the two ends of the breastplate."
02028024,2,28,24,You shall put the two braided chains of gold in the two rings at the ends of the breastplate.
02028025,2,28,25,"The other two ends of the two braided chains you shall put on the two settings, and put them on the shoulder-pieces of the ephod in the forepart of it."
02028026,2,28,26,"You shall make two rings of gold, and you shall put them on the two ends of the breastplate, on its edge, which is toward the side of the ephod inward."
02028027,2,28,27,"You shall make two rings of gold, and shall put them on the two shoulder-pieces of the ephod underneath, in the forepart of it, close by the coupling of it, above the skillfully woven band of the ephod."
02028028,2,28,28,"They shall bind the breastplate by the rings of it to the rings of the ephod with a lace of blue, that it may be on the skillfully woven band of the ephod, and that the breastplate may not swing out from the ephod."
02028029,2,28,29,"Aaron shall bear the names of the children of Israel in the breastplate of judgment on his heart, when he goes in to the holy place, for a memorial before Yahweh continually."
02028030,2,28,30,"You shall put in the breastplate of judgment the Urim and the Thummim; and they shall be on Aaron's heart, when he goes in before Yahweh: and Aaron shall bear the judgment of the children of Israel on his heart before Yahweh continually."
02028031,2,28,31,"""You shall make the robe of the ephod all of blue."
02028032,2,28,32,"It shall have a hole for the head in the midst of it: it shall have a binding of woven work round about the hole of it, as it were the hole of a coat of mail, that it not be torn."
02028033,2,28,33,"On its hem you shall make pomegranates of blue, and of purple, and of scarlet, around its hem; and bells of gold between them round about:"
02028034,2,28,34,"a golden bell and a pomegranate, a golden bell and a pomegranate, on the hem of the robe round about."
02028035,2,28,35,"It shall be on Aaron to minister: and the sound of it shall be heard when he goes in to the holy place before Yahweh, and when he comes out, that he not die."
02028036,2,28,36,"""You shall make a plate of pure gold, and engrave on it, like the engravings of a signet, 'HOLY TO YAHWEH.'"
02028037,2,28,37,"You shall put it on a lace of blue, and it shall be on the sash; on the front of the sash it shall be."
02028038,2,28,38,"It shall be on Aaron's forehead, and Aaron shall bear the iniquity of the holy things, which the children of Israel shall make holy in all their holy gifts; and it shall be always on his forehead, that they may be accepted before Yahweh."
02028039,2,28,39,"You shall weave the coat in checker work of fine linen, and you shall make a turban of fine linen, and you shall make a sash, the work of the embroiderer."
02028040,2,28,40,"""You shall make coats for Aaron's sons, and you shall make sashes for them and headbands shall you make for them, for glory and for beauty."
02028041,2,28,41,"You shall put them on Aaron your brother, and on his sons with him, and shall anoint them, and consecrate them, and sanctify them, that they may minister to me in the priest's office."
02028042,2,28,42,You shall make them linen breeches to cover the flesh of their nakedness; from the loins even to the thighs they shall reach:
02028043,2,28,43,"They shall be on Aaron, and on his sons, when they go in to the tent of meeting, or when they come near to the altar to minister in the holy place; that they don't bear iniquity, and die: it shall be a statute forever to him and to his descendants after him."
02029001,2,29,1,"""This is the thing that you shall do to them to make them holy, to minister to me in the priest's office: take one young bull and two rams without blemish,"
02029002,2,29,2,"unleavened bread, unleavened cakes mixed with oil, and unleavened wafers anointed with oil: you shall make them of fine wheat flour."
02029003,2,29,3,"You shall put them into one basket, and bring them in the basket, with the bull and the two rams."
02029004,2,29,4,"You shall bring Aaron and his sons to the door of the tent of meeting, and shall wash them with water."
02029005,2,29,5,"You shall take the garments, and put on Aaron the coat, the robe of the ephod, the ephod, and the breastplate, and dress him with the skillfully woven band of the ephod;"
02029006,2,29,6,"and you shall set the turban on his head, and put the holy crown on the turban."
02029007,2,29,7,"Then you shall take the anointing oil, and pour it on his head, and anoint him."
02029008,2,29,8,"You shall bring his sons, and put coats on them."
02029009,2,29,9,"You shall dress them with belts, Aaron and his sons, and bind headbands on them: and they shall have the priesthood by a perpetual statute: and you shall consecrate Aaron and his sons."
02029010,2,29,10,"""You shall bring the bull before the tent of meeting: and Aaron and his sons shall lay their hands on the head of the bull."
02029011,2,29,11,"You shall kill the bull before Yahweh, at the door of the tent of meeting."
02029012,2,29,12,"You shall take of the blood of the bull, and put it on the horns of the altar with your finger; and you shall pour out all the blood at the base of the altar."
02029013,2,29,13,"You shall take all the fat that covers the innards, the cover of the liver, the two kidneys, and the fat that is on them, and burn them on the altar."
02029014,2,29,14,"But the flesh of the bull, and its skin, and its dung, you shall burn with fire outside of the camp: it is a sin-offering."
02029015,2,29,15,"""You shall also take the one ram; and Aaron and his sons shall lay their hands on the head of the ram."
02029016,2,29,16,"You shall kill the ram, and you shall take its blood, and sprinkle it around on the altar."
02029017,2,29,17,"You shall cut the ram into its pieces, and wash its innards, and its legs, and put them with its pieces, and with its head."
02029018,2,29,18,"You shall burn the whole ram on the altar: it is a burnt offering to Yahweh; it is a sweet savor, an offering made by fire to Yahweh."
02029019,2,29,19,"""You shall take the other ram; and Aaron and his sons shall lay their hands on the head of the ram."
02029020,2,29,20,"Then you shall kill the ram, and take some of its blood, and put it on the tip of the right ear of Aaron, and on the tip of the right ear of his sons, and on the thumb of their right hand, and on the big toe of their right foot, and sprinkle the blood on the altar round about."
02029021,2,29,21,"You shall take of the blood that is on the altar, and of the anointing oil, and sprinkle it on Aaron, and on his garments, and on his sons, and on the garments of his sons with him: and he shall be made holy, and his garments, and his sons, and his sons' garments with him."
02029022,2,29,22,"Also you shall take some of the ram's fat, the fat tail, the fat that covers the innards, the cover of the liver, the two kidneys, the fat that is on them, and the right thigh (for it is a ram of consecration),"
02029023,2,29,23,"and one loaf of bread, one cake of oiled bread, and one wafer out of the basket of unleavened bread that is before Yahweh."
02029024,2,29,24,"You shall put all of this in Aaron's hands, and in his sons' hands, and shall wave them for a wave-offering before Yahweh."
02029025,2,29,25,"You shall take them from their hands, and burn them on the altar on the burnt offering, for a sweet savor before Yahweh: it is an offering made by fire to Yahweh."
02029026,2,29,26,"""You shall take the breast of Aaron's ram of consecration, and wave it for a wave-offering before Yahweh: and it shall be your portion."
02029027,2,29,27,"You shall sanctify the breast of the wave-offering, and the thigh of the heave-offering, which is waved, and which is heaved up, of the ram of consecration, even of that which is for Aaron, and of that which is for his sons:"
02029028,2,29,28,"and it shall be for Aaron and his sons as their portion forever from the children of Israel; for it is a heave-offering: and it shall be a heave-offering from the children of Israel of the sacrifices of their peace-offerings, even their heave-offering to Yahweh."
02029029,2,29,29,"""The holy garments of Aaron shall be for his sons after him, to be anointed in them, and to be consecrated in them."
02029030,2,29,30,"Seven days shall the son who is priest in his place put them on, when he comes into the tent of meeting to minister in the holy place."
02029031,2,29,31,"""You shall take the ram of consecration, and boil its flesh in a holy place."
02029032,2,29,32,"Aaron and his sons shall eat the flesh of the ram, and the bread that is in the basket, at the door of the tent of meeting."
02029033,2,29,33,"They shall eat those things with which atonement was made, to consecrate and sanctify them: but a stranger shall not eat of it, because they are holy."
