05001001,5,1,1,"These are the words which Moses spake unto all Israel beyond the Jordan in the wilderness, in the Arabah over against Suph, between Paran, and Tophel, and Laban, and Hazeroth, and Di-zahab."
05001002,5,1,2,It is eleven days' `journey' from Horeb by the way of mount Seir unto Kadesh-barnea.
05001003,5,1,3,"And it came to pass in the fortieth year, in the eleventh month, on the first day of the month, that Moses spake unto the children of Israel, according unto all that Jehovah had given him in commandment unto them;"
05001004,5,1,4,"after he had smitten Sihon the king of the Amorites, who dwelt in Heshbon, and Og the king of Bashan, who dwelt in Ashtaroth, at Edrei."
05001005,5,1,5,"Beyond the Jordan, in the land of Moab, began Moses to declare this law, saying,"
05001006,5,1,6,"Jehovah our God spake unto us in Horeb, saying, Ye have dwelt long enough in this mountain:"
05001007,5,1,7,"turn you, and take your journey, and go to the hill-country of the Amorites, and unto all `the places' nigh thereunto, in the Arabah, in the hill-country, and in the lowland, and in the South, and by the sea-shore, the land of the Canaanites, and Lebanon, as far as the great river, the river Euphrates."
05001008,5,1,8,"Behold, I have set the land before you: go in and possess the land which Jehovah sware unto your fathers, to Abraham, to Isaac, and to Jacob, to give unto them and to their seed after them."
05001009,5,1,9,"And I spake unto you at that time, saying, I am not able to bear you myself alone:"
05001010,5,1,10,"Jehovah your God hath multiplied you, and, behold, ye are this day as the stars of heaven for multitude."
05001011,5,1,11,"Jehovah, the God of your fathers, make you a thousand times as many as ye are, and bless you, as he hath promised you!"
05001012,5,1,12,"How can I myself alone bear your cumbrance, and your burden, and your strife?"
05001013,5,1,13,"Take you wise men, and understanding, and known, according to your tribes, and I will make them heads over you."
05001014,5,1,14,"And ye answered me, and said, The thing which thou hast spoken is good `for us' to do."
05001015,5,1,15,"So I took the heads of your tribes, wise men, and known, and made them heads over you, captains of thousands, and captains of hundreds, and captains of fifties, and captains of tens, and officers, according to your tribes."
05001016,5,1,16,"And I charged your judges at that time, saying, Hear `the causes' between your brethren, and judge righteously between a man and his brother, and the sojourner that is with him."
05001017,5,1,17,"Ye shall not respect persons in judgment; ye shall hear the small and the great alike; ye shall not be afraid of the face of man; for the judgment is God's: and the cause that is too hard for you ye shall bring unto me, and I will hear it."
05001018,5,1,18,And I commanded you at that time all the things which ye should do.
05001019,5,1,19,"And we journeyed from Horeb, and went through all that great and terrible wilderness which ye saw, by the way to the hill-country of the Amorites, as Jehovah our God commanded us; and we came to Kadesh-barnea."
05001020,5,1,20,"And I said unto you, Ye are come unto the hill-country of the Amorites, which Jehovah our God giveth unto us."
05001021,5,1,21,"Behold, Jehovah thy God hath set the land before thee: go up, take possession, as Jehovah, the God of thy fathers, hath spoken unto thee; fear not, neither be dismayed."
05001022,5,1,22,"And ye came near unto me every one of you, and said, Let us send men before us, that they may search the land for us, and bring us word again of the way by which we must go up, and the cities unto which we shall come."
05001023,5,1,23,"And the thing pleased me well; and I took twelve men of you, one man for every tribe:"
05001024,5,1,24,"and they turned and went up into the hill-country, and came unto the valley of Eshcol, and spied it out."
05001025,5,1,25,"And they took of the fruit of the land in their hands, and brought it down unto us, and brought us word again, and said, It is a good land which Jehovah our God giveth unto us."
05001026,5,1,26,"Yet ye would not go up, but rebelled against the commandment of Jehovah your God:"
05001027,5,1,27,"and ye murmured in your tents, and said, Because Jehovah hated us, he hath brought us forth out of the land of Egypt, to deliver us into the hand of the Amorites, to destroy us."
05001028,5,1,28,"Whither are we going up? our brethren have made our heart to melt, saying, The people are greater and taller than we; the cities are great and fortified up to heaven; and moreover we have seen the sons of the Anakim there."
05001029,5,1,29,"Then I said unto you, Dread not, neither be afraid of them."
05001030,5,1,30,"Jehovah your God who goeth before you, he will fight for you, according to all that he did for you in Egypt before your eyes,"
05001031,5,1,31,"and in the wilderness, where thou hast seen how that Jehovah thy God bare thee, as a man doth bear his son, in all the way that ye went, until ye came unto this place."
05001032,5,1,32,"Yet in this thing ye did not believe Jehovah your God,"
05001033,5,1,33,"who went before you in the way, to seek you out a place to pitch your tents in, in fire by night, to show you by what way ye should go, and in the cloud by day."
05001034,5,1,34,"And Jehovah heard the voice of your words, and was wroth, and sware, saying,"
05001035,5,1,35,"Surely there shall not one of these men of this evil generation see the good land, which I sware to give unto your fathers,"
05001036,5,1,36,"save Caleb the son of Jephunneh: he shall see it; and to him will I give the land that he hath trodden upon, and to his children, because he hath wholly followed Jehovah."
05001037,5,1,37,"Also Jehovah was angry with me for your sakes, saying, Thou also shalt not go in thither:"
05001038,5,1,38,"Joshua the son of Nun, who standeth before thee, he shall go in thither: encourage thou him; for he shall cause Israel to inherit it."
05001039,5,1,39,"Moreover your little ones, that ye said should be a prey, and your children, that this day have no knowledge of good or evil, they shall go in thither, and unto them will I give it, and they shall possess it."
05001040,5,1,40,"But as for you, turn you, and take your journey into the wilderness by the way to the Red Sea."
05001041,5,1,41,"Then ye answered and said unto me, We have sinned against Jehovah, we will go up and fight, according to all that Jehovah our God commanded us. And ye girded on every man his weapons of war, and were forward to go up into the hill-country."
05001042,5,1,42,"And Jehovah said unto me, Say unto them, Go not up, neither fight; for I am not among you; lest ye be smitten before your enemies."
05001043,5,1,43,"So I spake unto you, and ye hearkened not; but ye rebelled against the commandment of Jehovah, and were presumptuous, and went up into the hill-country."
05001044,5,1,44,"And the Amorites, that dwelt in that hill-country, came out against you, and chased you, as bees do, and beat you down in Seir, even unto Hormah."
05001045,5,1,45,"And ye returned and wept before Jehovah; but Jehovah hearkened not to your voice, nor gave ear unto you."
05001046,5,1,46,"So ye abode in Kadesh many days, according unto the days that ye abode `there'."
05002001,5,2,1,"Then we turned, and took our journey into the wilderness by the way to the Red Sea, as Jehovah spake unto me; and we compassed mount Seir many days."
05002002,5,2,2,"And Jehovah spake unto me, saying,"
05002003,5,2,3,Ye have compassed this mountain long enough: turn you northward.
05002004,5,2,4,"And command thou the people, saying, Ye are to pass through the border of your brethren the children of Esau, that dwell in Seir; and they will be afraid of you: take ye good heed unto yourselves therefore;"
05002005,5,2,5,"contend not with them; for I will not give you of their land, no, not so much as for the sole of the foot to tread on; because I have given mount Seir unto Esau for a possession."
05002006,5,2,6,"Ye shall purchase food of them for money, that ye may eat; and ye shall also buy water of them for money, that ye may drink."
05002007,5,2,7,For Jehovah thy God hath blessed thee in all the work of thy hand; he hath known thy walking through this great wilderness: these forty years Jehovah thy God hath been with thee; thou hast lacked nothing.
05002008,5,2,8,"So we passed by from our brethren the children of Esau, that dwell in Seir, from the way of the Arabah from Elath and from Ezion-geber. And we turned and passed by the way of the wilderness of Moab."
05002009,5,2,9,"And Jehovah said unto me, Vex not Moab, neither contend with them in battle; for I will not give thee of his land for a possession; because I have given Ar unto the children of Lot for a possession."
05002010,5,2,10,"(The Emim dwelt therein aforetime, a people great, and many, and tall, as the Anakim:"
05002011,5,2,11,"these also are accounted Rephaim, as the Anakim; but the Moabites call them Emim."
05002012,5,2,12,"The Horites also dwelt in Seir aforetime, but the children of Esau succeeded them; and they destroyed them from before them, and dwelt in their stead; as Israel did unto the land of his possession, which Jehovah gave unto them.)"
05002013,5,2,13,"Now rise up, and get you over the brook Zered. And we went over the brook Zered."
05002014,5,2,14,"And the days in which we came from Kadesh-barnea, until we were come over the brook Zered, were thirty and eight years; until all the generation of the men of war were consumed from the midst of the camp, as Jehovah sware unto them."
05002015,5,2,15,"Moreover the hand of Jehovah was against them, to destroy them from the midst of the camp, until they were consumed."
05002016,5,2,16,"So it came to pass, when all the men of war were consumed and dead from among the people,"
05002017,5,2,17,"that Jehovah spake unto me, saying,"
05002018,5,2,18,"Thou art this day to pass over Ar, the border of Moab:"
05002019,5,2,19,"and when thou comest nigh over against the children of Ammon, vex them not, nor contend with them; for I will not give thee of the land of the children of Ammon for a possession; because I have given it unto the children of Lot for a possession."
05002020,5,2,20,"(That also is accounted a land of Rephaim: Rephaim dwelt therein aforetime; but the Ammonites call them Zamzummim,"
05002021,5,2,21,"a people great, and many, and tall, as the Anakim; but Jehovah destroyed them before them; and they succeeded them, and dwelt in their stead;"
05002022,5,2,22,"as he did for the children of Esau, that dwell in Seir, when he destroyed the Horites from before them; and they succeeded them, and dwelt in their stead even unto this day:"
05002023,5,2,23,"and the Avvim, that dwelt in villages as far as Gaza, the Caphtorim, that came forth out of Caphtor, destroyed them, and dwelt in their stead.)"
05002024,5,2,24,"Rise ye up, take your journey, and pass over the valley of the Arnon: behold, I have given into thy hand Sihon the Amorite, king of Heshbon, and his land; begin to possess it, and contend with him in battle."
05002025,5,2,25,"This day will I begin to put the dread of thee and the fear of thee upon the peoples that are under the whole heaven, who shall hear the report of thee, and shall tremble, and be in anguish because of thee."
05002026,5,2,26,"And I sent messengers out of the wilderness of Kedemoth unto Sihon king of Heshbon with words of peace, saying,"
05002027,5,2,27,"Let me pass through thy land: I will go along by the highway, I will turn neither unto the right hand nor to the left."
05002028,5,2,28,"Thou shalt sell me food for money, that I may eat; and give me water for money, that I may drink: only let me pass through on my feet,"
05002029,5,2,29,"as the children of Esau that dwell in Seir, and the Moabites that dwell in Ar, did unto me; until I shall pass over the Jordan into the land which Jehovah our God giveth us."
05002030,5,2,30,"But Sihon king of Heshbon would not let us pass by him; for Jehovah thy God hardened his spirit, and made his heart obstinate, that he might deliver him into thy hand, as at this day."
05002031,5,2,31,"And Jehovah said unto me, Behold, I have begun to deliver up Sihon and his land before thee: begin to possess, that thou mayest inherit his land."
05002032,5,2,32,"Then Sihon came out against us, he and all his people, unto battle at Jahaz."
05002033,5,2,33,"And Jehovah our God delivered him up before us; and we smote him, and his sons, and all his people."
05002034,5,2,34,"And we took all his cities at that time, and utterly destroyed every inhabited city, with the women and the little ones; we left none remaining:"
05002035,5,2,35,"only the cattle we took for a prey unto ourselves, with the spoil of the cities which we had taken."
05002036,5,2,36,"From Aroer, which is on the edge of the valley of the Arnon, and `from' the city that is in the valley, even unto Gilead, there was not a city too high for us; Jehovah our God delivered up all before us:"
05002037,5,2,37,"only to the land of the children of Ammon thou camest not near; all the side of the river Jabbok, and the cities of the hill-country, and wheresoever Jehovah our God forbade us."
05003001,5,3,1,"Then we turned, and went up the way to Bashan: and Og the king of Bashan came out against us, he and all his people, unto battle at Edrei."
05003002,5,3,2,"And Jehovah said unto me, Fear him not; for I have delivered him, and all his people, and his land, into thy hand; and thou shalt do unto him as thou didst unto Sihon king of the Amorites, who dwelt at Heshbon."
05003003,5,3,3,"So Jehovah our God delivered into our hand Og also, the king of Bashan, and all his people: and we smote him until none was left to him remaining."
05003004,5,3,4,"And we took all his cities at that time; there was not a city which we took not from them; threescore cities, all the region of Argob, the kingdom of Og in Bashan."
05003005,5,3,5,"All these were cities fortified with high walls, gates, and bars; besides the unwalled towns a great many."
05003006,5,3,6,"And we utterly destroyed them, as we did unto Sihon king of Heshbon, utterly destroying every inhabited city, with the women and the little ones."
05003007,5,3,7,"But all the cattle, and the spoil of the cities, we took for a prey unto ourselves."
05003008,5,3,8,"And we took the land at that time out of the hand of the two kings of the Amorites that were beyond the Jordan, from the valley of the Arnon unto mount Hermon;"
05003009,5,3,9,"(`which' Hermon the Sidonians call Sirion, and the Amorites call it Senir;)"
05003010,5,3,10,"all the cities of the plain, and all Gilead, and all Bashan, unto Salecah and Edrei, cities of the kingdom of Og in Bashan."
05003011,5,3,11,"(For only Og king of Bashan remained of the remnant of the Rephaim; behold, his bedstead was a bedstead of iron; is it not in Rabbah of the children of Ammon? nine cubits was the length thereof, and four cubits the breadth of it, after the cubit of a man.)"
05003012,5,3,12,"And this land we took in possession at that time: from Aroer, which is by the valley of the Arnon, and half the hill-country of Gilead, and the cities thereof, gave I unto the Reubenites and to the Gadites:"
05003013,5,3,13,"and the rest of Gilead, and all Bashan, the kingdom of Og, gave I unto the half-tribe of Manasseh; all the region of Argob, even all Bashan. (The same is called the land of Rephaim."
05003014,5,3,14,"Jair the son of Manasseh took all the region of Argob, unto the border of the Geshurites and the Maacathites, and called them, even Bashan, after his own name, Havvoth-jair, unto this day.)"
05003015,5,3,15,And I gave Gilead unto Machir.
05003016,5,3,16,"And unto the Reubenites and unto the Gadites I gave from Gilead even unto the valley of the Arnon, the middle of the valley, and the border `thereof', even unto the river Jabbok, which is the border of the children of Ammon;"
05003017,5,3,17,"the Arabah also, and the Jordan and the border `thereof', from Chinnereth even unto the sea of the Arabah, the Salt Sea, under the slopes of Pisgah eastward."
05003018,5,3,18,"And I commanded you at that time, saying, Jehovah your God hath given you this land to possess it: ye shall pass over armed before your brethren the children of Israel, all the men of valor."
05003019,5,3,19,"But your wives, and your little ones, and your cattle, (I know that ye have much cattle,) shall abide in your cities which I have given you,"
05003020,5,3,20,"until Jehovah give rest unto your brethren, as unto you, and they also possess the land which Jehovah your God giveth them beyond the Jordan: then shall ye return every man unto his possession, which I have given you."
05003021,5,3,21,"And I commanded Joshua at that time, saying, Thine eyes have seen all that Jehovah your God hath done unto these two kings: so shall Jehovah do unto all the kingdoms whither thou goest over."
05003022,5,3,22,"Ye shall not fear them; for Jehovah your God, he it is that fighteth for you."
05003023,5,3,23,"And I besought Jehovah at that time, saying,"
05003024,5,3,24,"O Lord Jehovah, thou hast begun to show thy servant thy greatness, and thy strong hand: for what god is there in heaven or in earth, that can do according to thy works, and according to thy mighty acts?"
05003025,5,3,25,"Let me go over, I pray thee, and see the good land that is beyond the Jordan, that goodly mountain, and Lebanon."
05003026,5,3,26,"But Jehovah was wroth with me for your sakes, and hearkened not unto me; and Jehovah said unto me, Let it suffice thee; speak no more unto me of this matter."
05003027,5,3,27,"Get thee up unto the top of Pisgah, and lift up thine eyes westward, and northward, and southward, and eastward, and behold with thine eyes: for thou shalt not go over this Jordan."
05003028,5,3,28,"But charge Joshua, and encourage him, and strengthen him; for he shall go over before this people, and he shall cause them to inherit the land which thou shalt see."
05003029,5,3,29,So we abode in the valley over against Beth-peor.
05004001,5,4,1,"And now, O Israel, hearken unto the statutes and unto the ordinances, which I teach you, to do them; that ye may live, and go in and possess the land which Jehovah, the God of your fathers, giveth you."
05004002,5,4,2,"Ye shall not add unto the word which I command you, neither shall ye diminish from it, that ye may keep the commandments of Jehovah your God which I command you."
05004003,5,4,3,"Your eyes have seen what Jehovah did because of Baal-peor; for all the men that followed Baal-peor, Jehovah thy God hath destroyed them from the midst of thee."
05004004,5,4,4,But ye that did cleave unto Jehovah your God are alive every one of you this day.
05004005,5,4,5,"Behold, I have taught you statutes and ordinances, even as Jehovah my God commanded me, that ye should do so in the midst of the land whither ye go in to possess it."
05004006,5,4,6,"Keep therefore and do them; for this is your wisdom and your understanding in the sight of the peoples, that shall hear all these statutes, and say, Surely this great nation is a wise and understanding people."
05004007,5,4,7,"For what great nation is there, that hath a god so nigh unto them, as Jehovah our God is whensoever we call upon him?"
05004008,5,4,8,"And what great nation is there, that hath statutes and ordinances so righteous as all this law, which I set before you this day?"
05004009,5,4,9,"Only take heed to thyself, and keep thy soul diligently, lest thou forget the things which thine eyes saw, and lest they depart from thy heart all the days of thy life; but make them known unto thy children and thy children's children;"
05004010,5,4,10,"the day that thou stoodest before Jehovah thy God in Horeb, when Jehovah said unto me, Assemble me the people, and I will make them hear my words, that they may learn to fear me all the days that they live upon the earth, and that they may teach their children."
05004011,5,4,11,"And ye came near and stood under the mountain; and the mountain burned with fire unto the heart of heaven, with darkness, cloud, and thick darkness."
05004012,5,4,12,"And Jehovah spake unto you out of the midst of the fire: ye heard the voice of words, but ye saw no form; only `ye heard' a voice."
05004013,5,4,13,"And he declared unto you his covenant, which he commanded you to perform, even the ten commandments; and he wrote them upon two tables of stone."
05004014,5,4,14,"And Jehovah commanded me at that time to teach you statutes and ordinances, that ye might do them in the land whither ye go over to possess it."
05004015,5,4,15,Take ye therefore good heed unto yourselves; for ye saw no manner of form on the day that Jehovah spake unto you in Horeb out of the midst of the fire.
05004016,5,4,16,"Lest ye corrupt yourselves, and make you a graven image in the form of any figure, the likeness of male or female,"
05004017,5,4,17,"the likeness of any beast that is on the earth, the likeness of any winged bird that flieth in the heavens,"
05004018,5,4,18,"the likeness of anything that creepeth on the ground, the likeness of any fish that is in the water under the earth;"
05004019,5,4,19,"and lest thou lift up thine eyes unto heaven, and when thou seest the sun and the moon and the stars, even all the host of heaven, thou be drawn away and worship them, and serve them, which Jehovah thy God hath allotted unto all the peoples under the whole heaven."
05004020,5,4,20,"But Jehovah hath taken you, and brought you forth out of the iron furnace, out of Egypt, to be unto him a people of inheritance, as at this day."
05004021,5,4,21,"Furthermore Jehovah was angry with me for your sakes, and sware that I should not go over the Jordan, and that I should not go in unto that good land, which Jehovah thy God giveth thee for an inheritance:"
05004022,5,4,22,"but I must die in this land, I must not go over the Jordan; but ye shall go over, and possess that good land."
05004023,5,4,23,"Take heed unto yourselves, lest ye forget the covenant of Jehovah your God, which he made with you, and make you a graven image in the form of anything which Jehovah thy God hath forbidden thee."
05004024,5,4,24,"For Jehovah thy God is a devouring fire, a jealous God."
05004025,5,4,25,"When thou shalt beget children, and children's children, and ye shall have been long in the land, and shall corrupt yourselves, and make a graven image in the form of anything, and shall do that which is evil in the sight of Jehovah thy God, to provoke him to anger;"
05004026,5,4,26,"I call heaven and earth to witness against you this day, that ye shall soon utterly perish from off the land whereunto ye go over the Jordan to possess it; ye shall not prolong your days upon it, but shall utterly be destroyed."
05004027,5,4,27,"And Jehovah will scatter you among the peoples, and ye shall be left few in number among the nations, whither Jehovah shall lead you away."
05004028,5,4,28,"And there ye shall serve gods, the work of men's hands, wood and stone, which neither see, nor hear, nor eat, nor smell."
05004029,5,4,29,"But from thence ye shall seek Jehovah thy God, and thou shalt find him, when thou searchest after him with all thy heart and with all thy soul."
05004030,5,4,30,"When thou art in tribulation, and all these things are come upon thee, in the latter days thou shalt return to Jehovah thy God, and hearken unto his voice:"
05004031,5,4,31,"for Jehovah thy God is a merciful God; he will not fail thee, neither destroy thee, nor forget the covenant of thy fathers which he sware unto them."
05004032,5,4,32,"For ask now of the days that are past, which were before thee, since the day that God created man upon the earth, and from the one end of heaven unto the other, whether there hath been `any such thing' as this great thing is, or hath been heard like it?"
05004033,5,4,33,"Did ever a people hear the voice of God speaking out of the midst of the fire, as thou hast heard, and live?"
05004034,5,4,34,"Or hath God assayed to go and take him a nation from the midst of `another' nation, by trials, by signs, and by wonders, and by war, and by a mighty hand, and by an outstretched arm, and by great terrors, according to all that Jehovah your God did for you in Egypt before your eyes?"
05004035,5,4,35,"Unto thee it was showed, that thou mightest know that Jehovah he is God; there is none else besides him."
05004036,5,4,36,"Out of heaven he made thee to hear his voice, that he might instruct thee: and upon earth he made thee to see his great fire; and thou heardest his words out of the midst of the fire."
05004037,5,4,37,"And because he loved thy fathers, therefore he chose their seed after them, and brought thee out with his presence, with his great power, out of Egypt;"
05004038,5,4,38,"to drive out nations from before thee greater and mightier than thou, to bring thee in, to give thee their land for an inheritance, as at this day."
05004039,5,4,39,"Know therefore this day, and lay it to thy heart, that Jehovah he is God in heaven above and upon the earth beneath; there is none else."
05004040,5,4,40,"And thou shalt keep his statutes, and his commandments, which I command thee this day, that it may go well with thee, and with thy children after thee, and that thou mayest prolong thy days in the land, which Jehovah thy God giveth thee, for ever."
05004041,5,4,41,Then Moses set apart three cities beyond the Jordan toward the sunrising;
05004042,5,4,42,"that the manslayer might flee thither, that slayeth his neighbor unawares, and hated him not in time past; and that fleeing unto one of these cities he might live:"
05004043,5,4,43,"`namely', Bezer in the wilderness, in the plain country, for the Reubenites; and Ramoth in Gilead, for the Gadites; and Golan in Bashan, for the Manassites."
05004044,5,4,44,And this is the law which Moses set before the children of Israel:
