05016009,5,16,9,Seven weeks shalt thou number unto thee: from the time thou beginnest to put the sickle to the standing grain shalt thou begin to number seven weeks.
05016010,5,16,10,"And thou shalt keep the feast of weeks unto Jehovah thy God with a tribute of a freewill-offering of thy hand, which thou shalt give, according as Jehovah thy God blesseth thee:"
05016011,5,16,11,"and thou shalt rejoice before Jehovah thy God, thou, and thy son, and thy daughter, and thy man-servant, and thy maid-servant, and the Levite that is within thy gates, and the sojourner, and the fatherless, and the widow, that are in the midst of thee, in the place which Jehovah thy God shall choose, to cause his name to dwell there."
05016012,5,16,12,And thou shalt remember that thou wast a bondman in Egypt: and thou shalt observe and do these statutes.
05016013,5,16,13,"Thou shalt keep the feast of tabernacles seven days, after that thou hast gathered in from thy threshing-floor and from thy winepress:"
05016014,5,16,14,"and thou shalt rejoice in thy feast, thou, and thy son, and thy daughter, and thy man-servant, and thy maid-servant, and the Levite, and the sojourner, and the fatherless, and the widow, that are within thy gates."
05016015,5,16,15,"Seven days shalt thou keep a feast unto Jehovah thy God in the place which Jehovah shall choose; because Jehovah thy God will bless thee in all thine increase, and in all the work of thy hands, and thou shalt be altogether joyful."
05016016,5,16,16,"Three times in a year shall all thy males appear before Jehovah thy God in the place which he shall choose: in the feast of unleavened bread, and in the feast of weeks, and in the feast of tabernacles; and they shall not appear before Jehovah empty:"
05016017,5,16,17,"every man shall give as he is able, according to the blessing of Jehovah thy God which he hath given thee."
05016018,5,16,18,"Judges and officers shalt thou make thee in all thy gates, which Jehovah thy God giveth thee, according to thy tribes; and they shall judge the people with righteous judgment."
05016019,5,16,19,"Thou shalt not wrest justice: thou shalt not respect persons; neither shalt thou take a bribe; for a bribe doth blind the eyes of the wise, and pervert the words of the righteous."
05016020,5,16,20,"That which is altogether just shalt thou follow, that thou mayest live, and inherit the land which Jehovah thy God giveth thee."
05016021,5,16,21,"Thou shalt not plant thee an Asherah of any kind of tree beside the altar of Jehovah thy God, which thou shalt make thee."
05016022,5,16,22,Neither shalt thou set thee up a pillar; which Jehovah thy God hateth.
05017001,5,17,1,"Thou shalt not sacrifice unto Jehovah thy God an ox, or a sheep, wherein is a blemish, `or' anything evil; for that is an abomination unto Jehovah thy God."
05017002,5,17,2,"If there be found in the midst of thee, within any of thy gates which Jehovah thy God giveth thee, man or woman, that doeth that which is evil in the sight of Jehovah thy God, in transgressing his covenant,"
05017003,5,17,3,"and hath gone and served other gods, and worshipped them, or the sun, or the moon, or any of the host of heaven, which I have not commanded;"
05017004,5,17,4,"and it be told thee, and thou hast heard of it, then shalt thou inquire diligently; and, behold, if it be true, and the thing certain, that such abomination is wrought in Israel,"
05017005,5,17,5,"then shalt thou bring forth that man or that woman, who hath done this evil thing, unto thy gates, even the man or the woman; and thou shalt stone them to death with stones."
05017006,5,17,6,"At the mouth of two witnesses, or three witnesses, shall he that is to die be put to death; at the mouth of one witness he shall not be put to death."
05017007,5,17,7,"The hand of the witnesses shall be first upon him to put him to death, and afterward the hand of all the people. So thou shalt put away the evil from the midst of thee."
05017008,5,17,8,"If there arise a matter too hard for thee in judgment, between blood and blood, between plea and plea, and between stroke and stroke, being matters of controversy within thy gates; then shalt thou arise, and get thee up unto the place which Jehovah thy God shall choose;"
05017009,5,17,9,"and thou shalt come unto the priests the Levites, and unto the judge that shall be in those days: and thou shalt inquire; and they shall show thee the sentence of judgment."
05017010,5,17,10,And thou shalt do according to the tenor of the sentence which they shall show thee from that place which Jehovah shall choose; and thou shalt observe to do according to all that they shall teach thee:
05017011,5,17,11,"according to the tenor of the law which they shall teach thee, and according to the judgment which they shall tell thee, thou shalt do; thou shalt not turn aside from the sentence which they shall show thee, to the right hand, nor to the left."
05017012,5,17,12,"And the man that doeth presumptuously, in not hearkening unto the priest that standeth to minister there before Jehovah thy God, or unto the judge, even that man shall die: and thou shalt put away the evil from Israel."
05017013,5,17,13,"And all the people shall hear, and fear, and do no more presumptuously."
05017014,5,17,14,"When thou art come unto the land which Jehovah thy God giveth thee, and shalt possess it, and shalt dwell therein, and shalt say, I will set a king over me, like all the nations that are round about me;"
05017015,5,17,15,"thou shalt surely set him king over thee, whom Jehovah thy God shall choose: one from among thy brethren shalt thou set king over thee; thou mayest not put a foreigner over thee, who is not thy brother."
05017016,5,17,16,"Only he shall not multiply horses to himself, nor cause the people to return to Egypt, to the end that he may multiply horses; forasmuch as Jehovah hath said unto you, Ye shall henceforth return no more that way."
05017017,5,17,17,"Neither shall he multiply wives to himself, that his heart turn not away: neither shall he greatly multiply to himself silver and gold."
05017018,5,17,18,"And it shall be, when he sitteth upon the throne of his kingdom, that he shall write him a copy of this law in a book, out of `that which is' before the priests the Levites:"
05017019,5,17,19,"and it shall be with him, and he shall read therein all the days of his life; that he may learn to fear Jehovah his God, to keep all the words of this law and these statutes, to do them;"
05017020,5,17,20,"that his heart be not lifted up above his brethren, and that he turn not aside from the commandment, to the right hand, or to the left: to the end that he may prolong his days in his kingdom, he and his children, in the midst of Israel."
05018001,5,18,1,"The priests the Levites, `even' all the tribe of Levi, shall have no portion nor inheritance with Israel: they shall eat the offerings of Jehovah made by fire, and his inheritance."
05018002,5,18,2,"And they shall have no inheritance among their brethren: Jehovah is their inheritance, as he hath spoken unto them."
05018003,5,18,3,"And this shall be the priests' due from the people, from them that offer a sacrifice, whether it be ox or sheep, that they shall give unto the priest the shoulder, and the two cheeks, and the maw."
05018004,5,18,4,"The first-fruits of thy grain, of thy new wine, and of thine oil, and the first of the fleece of thy sheep, shalt thou give him."
05018005,5,18,5,"For Jehovah thy God hath chosen him out of all thy tribes, to stand to minister in the name of Jehovah, him and his sons for ever."
05018006,5,18,6,"And if a Levite come from any of thy gates out of all Israel, where he sojourneth, and come with all the desire of his soul unto the place which Jehovah shall choose;"
05018007,5,18,7,"then he shall minister in the name of Jehovah his God, as all his brethren the Levites do, who stand there before Jehovah."
05018008,5,18,8,"They shall have like portions to eat, besides that which cometh of the sale of his patrimony."
05018009,5,18,9,"When thou art come into the land which Jehovah thy God giveth thee, thou shalt not learn to do after the abominations of those nations."
05018010,5,18,10,"There shall not be found with thee any one that maketh his son or his daughter to pass through the fire, one that useth divination, one that practiseth augury, or an enchanter, or a sorcerer,"
05018011,5,18,11,"or a charmer, or a consulter with a familiar spirit, or a wizard, or a necromancer."
05018012,5,18,12,For whosoever doeth these things is an abomination unto Jehovah: and because of these abominations Jehovah thy God doth drive them out from before thee.
05018013,5,18,13,Thou shalt be perfect with Jehovah thy God.
05018014,5,18,14,"For these nations, that thou shalt dispossess, hearken unto them that practise augury, and unto diviners; but as for thee, Jehovah thy God hath not suffered thee so to do."
05018015,5,18,15,"Jehovah thy God will raise up unto thee a prophet from the midst of thee, of thy brethren, like unto me; unto him ye shall hearken;"
05018016,5,18,16,"according to all that thou desiredst of Jehovah thy God in Horeb in the day of the assembly, saying, Let me not hear again the voice of Jehovah my God, neither let me see this great fire any more, that I die not."
05018017,5,18,17,"And Jehovah said unto me, They have well said that which they have spoken."
05018018,5,18,18,"I will raise them up a prophet from among their brethren, like unto thee; and I will put my words in his mouth, and he shall speak unto them all that I shall command him."
05018019,5,18,19,"And it shall come to pass, that whosoever will not hearken unto my words which he shall speak in my name, I will require it of him."
05018020,5,18,20,"But the prophet, that shall speak a word presumptuously in my name, which I have not commanded him to speak, or that shall speak in the name of other gods, that same prophet shall die."
05018021,5,18,21,"And if thou say in thy heart, How shall we know the word which Jehovah hath not spoken?"
05018022,5,18,22,"when a prophet speaketh in the name of Jehovah, if the thing follow not, nor come to pass, that is the thing which Jehovah hath not spoken: the prophet hath spoken it presumptuously, thou shalt not be afraid of him."
05019001,5,19,1,"When Jehovah thy God shall cut off the nations, whose land Jehovah thy God giveth thee, and thou succeedest them, and dwellest in their cities, and in their houses;"
05019002,5,19,2,"thou shalt set apart three cities for thee in the midst of thy land, which Jehovah thy God giveth thee to possess it."
05019003,5,19,3,"Thou shalt prepare thee the way, and divide the borders of thy land, which Jehovah thy God causeth thee to inherit, into three parts, that every manslayer may flee thither."
05019004,5,19,4,"And this is the case of the manslayer, that shall flee thither and live: whoso killeth his neighbor unawares, and hated him not in time past;"
05019005,5,19,5,"as when a man goeth into the forest with his neighbor to hew wood, and his hand fetcheth a stroke with the axe to cut down the tree, and the head slippeth from the helve, and lighteth upon his neighbor, so that he dieth; he shall flee unto one of these cities and live:"
05019006,5,19,6,"lest the avenger of blood pursue the manslayer, while his heart is hot, and overtake him, because the way is long, and smite him mortally; whereas he was not worthy of death, inasmuch as he hated him not in time past."
05019007,5,19,7,"Wherefore I command thee, saying, Thou shalt set apart three cities for thee."
05019008,5,19,8,"And if Jehovah thy God enlarge thy border, as he hath sworn unto thy fathers, and give thee all the land which he promised to give unto thy fathers;"
05019009,5,19,9,"if thou shalt keep all this commandment to do it, which I command thee this day, to love Jehovah thy God, and to walk ever in his ways; then shalt thou add three cities more for thee, besides these three:"
05019010,5,19,10,"that innocent blood be not shed in the midst of thy land, which Jehovah thy God giveth thee for an inheritance, and so blood be upon thee."
05019011,5,19,11,"But if any man hate his neighbor, and lie in wait for him, and rise up against him, and smite him mortally so that he dieth, and he flee into one of these cities;"
05019012,5,19,12,"then the elders of his city shall send and fetch him thence, and deliver him into the hand of the avenger of blood, that he may die."
05019013,5,19,13,"Thine eye shall not pity him, but thou shalt put away the innocent blood from Israel, that it may go well with thee."
05019014,5,19,14,"Thou shalt not remove thy neighbor's landmark, which they of old time have set, in thine inheritance which thou shalt inherit, in the land that Jehovah thy God giveth thee to possess it."
05019015,5,19,15,"One witness shall not rise up against a man for any iniquity, or for any sin, in any sin that he sinneth: at the mouth of two witnesses, or at the mouth of three witnesses, shall a matter be established."
05019016,5,19,16,"If an unrighteous witness rise up against any man to testify against him of wrong-doing,"
05019017,5,19,17,"then both the men, between whom the controversy is, shall stand before Jehovah, before the priests and the judges that shall be in those days;"
05019018,5,19,18,"and the judges shall make diligent inquisition: and, behold, if the witness be a false witness, and have testified falsely against his brother;"
05019019,5,19,19,"then shall ye do unto him, as he had thought to do unto his brother: so shalt thou put away the evil from the midst of thee."
05019020,5,19,20,"And those that remain shall hear, and fear, and shall henceforth commit no more any such evil in the midst of thee."
05019021,5,19,21,"And thine eyes shall not pity; life `shall go' for life, eye for eye, tooth for tooth, hand for hand, foot for foot."
05020001,5,20,1,"When thou goest forth to battle against thine enemies, and seest horses, and chariots, `and' a people more than thou, thou shalt not be afraid of them; for Jehovah thy God is with thee, who brought thee up out of the land of Egypt."
05020002,5,20,2,"And it shall be, when ye draw nigh unto the battle, that the priest shall approach and speak unto the people,"
05020003,5,20,3,"and shall say unto them, Hear, O Israel, ye draw nigh this day unto battle against your enemies: let not your heart faint; fear not, nor tremble, neither be ye affrighted at them;"
05020004,5,20,4,"for Jehovah your God is he that goeth with you, to fight for you against your enemies, to save you."
05020005,5,20,5,"And the officers shall speak unto the people, saying, What man is there that hath built a new house, and hath not dedicated it? let him go and return to his house, lest he die in the battle, and another man dedicate it."
05020006,5,20,6,"And what man is there that hath planted a vineyard, and hath not used the fruit thereof? let him go and return unto his house, lest he die in the battle, and another man use the fruit thereof."
05020007,5,20,7,"And what man is there that hath betrothed a wife, and hath not taken her? let him go and return unto his house, lest he die in the battle, and another man take her."
05020008,5,20,8,"And the officers shall speak further unto the people, and they shall say, What man is there that is fearful and faint-hearted? let him go and return unto his house, lest his brethren's heart melt as his heart."
05020009,5,20,9,"And it shall be, when the officers have made an end of speaking unto the people, that they shall appoint captains of hosts at the head of the people."
05020010,5,20,10,"When thou drawest nigh unto a city to fight against it, then proclaim peace unto it."
05020011,5,20,11,"And it shall be, if it make thee answer of peace, and open unto thee, then it shall be, that all the people that are found therein shall become tributary unto thee, and shall serve thee."
05020012,5,20,12,"And if it will make no peace with thee, but will make war against thee, then thou shalt besiege it:"
05020013,5,20,13,"and when Jehovah thy God delivereth it into thy hand, thou shalt smite every male thereof with the edge of the sword:"
05020014,5,20,14,"but the women, and the little ones, and the cattle, and all that is in the city, even all the spoil thereof, shalt thou take for a prey unto thyself; and thou shalt eat the spoil of thine enemies, which Jehovah thy God hath given thee."
05020015,5,20,15,"Thus shalt thou do unto all the cities which are very far off from thee, which are not of the cities of these nations."
05020016,5,20,16,"But of the cities of these peoples, that Jehovah thy God giveth thee for an inheritance, thou shalt save alive nothing that breatheth;"
05020017,5,20,17,"but thou shalt utterly destroy them: the Hittite, and the Amorite, the Canaanite, and the Perizzite, the Hivite, and the Jebusite; as Jehovah thy God hath commanded thee;"
05020018,5,20,18,"that they teach you not to do after all their abominations, which they have done unto their gods; so would ye sin against Jehovah your God."
05020019,5,20,19,"When thou shalt besiege a city a long time, in making war against it to take it, thou shalt not destroy the trees thereof by wielding an axe against them; for thou mayest eat of them, and thou shalt not cut them down; for is the tree of the field man, that it should be besieged of thee?"
05020020,5,20,20,"Only the trees of which thou knowest that they are not trees for food, thou shalt destroy and cut them down; and thou shalt build bulwarks against the city that maketh war with thee, until it fall."
05021001,5,21,1,"If one be found slain in the land which Jehovah thy God giveth thee to possess it, lying in the field, and it be not known who hath smitten him;"
05021002,5,21,2,"then thy elders and thy judges shall come forth, and they shall measure unto the cities which are round about him that is slain:"
05021003,5,21,3,"and it shall be, that the city which is nearest unto the slain man, even the elders of that city shall take a heifer of the herd, which hath not been wrought with, and which hath not drawn in the yoke;"
05021004,5,21,4,"and the elders of that city shall bring down the heifer unto a valley with running water, which is neither plowed nor sown, and shall break the heifer's neck there in the valley."
05021005,5,21,5,"And the priests the sons of Levi shall come near; for them Jehovah thy God hath chosen to minister unto him, and to bless in the name of Jehovah; and according to their word shall every controversy and every stroke be."
05021006,5,21,6,"And all the elders of that city, who are nearest unto the slain man, shall wash their hands over the heifer whose neck was broken in the valley;"
05021007,5,21,7,"and they shall answer and say, Our hands have not shed this blood, neither have our eyes seen it."
05021008,5,21,8,"Forgive, O Jehovah, thy people Israel, whom thou hast redeemed, and suffer not innocent blood `to remain' in the midst of thy people Israel. And the blood shall be forgiven them."
05021009,5,21,9,"So shalt thou put away the innocent blood from the midst of thee, when thou shalt do that which is right in the eyes of Jehovah."
05021010,5,21,10,"When thou goest forth to battle against thine enemies, and Jehovah thy God delivereth them into thy hands, and thou carriest them away captive,"
05021011,5,21,11,"and seest among the captives a beautiful woman, and thou hast a desire unto her, and wouldest take her to thee to wife;"
05021012,5,21,12,"then thou shalt bring her home to thy house; and she shall shave her head, and pare her nails;"
05021013,5,21,13,"and she shall put the raiment of her captivity from off her, and shall remain in thy house, and bewail her father and her mother a full month: and after that thou shalt go in unto her, and be her husband, and she shall be thy wife."
05021014,5,21,14,"And it shall be, if thou have no delight in her, then thou shalt let her go whither she will; but thou shalt not sell her at all for money, thou shalt not deal with her as a slave, because thou hast humbled her."
05021015,5,21,15,"If a man have two wives, the one beloved, and the other hated, and they have borne him children, both the beloved and the hated; and if the first-born son be hers that was hated;"
05021016,5,21,16,"then it shall be, in the day that he causeth his sons to inherit that which he hath, that he may not make the son of the beloved the first-born before the son of the hated, who is the first-born:"
05021017,5,21,17,"but he shall acknowledge the first-born, the son of the hated, by giving him a double portion of all that he hath; for he is the beginning of his strength; the right of the first-born is his."
05021018,5,21,18,"If a man have a stubborn and rebellious son, that will not obey the voice of his father, or the voice of his mother, and, though they chasten him, will not hearken unto them;"
05021019,5,21,19,"then shall his father and his mother lay hold on him, and bring him out unto the elders of his city, and unto the gate of his place;"
05021020,5,21,20,"and they shall say unto the elders of his city, This our son is stubborn and rebellious, he will not obey our voice; he is a glutton, and a drunkard."
05021021,5,21,21,"And all the men of his city shall stone him to death with stones: so shalt thou put away the evil from the midst of thee; and all Israel shall hear, and fear."
05021022,5,21,22,"And if a man have committed a sin worthy of death, and he be put to death, and thou hang him on a tree;"
05021023,5,21,23,"his body shall not remain all night upon the tree, but thou shalt surely bury him the same day; for he that is hanged is accursed of God; that thou defile not thy land which Jehovah thy God giveth thee for an inheritance."
05022001,5,22,1,"Thou shalt not see thy brother's ox or his sheep go astray, and hide thyself from them: thou shalt surely bring them again unto thy brother."
05022002,5,22,2,"And if thy brother be not nigh unto thee, or if thou know him not, then thou shalt bring it home to thy house, and it shall be with thee until thy brother seek after it, and thou shalt restore it to him."
05022003,5,22,3,"And so shalt thou do with his ass; and so shalt thou do with his garment; and so shalt thou do with every lost thing of thy brother's, which he hath lost, and thou hast found: thou mayest not hide thyself."
05022004,5,22,4,"Thou shalt not see thy brother's ass or his ox fallen down by the way, and hide thyself from them: thou shalt surely help him to lift them up again."
05022005,5,22,5,"A woman shall not wear that which pertaineth unto a man, neither shall a man put on a woman's garment; for whosoever doeth these things is an abomination unto Jehovah thy God."
05022006,5,22,6,"If a bird's nest chance to be before thee in the way, in any tree or on the ground, with young ones or eggs, and the dam sitting upon the young, or upon the eggs, thou shalt not take the dam with the young:"
05022007,5,22,7,"thou shalt surely let the dam go, but the young thou mayest take unto thyself; that it may be well with thee, and that thou mayest prolong thy days."
05022008,5,22,8,"When thou buildest a new house, then thou shalt make a battlement for thy roof, that thou bring not blood upon thy house, if any man fall from thence."
05022009,5,22,9,"Thou shalt not sow thy vineyard with two kinds of seed, lest the whole fruit be forfeited, the seed which thou hast sown, and the increase of the vineyard."
05022010,5,22,10,Thou shalt not plow with an ox and an ass together.
05022011,5,22,11,"Thou shalt not wear a mingled stuff, wool and linen together."
05022012,5,22,12,"Thou shalt make thee fringes upon the four borders of thy vesture, wherewith thou coverest thyself."
05022013,5,22,13,"If any man take a wife, and go in unto her, and hate her,"
05022014,5,22,14,"and lay shameful things to her charge, and bring up an evil name upon her, and say, I took this woman, and when I came nigh to her, I found not in her the tokens of virginity;"
05022015,5,22,15,"then shall the father of the damsel, and her mother, take and bring forth the tokens of the damsel's virginity unto the elders of the city in the gate;"
05022016,5,22,16,"and the damsel's father shall say unto the elders, I gave my daughter unto this man to wife, and he hateth her;"
05022017,5,22,17,"and, lo, he hath laid shameful things `to her charge', saying, I found not in thy daughter the tokens of virginity; and yet these are the tokens of my daughter's virginity. And they shall spread the garment before the elders of the city."
05022018,5,22,18,And the elders of that city shall take the man and chastise him;
05022019,5,22,19,"and they shall fine him a hundred `shekels' of silver, and give them unto the father of the damsel, because he hath brought up an evil name upon a virgin of Israel: and she shall be his wife; he may not put her away all his days."
05022020,5,22,20,"But if this thing be true, that the tokens of virginity were not found in the damsel;"
05022021,5,22,21,"then they shall bring out the damsel to the door of her father's house, and the men of her city shall stone her to death with stones, because she hath wrought folly in Israel, to play the harlot in her father's house: so shalt thou put away the evil from the midst of thee."
05022022,5,22,22,"If a man be found lying with a woman married to a husband, then they shall both of them die, the man that lay with the woman, and the woman: so shalt thou put away the evil from Israel."
05022023,5,22,23,"If there be a damsel that is a virgin betrothed unto a husband, and a man find her in the city, and lie with her;"
05022024,5,22,24,"then ye shall bring them both out unto the gate of that city, and ye shall stone them to death with stones; the damsel, because she cried not, being in the city; and the man, because he hath humbled his neighbor's wife: so thou shalt put away the evil from the midst of thee."
