19072010,19,72,10,The kings of Tarshish and of the isles shall render tribute: The kings of Sheba and Seba shall offer gifts.
19072011,19,72,11,"Yea, all kings shall fall down before him; All nations shall serve him."
19072012,19,72,12,"For he will deliver the needy when he crieth, And the poor, that hath no helper."
19072013,19,72,13,"He will have pity on the poor and needy, And the souls of the needy he will save."
19072014,19,72,14,He will redeem their soul from oppression and violence; And precious will their blood be in his sight:
19072015,19,72,15,And they shall live; and to him shall be given of the gold of Sheba: And men shall pray for him continually; They shall bless him all the day long.
19072016,19,72,16,There shall be abundance of grain in the earth upon the top of the mountains; The fruit thereof shall shake like Lebanon: And they of the city shall flourish like grass of the earth.
19072017,19,72,17,His name shall endure for ever; His name shall be continued as long as the sun: And men shall be blessed in him; All nations shall call him happy.
19072018,19,72,18,"Blessed be Jehovah God, the God of Israel, Who only doeth wondrous things:"
19072019,19,72,19,"And blessed be his glorious name for ever; And let the whole earth be filled with his glory. Amen, and Amen."
19072020,19,72,20,The prayers of David the son of Jesse are ended. Psalm 73 A Psalm of Asaph.
19073001,19,73,1,"Surely God is good to Israel, `Even' to such as are pure in heart."
19073002,19,73,2,"But as for me, my feet were almost gone; My steps had well nigh slipped."
19073003,19,73,3,"For I was envious at the arrogant, When I saw the prosperity of the wicked."
19073004,19,73,4,For there are no pangs in their death; But their strength is firm.
19073005,19,73,5,They are not in trouble as `other' men; Neither are they plagued like `other' men.
19073006,19,73,6,Therefore pride is as a chain about their neck; Violence covereth them as a garment.
19073007,19,73,7,Their eyes stand out with fatness: They have more than heart could wish.
19073008,19,73,8,"They scoff, and in wickedness utter oppression: They speak loftily."
19073009,19,73,9,"They have set their mouth in the heavens, And their tongue walketh through the earth."
19073010,19,73,10,Therefore his people return hither: And waters of a full `cup' are drained by them.
19073011,19,73,11,"And they say, How doth God know? And is there knowledge in the Most High?"
19073012,19,73,12,"Behold, these are the wicked; And, being alway at ease, they increase in riches."
19073013,19,73,13,"Surely in vain have I cleansed my heart, And washed my hands in innocency;"
19073014,19,73,14,"For all the day long have I been plagued, And chastened every morning."
19073015,19,73,15,"If I had said, I will speak thus; Behold, I had dealt treacherously with the generation of thy children."
19073016,19,73,16,"When I thought how I might know this, It was too painful for me;"
19073017,19,73,17,"Until I went into the sanctuary of God, And considered their latter end."
19073018,19,73,18,Surely thou settest them in slippery places: Thou castest them down to destruction.
19073019,19,73,19,How are they become a desolation in a moment! They are utterly consumed with terrors.
19073020,19,73,20,"As a dream when one awaketh, So, O Lord, when thou awakest, thou wilt despise their image."
19073021,19,73,21,"For my soul was grieved, And I was pricked in my heart:"
19073022,19,73,22,"So brutish was I, and ignorant; I was `as' a beast before thee."
19073023,19,73,23,Nevertheless I am continually with thee: Thou hast holden my right hand.
19073024,19,73,24,"Thou wilt guide me with thy counsel, And afterward receive me to glory."
19073025,19,73,25,Whom have I in heaven `but thee'? And there is none upon earth that I desire besides thee.
19073026,19,73,26,My flesh and my heart faileth; `But' God is the strength of my heart and my portion for ever.
19073027,19,73,27,"For, lo, they that are far from thee shall perish: Thou hast destroyed all them that play the harlot, `departing' from thee."
19073028,19,73,28,"But it is good for me to draw near unto God: I have made the Lord Jehovah my refuge, That I may tell of all thy works. Psalm 74 Maschil of Asaph."
19074001,19,74,1,"O God, why hast thou cast `us' off for ever? Why doth thine anger smoke against the sheep of thy pasture?"
19074002,19,74,2,"Remember thy congregation, which thou hast gotten of old, Which thou hast redeemed to be the tribe of thine inheritance; `And' mount Zion, wherein thou hast dwelt."
19074003,19,74,3,"Lift up thy feet unto the perpetual ruins, All the evil that the enemy hath done in the sanctuary."
19074004,19,74,4,Thine adversaries have roared in the midst of thine assembly; They have set up their ensigns for signs.
19074005,19,74,5,They seemed as men that lifted up Axes upon a thicket of trees.
19074006,19,74,6,And now all the carved work thereof They break down with hatchet and hammers.
19074007,19,74,7,They have set thy sanctuary on fire; They have profaned the dwelling-place of thy name `by casting it' to the ground.
19074008,19,74,8,"They said in their heart, Let us make havoc of them altogether: They have burned up all the synagogues of God in the land."
19074009,19,74,9,We see not our signs: There is no more any prophet; Neither is there among us any that knoweth how long.
19074010,19,74,10,"How long, O God, shall the adversary reproach? Shall the enemy blaspheme thy name for ever?"
19074011,19,74,11,"Why drawest thou back thy hand, even thy right hand? `Pluck it' out of thy bosom `and' consume `them'."
19074012,19,74,12,"Yet God is my King of old, Working salvation in the midst of the earth."
19074013,19,74,13,Thou didst divide the sea by thy strength: Thou brakest the heads of the sea-monsters in the waters.
19074014,19,74,14,Thou brakest the heads of leviathan in pieces; Thou gavest him to be food to the people inhabiting the wilderness.
19074015,19,74,15,Thou didst cleave fountain and flood: Thou driedst up mighty rivers.
19074016,19,74,16,"The day is thine, the night also is thine: Thou hast prepared the light and the sun."
19074017,19,74,17,Thou hast set all the borders of the earth: Thou hast made summer and winter.
19074018,19,74,18,"Remember this, that the enemy hath reproached, O Jehovah, And that a foolish people hath blasphemed thy name."
19074019,19,74,19,Oh deliver not the soul of thy turtle-dove unto the wild beast: Forget not the life of thy poor for ever.
19074020,19,74,20,Have respect unto the covenant; For the dark places of the earth are full of the habitations of violence.
19074021,19,74,21,Oh let not the oppressed return ashamed: Let the poor and needy praise thy name.
19074022,19,74,22,"Arise, O God, plead thine own cause: Remember how the foolish man reproacheth thee all the day."
19074023,19,74,23,Forget not the voice of thine adversaries: The tumult of those that rise up against thee ascendeth continually. Psalm 75 For the Chief Musician; `set to' Al-tash-heth. A Psalm of Asaph; a song.
19075001,19,75,1,"We give thanks unto thee, O God; We give thanks, for thy name is near: Men tell of thy wondrous works."
19075002,19,75,2,"When I shall find the set time, I will judge uprightly."
19075003,19,75,3,The earth and all the inhabitants thereof are dissolved: I have set up the pillars of it. Selah
19075004,19,75,4,"I said unto the arrogant, Deal not arrogantly; And to the wicked, Lift not up the horn:"
19075005,19,75,5,Lift not up your horn on high; Speak not with a stiff neck.
19075006,19,75,6,"For neither from the east, nor from the west, Nor yet from the south, `cometh' lifting up."
19075007,19,75,7,"But God is the judge: He putteth down one, and lifteth up another."
19075008,19,75,8,"For in the hand of Jehovah there is a cup, and the wine foameth; It is full of mixture, and he poureth out of the same: Surely the dregs thereof, all the wicked of the earth shall drain them, and drink them."
19075009,19,75,9,"But I will declare for ever, I will sing praises to the God of Jacob."
19075010,19,75,10,"All the horns of the wicked also will I cut off; But the horns of the righteous shall be lifted up. Psalm 76 For the Chief Musician; on stringed instruments. A Psalm of Asaph, a song."
19076001,19,76,1,In Judah is God known: His name is great in Israel.
19076002,19,76,2,"In Salem also is his tabernacle, And his dwelling-place in Zion."
19076003,19,76,3,"There he brake the arrows of the bow; The shield, and the sword, and the battle. Selah"
19076004,19,76,4,"Glorious art thou `and' excellent, From the mountains of prey."
19076005,19,76,5,"The stouthearted are made a spoil, They have slept their sleep; And none of the men of might have found their hands."
19076006,19,76,6,"At thy rebuke, O God of Jacob, Both chariot and horse are cast into a deep sleep."
19076007,19,76,7,"Thou, even thou, art to be feared; And who may stand in thy sight when once thou art angry?"
19076008,19,76,8,"Thou didst cause sentence to be heard from heaven; The earth feared, and was still,"
19076009,19,76,9,"When God arose to judgment, To save all the meek of the earth. Selah"
19076010,19,76,10,Surely the wrath of man shall praise thee: The residue of wrath shalt thou gird upon thee.
19076011,19,76,11,"Vow, and pay unto Jehovah your God: Let all that are round about him bring presents unto him that ought to be feared."
19076012,19,76,12,He will cut off the spirit of princes: He is terrible to the kings of the earth. Psalm 77 For the Chief Musician; after the manner of Jeduthan. A Psalm of Asaph.
19077001,19,77,1,"I will cry unto God with my voice, Even unto God with my voice; and he will give ear unto me."
19077002,19,77,2,"In the day of my trouble I sought the Lord: My hand was stretched out in the night, and slacked not; My soul refused to be comforted."
19077003,19,77,3,"I remember God, and am disquieted: I complain, and my spirit is overwhelmed. Selah"
19077004,19,77,4,Thou holdest mine eyes watching: I am so troubled that I cannot speak.
19077005,19,77,5,"I have considered the days of old, The years of ancient times."
19077006,19,77,6,I call to remembrance my song in the night: I commune with mine own heart; And my spirit maketh diligent search.
19077007,19,77,7,Will the Lord cast off for ever? And will he be favorable no more?
19077008,19,77,8,Is his lovingkindness clean gone for ever? Doth his promise fail for evermore?
19077009,19,77,9,Hath God forgotten to be gracious? Hath he in anger shut up his tender mercies? Selah
19077010,19,77,10,"And I said, This is my infirmity; `But I will remember' the years of the right hand of the Most High."
19077011,19,77,11,I will make mention of the deeds of Jehovah; For I will remember thy wonders of old.
19077012,19,77,12,"I will meditate also upon all thy work, And muse on thy doings."
19077013,19,77,13,"Thy way, O God, is in the sanctuary: Who is a great god like unto God?"
19077014,19,77,14,Thou art the God that doest wonders: Thou hast made known thy strength among the peoples.
19077015,19,77,15,"Thou hast with thine arm redeemed thy people, The sons of Jacob and Joseph. Selah"
19077016,19,77,16,"The waters saw thee, O God; The waters saw thee, they were afraid: The depths also trembled."
19077017,19,77,17,The clouds poured out water; The skies sent out a sound: Thine arrows also went abroad.
19077018,19,77,18,The voice of thy thunder was in the whirlwind; The lightnings lightened the world: The earth trembled and shook.
19077019,19,77,19,"Thy way was in the sea, And thy paths in the great waters, And thy footsteps were not known."
19077020,19,77,20,"Thou leddest thy people like a flock, By the hand of Moses and Aaron. Psalm 78 Maschil of Asaph."
19078001,19,78,1,"Give ear, O my people, to my law: Incline your ears to the words of my mouth."
19078002,19,78,2,"I will open my mouth in a parable; I will utter dark sayings of old,"
19078003,19,78,3,"Which we have heard and known, And our fathers have told us."
19078004,19,78,4,"We will not hide them from their children, Telling to the generation to come the praises of Jehovah, And his strength, and his wondrous works that he hath done."
19078005,19,78,5,"For he established a testimony in Jacob, And appointed a law in Israel, Which he commanded our fathers, That they should make them known to their children;"
19078006,19,78,6,"That the generation to come might know `them', even the children that should be born; Who should arise and tell `them' to their children,"
19078007,19,78,7,"That they might set their hope in God, And not forget the works of God, But keep his commandments,"
19078008,19,78,8,"And might not be as their fathers, A stubborn and rebellious generation, A generation that set not their heart aright, And whose spirit was not stedfast with God."
19078009,19,78,9,"The children of Ephraim, being armed and carrying bows, Turned back in the day of battle."
19078010,19,78,10,"They kept not the covenant of God, And refused to walk in his law;"
19078011,19,78,11,"And they forgat his doings, And his wondrous works that he had showed them."
19078012,19,78,12,"Marvellous things did he in the sight of their fathers, In the land of Egypt, in the field of Zoan."
19078013,19,78,13,"He clave the sea, and caused them to pass through; And he made the waters to stand as a heap."
19078014,19,78,14,"In the day-time also he led them with a cloud, And all the night with a light of fire."
19078015,19,78,15,"He clave rocks in the wilderness, And gave them drink abundantly as out of the depths."
19078016,19,78,16,"He brought streams also out of the rock, And caused waters to run down like rivers."
19078017,19,78,17,"Yet went they on still to sin against him, To rebel against the Most High in the desert."
19078018,19,78,18,And they tempted God in their heart By asking food according to their desire.
19078019,19,78,19,"Yea, they spake against God; They said, Can God prepare a table in the wilderness?"
19078020,19,78,20,"Behold, he smote the rock, so that waters gushed out, And streams overflowed; Can he give bread also? Will he provide flesh for his people?"
19078021,19,78,21,"Therefore Jehovah heard, and was wroth; And a fire was kindled against Jacob, And anger also went up against Israel;"
19078022,19,78,22,"Because they believed not in God, And trusted not in his salvation."
19078023,19,78,23,"Yet he commanded the skies above, And opened the doors of heaven;"
19078024,19,78,24,"And he rained down manna upon them to eat, And gave them food from heaven."
19078025,19,78,25,Man did eat the bread of the mighty: He sent them food to the full.
19078026,19,78,26,He caused the east wind to blow in the heavens; And by his power he guided the south wind.
19078027,19,78,27,"He rained flesh also upon them as the dust, And winged birds as the sand of the seas:"
19078028,19,78,28,"And he let it fall in the midst of their camp, Round about their habitations."
19078029,19,78,29,"So they did eat, and were well filled; And he gave them their own desire."
19078030,19,78,30,"They were not estranged from that which they desired, Their food was yet in their mouths,"
19078031,19,78,31,"When the anger of God went up against them, And slew of the fattest of them, And smote down the young men of Israel."
19078032,19,78,32,"For all this they sinned still, And believed not in his wondrous works."
19078033,19,78,33,"Therefore their days did he consume in vanity, And their years in terror."
19078034,19,78,34,"When he slew them, then they inquired after him; And they returned and sought God earnestly."
19078035,19,78,35,"And they remembered that God was their rock, And the Most High God their redeemer."
19078036,19,78,36,"But they flattered him with their mouth, And lied unto him with their tongue."
19078037,19,78,37,"For their heart was not right with him, Neither were they faithful in his covenant."
19078038,19,78,38,"But he, being merciful, forgave `their' iniquity, and destroyed `them' not: Yea, many a time turned he his anger away, And did not stir up all his wrath."
19078039,19,78,39,"And he remembered that they were but flesh, A wind that passeth away, and cometh not again."
19078040,19,78,40,"How oft did they rebel against him in the wilderness, And grieve him in the desert!"
19078041,19,78,41,"And they turned again and tempted God, And provoked the Holy One of Israel."
19078042,19,78,42,"They remember not his hand, Nor the day when he redeemed them from the adversary;"
19078043,19,78,43,"How he set his signs in Egypt, And his wonders in the field of Zoan,"
19078044,19,78,44,"And turned their rivers into blood, And their streams, so that they could not drink."
19078045,19,78,45,"He sent among them swarms of flies, which devoured them; And frogs, which destroyed them."
19078046,19,78,46,"He gave also their increase unto the caterpillar, And their labor unto the locust."
19078047,19,78,47,"He destroyed their vines with hail, And their sycomore-trees with frost."
19078048,19,78,48,"He gave over their cattle also to the hail, And their flocks to hot thunderbolts."
19078049,19,78,49,"He cast upon them the fierceness of his anger, Wrath, and indignation, and trouble, A band of angels of evil."
19078050,19,78,50,"He made a path for his anger; He spared not their soul from death, But gave their life over to the pestilence,"
19078051,19,78,51,"And smote all the first-born in Egypt, The chief of their strength in the tents of Ham."
19078052,19,78,52,"But he led forth his own people like sheep, And guided them in the wilderness like a flock."
19078053,19,78,53,"And he led them safely, so that they feared not; But the sea overwhelmed their enemies."
19078054,19,78,54,"And he brought them to the border of his sanctuary, To this mountain, which his right hand had gotten."
19078055,19,78,55,"He drove out the nations also before them, And allotted them for an inheritance by line, And made the tribes of Israel to dwell in their tents."
19078056,19,78,56,"Yet they tempted and rebelled against the Most High God, And kept not his testimonies;"
19078057,19,78,57,"But turned back, and dealt treacherously like their fathers: They were turned aside like a deceitful bow."
19078058,19,78,58,"For they provoked him to anger with their high places, And moved him to jealousy with their graven images."
19078059,19,78,59,"When God heard `this', he was wroth, And greatly abhorred Israel;"
19078060,19,78,60,"So that he forsook the tabernacle of Shiloh, The tent which he placed among men;"
19078061,19,78,61,"And delivered his strength into captivity, And his glory into the adversary's hand."
19078062,19,78,62,"He gave his people over also unto the sword, And was wroth with his inheritance."
19078063,19,78,63,Fire devoured their young men; And their virgins had no marriage-song.
19078064,19,78,64,Their priests fell by the sword; And their widows made no lamentation.
19078065,19,78,65,"Then the Lord awaked as one out of sleep, Like a mighty man that shouteth by reason of wine."
19078066,19,78,66,And he smote his adversaries backward: He put them to a perpetual reproach.
19078067,19,78,67,"Moreover he refused the tent of Joseph, And chose not the tribe of Ephraim,"
19078068,19,78,68,"But chose the tribe of Judah, The mount Zion which he loved."
19078069,19,78,69,"And he built his sanctuary like the heights, Like the earth which he hath established for ever."
19078070,19,78,70,"He chose David also his servant, And took him from the sheepfolds:"
19078071,19,78,71,"From following the ewes that have their young he brought him, To be the shepherd of Jacob his people, and Israel his inheritance."
19078072,19,78,72,"So he was their shepherd according to the integrity of his heart, And guided them by the skilfulness of his hands. Psalm 79 A Psalm of Asaph."
19079001,19,79,1,"O God, the nations are come into thine inheritance; Thy holy temple have they defiled; They have laid Jerusalem in heaps."
19079002,19,79,2,"The dead bodies of thy servants have they given to be food unto the birds of the heavens, The flesh of thy saints unto the beasts of the earth."
19079003,19,79,3,Their blood have they shed like water round about Jerusalem; And there was none to bury them.
19079004,19,79,4,"We are become a reproach to our neighbors, A scoffing and derision to them that are round about us."
19079005,19,79,5,"How long, O Jehovah? wilt thou be angry for ever? Shall thy jealousy burn like fire?"
19079006,19,79,6,"Pour out thy wrath upon the nations that know thee not, And upon the kingdoms that call not upon thy name."
19079007,19,79,7,"For they have devoured Jacob, And laid waste his habitation."
19079008,19,79,8,Remember not against us the iniquities of our forefathers: Let thy tender mercies speedily meet us; For we are brought very low.
19079009,19,79,9,"Help us, O God of our salvation, for the glory of thy name; And deliver us, and forgive our sins, for thy name's sake."
19079010,19,79,10,"Wherefore should the nations say, Where is their God? Let the avenging of the blood of thy servants which is shed Be known among the nations in our sight."
19079011,19,79,11,Let the sighing of the prisoner come before thee: According to the greatness of thy power preserve thou those that are appointed to death;
19079012,19,79,12,"And render unto our neighbors sevenfold into their bosom Their reproach, wherewith they have reproached thee, O Lord."
19079013,19,79,13,"So we thy people and sheep of thy pasture Will give thee thanks for ever: We will show forth thy praise to all generations. Psalm 80 For the Chief Musician, set to Shoshanim Eduth.. A Psalm of Asaph."
19080001,19,80,1,"Give ear, O Shepherd of Israel, Thou that leadest Joseph like a flock; Thou that sittest `above' the cherubim, shine forth."
19080002,19,80,2,"Before Ephraim and Benjamin and Manasseh, stir up thy might, And come to save us."
19080003,19,80,3,"Turn us again, O God; And cause thy face to shine, and we shall be saved."
19080004,19,80,4,"O Jehovah God of hosts, How long wilt thou be angry against the prayer of thy people?"
19080005,19,80,5,"Thou hast fed them with the bread of tears, And given them tears to drink in large measure."
19080006,19,80,6,Thou makest us a strife unto our neighbors; And our enemies laugh among themselves.
19080007,19,80,7,"Turn us again, O God of hosts; And cause thy face to shine, and we shall be saved."
19080008,19,80,8,"Thou broughtest a vine out of Egypt: Thou didst drive out the nations, and plantedst it."
19080009,19,80,9,"Thou preparedst `room' before it, And it took deep root, and filled the land."
19080010,19,80,10,"The mountains were covered with the shadow of it, And the boughs thereof were `like' cedars of God."
19080011,19,80,11,"It sent out its branches unto the sea, And its shoots unto the River."
19080012,19,80,12,"Why hast thou broken down its walls, So that all they that pass by the way do pluck it?"
19080013,19,80,13,"The boar out of the wood doth ravage it, And the wild beasts of the field feed on it."
19080014,19,80,14,"Turn again, we beseech thee, O God of hosts: Look down from heaven, and behold, and visit this vine,"
19080015,19,80,15,"And the stock which thy right hand planted, And the branch that thou madest strong for thyself."
19080016,19,80,16,"It is burned with fire, it is cut down: They perish at the rebuke of thy countenance."
19080017,19,80,17,"Let thy hand be upon the man of thy right hand, Upon the son of man whom thou madest strong for thyself."
19080018,19,80,18,"So shall we not go back from thee: Quicken thou us, and we will call upon thy name."
19080019,19,80,19,"Turn us again, O Jehovah God of hosts; Cause thy face to shine, and we shall be saved. Psalm 81 For the Chief Musician; set to the Gittith. `A Psalm' of Asaph."
19081001,19,81,1,Sing aloud unto God our strength: Make a joyful noise unto the God of Jacob.
19081002,19,81,2,"Raise a song, and bring hither the timbrel, The pleasant harp with the psaltery."
19081003,19,81,3,"Blow the trumpet at the new moon, At the full moon, on our feast-day."
19081004,19,81,4,"For it is a statute for Israel, An ordinance of the God of Jacob."
19081005,19,81,5,"He appointed it in Joseph for a testimony, When he went out over the land of Egypt, `Where' I heard a language that I knew not."
19081006,19,81,6,I removed his shoulder from the burden: His hands were freed from the basket.
19081007,19,81,7,"Thou calledst in trouble, and I delivered thee; I answered thee in the secret place of thunder; I proved thee at the waters of Meribah. Selah"
19081008,19,81,8,"Hear, O my people, and I will testify unto thee: O Israel, if thou wouldest hearken unto me!"
19081009,19,81,9,There shall no strange god be in thee; Neither shalt thou worship any foreign god.
19081010,19,81,10,"I am Jehovah thy God, Who brought thee up out of the land of Egypt: Open thy mouth wide, and I will fill it."
19081011,19,81,11,But my people hearkened not to my voice; And Israel would none of me.
19081012,19,81,12,"So I let them go after the stubbornness of their heart, That they might walk in their own counsels."
19081013,19,81,13,"Oh that my people would hearken unto me, That Israel would walk in my ways!"
19081014,19,81,14,"I would soon subdue their enemies, And turn my hand against their adversaries."
19081015,19,81,15,The haters of Jehovah should submit themselves unto him: But their time should endure for ever.
19081016,19,81,16,He would feed them also with the finest of the wheat; And with honey out of the rock would I satisfy thee. Psalm 82 A Psalm of Asaph.
19082001,19,82,1,God standeth in the congregation of God; He judgeth among the gods.
19082002,19,82,2,"How long will ye judge unjustly, And respect the persons of the wicked? Selah"
19082003,19,82,3,Judge the poor and fatherless: Do justice to the afflicted and destitute.
19082004,19,82,4,Rescue the poor and needy: Deliver them out of the hand of the wicked.
19082005,19,82,5,"They know not, neither do they understand; They walk to and fro in darkness: All the foundations of the earth are shaken."
