05022025,5,22,25,"But if the man find the damsel that is betrothed in the field, and the man force her, and lie with her; then the man only that lay with her shall die:"
05022026,5,22,26,"but unto the damsel thou shalt do nothing; there is in the damsel no sin worthy of death: for as when a man riseth against his neighbor, and slayeth him, even so is this matter;"
05022027,5,22,27,"for he found her in the field, the betrothed damsel cried, and there was none to save her."
05022028,5,22,28,"If a man find a damsel that is a virgin, that is not betrothed, and lay hold on her, and lie with her, and they be found;"
05022029,5,22,29,"then the man that lay with her shall give unto the damsel's father fifty `shekels' of silver, and she shall be his wife, because he hath humbled her; he may not put her away all his days."
05022030,5,22,30,"A man shall not take his father's wife, and shall not uncover his father's skirt."
05023001,5,23,1,"He that is wounded in the stones, or hath his privy member cut off, shall not enter into the assembly of Jehovah."
05023002,5,23,2,A bastard shall not enter into the assembly of Jehovah; even to the tenth generation shall none of his enter into the assembly of Jehovah.
05023003,5,23,3,An Ammonite or a Moabite shall not enter into the assembly of Jehovah; even to the tenth generation shall none belonging to them enter into the assembly of Jehovah for ever:
05023004,5,23,4,"because they met you not with bread and with water in the way, when ye came forth out of Egypt, and because they hired against thee Balaam the son of Beor from Pethor of Mesopotamia, to curse thee."
05023005,5,23,5,"Nevertheless Jehovah thy God would not hearken unto Balaam; but Jehovah thy God turned the curse into a blessing unto thee, because Jehovah thy God loved thee."
05023006,5,23,6,Thou shalt not seek their peace nor their prosperity all thy days for ever.
05023007,5,23,7,"Thou shalt not abhor an Edomite; for he is thy brother: thou shalt not abhor an Egyptian, because thou wast a sojourner in his land."
05023008,5,23,8,The children of the third generation that are born unto them shall enter into the assembly of Jehovah.
05023009,5,23,9,"When thou goest forth in camp against thine enemies, then thou shalt keep thee from every evil thing."
05023010,5,23,10,"If there be among you any man, that is not clean by reason of that which chanceth him by night, then shall he go abroad out of the camp, he shall not come within the camp:"
05023011,5,23,11,"but it shall be, when evening cometh on, he shall bathe himself in water; and when the sun is down, he shall come within the camp."
05023012,5,23,12,"Thou shalt have a place also without the camp, whither thou shalt go forth abroad:"
05023013,5,23,13,"and thou shalt have a paddle among thy weapons; and it shall be, when thou sittest down abroad, thou shalt dig therewith, and shalt turn back and cover that which cometh from thee:"
05023014,5,23,14,"for Jehovah thy God walketh in the midst of thy camp, to deliver thee, and to give up thine enemies before thee; therefore shall thy camp be holy, that he may not see an unclean thing in thee, and turn away from thee."
05023015,5,23,15,Thou shalt not deliver unto his master a servant that is escaped from his master unto thee:
05023016,5,23,16,"he shall dwell with thee, in the midst of thee, in the place which he shall choose within one of thy gates, where it pleaseth him best: thou shalt not oppress him."
05023017,5,23,17,"There shall be no prostitute of the daughters of Israel, neither shall there be a sodomite of the sons of Israel."
05023018,5,23,18,"Thou shalt not bring the hire of a harlot, or the wages of a dog, into the house of Jehovah thy God for any vow: for even both these are an abomination unto Jehovah thy God."
05023019,5,23,19,"Thou shalt not lend upon interest to thy brother; interest of money, interest of victuals, interest of anything that is lent upon interest:"
05023020,5,23,20,"unto a foreigner thou mayest lend upon interest; but unto thy brother thou shalt not lend upon interest, that Jehovah thy God may bless thee in all that thou puttest thy hand unto, in the land whither thou goest in to possess it."
05023021,5,23,21,"When thou shalt vow a vow unto Jehovah thy God, thou shalt not be slack to pay it: for Jehovah thy God will surely require it of thee; and it would be sin in thee."
05023022,5,23,22,"But if thou shalt forbear to vow, it shall be no sin in thee."
05023023,5,23,23,"That which is gone out of thy lips thou shalt observe and do; according as thou hast vowed unto Jehovah thy God, a freewill-offering, which thou hast promised with thy mouth."
05023024,5,23,24,"When thou comest into thy neighbor's vineyard, then thou mayest eat of grapes thy fill at thine own pleasure; but thou shalt not put any in thy vessel."
05023025,5,23,25,"When thou comest into thy neighbor's standing grain, then thou mayest pluck the ears with thy hand; but thou shalt not move a sickle unto thy neighbor's standing grain."
05024001,5,24,1,"When a man taketh a wife, and marrieth her, then it shall be, if she find no favor in his eyes, because he hath found some unseemly thing in her, that he shall write her a bill of divorcement, and give it in her hand, and send her out of his house."
05024002,5,24,2,"And when she is departed out of his house, she may go and be another man's `wife'."
05024003,5,24,3,"And if the latter husband hate her, and write her a bill of divorcement, and give it in her hand, and send her out of his house; or if the latter husband die, who took her to be his wife;"
05024004,5,24,4,"her former husband, who sent her away, may not take her again to be his wife, after that she is defiled; for that is abomination before Jehovah: and thou shalt not cause the land to sin, which Jehovah thy God giveth thee for an inheritance."
05024005,5,24,5,"When a man taketh a new wife, he shall not go out in the host, neither shall he be charged with any business: he shall be free at home one year, and shall cheer his wife whom he hath taken."
05024006,5,24,6,No man shall take the mill or the upper millstone to pledge; for he taketh `a man's' life to pledge.
05024007,5,24,7,"If a man be found stealing any of his brethren of the children of Israel, and he deal with him as a slave, or sell him; then that thief shall die: so shalt thou put away the evil from the midst of thee."
05024008,5,24,8,"Take heed in the plague of leprosy, that thou observe diligently, and do according to all that the priests the Levites shall teach you: as I commanded them, so ye shall observe to do."
05024009,5,24,9,"Remember what Jehovah thy God did unto Miriam, by the way as ye came forth out of Egypt."
05024010,5,24,10,"When thou dost lend thy neighbor any manner of loan, thou shalt not go into his house to fetch his pledge."
05024011,5,24,11,"Thou shalt stand without, and the man to whom thou dost lend shall bring forth the pledge without unto thee."
05024012,5,24,12,"And if he be a poor man, thou shalt not sleep with his pledge;"
05024013,5,24,13,"thou shalt surely restore to him the pledge when the sun goeth down, that he may sleep in his garment, and bless thee: and it shall be righteousness unto thee before Jehovah thy God."
05024014,5,24,14,"Thou shalt not oppress a hired servant that is poor and needy, whether he be of thy brethren, or of thy sojourners that are in thy land within thy gates:"
05024015,5,24,15,"in his day thou shalt give him his hire, neither shall the sun go down upon it; for he is poor, and setteth his heart upon it: lest he cry against thee unto Jehovah, and it be sin unto thee."
05024016,5,24,16,"The fathers shall not be put to death for the children, neither shall the children be put to death for the fathers: every man shall be put to death for his own sin."
05024017,5,24,17,"Thou shalt not wrest the justice `due' to the sojourner, `or' to the fatherless, nor take the widow's raiment to pledge;"
05024018,5,24,18,"but thou shalt remember that thou wast a bondman in Egypt, and Jehovah thy God redeemed thee thence: therefore I command thee to do this thing."
05024019,5,24,19,"When thou reapest thy harvest in thy field, and hast forgot a sheaf in the field, thou shalt not go again to fetch it: it shall be for the sojourner, for the fatherless, and for the widow; that Jehovah thy God may bless thee in all the work of thy hands."
05024020,5,24,20,"When thou beatest thine olive-tree, thou shalt not go over the boughs again: it shall be for the sojourner, for the fatherless, and for the widow."
05024021,5,24,21,"When thou gatherest `the grapes of' thy vineyard, thou shalt not glean it after thee: it shall be for the sojourner, for the fatherless, and for the widow."
05024022,5,24,22,And thou shalt remember that thou wast a bondman in the land of Egypt: therefore I command thee to do this thing.
05025001,5,25,1,"If there be a controversy between men, and they come unto judgment, and `the judges' judge them; then they shall justify the righteous, and condemn the wicked;"
05025002,5,25,2,"and it shall be, if the wicked man be worthy to be beaten, that the judge shall cause him to lie down, and to be beaten before his face, according to his wickedness, by number."
05025003,5,25,3,"Forty stripes he may give him, he shall not exceed; lest, if he should exceed, and beat him above these with many stripes, then thy brother should seem vile unto thee."
05025004,5,25,4,Thou shalt not muzzle the ox when he treadeth out `the grain'.
05025005,5,25,5,"If brethren dwell together, and one of them die, and have no son, the wife of the dead shall not be married without unto a stranger: her husband's brother shall go in unto her, and take her to him to wife, and perform the duty of a husband's brother unto her."
05025006,5,25,6,"And it shall be, that the first-born that she beareth shall succeed in the name of his brother that is dead, that his name be not blotted out of Israel."
05025007,5,25,7,"And if the man like not to take his brother's wife, then his brother's wife shall go up to the gate unto the elders, and say, My husband's brother refuseth to raise up unto his brother a name in Israel; he will not perform the duty of a husband's brother unto me."
05025008,5,25,8,"Then the elders of his city shall call him, and speak unto him: and if he stand, and say, I like not to take her;"
05025009,5,25,9,"then shall his brother's wife come unto him in the presence of the elders, and loose his shoe from off his foot, and spit in his face; and she shall answer and say, So shall it be done unto the man that doth not build up his brother's house."
05025010,5,25,10,"And his name shall be called in Israel, The house of him that hath his shoe loosed."
05025011,5,25,11,"When men strive together one with another, and the wife of the one draweth near to deliver her husband out of the hand of him that smiteth him, and putteth forth her hand, and taketh him by the secrets;"
05025012,5,25,12,"then thou shalt cut off her hand, thine eye shall have no pity."
05025013,5,25,13,"Thou shalt not have in thy bag diverse weights, a great and a small."
05025014,5,25,14,"Thou shalt not have in thy house diverse measures, a great and a small."
05025015,5,25,15,A perfect and just weight shalt thou have; a perfect and just measure shalt thou have: that thy days may be long in the land which Jehovah thy God giveth thee.
05025016,5,25,16,"For all that do such things, `even' all that do unrighteously, are an abomination unto Jehovah thy God."
05025017,5,25,17,Remember what Amalek did unto thee by the way as ye came forth out of Egypt;
05025018,5,25,18,"how he met thee by the way, and smote the hindmost of thee, all that were feeble behind thee, when thou wast faint and weary; and he feared not God."
05025019,5,25,19,"Therefore it shall be, when Jehovah thy God hath given thee rest from all thine enemies round about, in the land which Jehovah thy God giveth thee for an inheritance to possess it, that thou shalt blot out the remembrance of Amalek from under heaven; thou shalt not forget."
05026001,5,26,1,"And it shall be, when thou art come in unto the land which Jehovah thy God giveth thee for an inheritance, and possessest it, and dwellest therein,"
05026002,5,26,2,"that thou shalt take of the first of all the fruit of the ground, which thou shalt bring in from thy land that Jehovah thy God giveth thee; and thou shalt put it in a basket, and shalt go unto the place which Jehovah thy God shall choose, to cause his name to dwell there."
05026003,5,26,3,"And thou shalt come unto the priest that shall be in those days, and say unto him, I profess this day unto Jehovah thy God, that I am come unto the land which Jehovah sware unto our fathers to give us."
05026004,5,26,4,"And the priest shall take the basket out of thy hand, and set it down before the altar of Jehovah thy God."
05026005,5,26,5,"And thou shalt answer and say before Jehovah thy God, A Syrian ready to perish was my father; and he went down into Egypt, and sojourned there, few in number; and he became there a nation, great, mighty, and populous."
05026006,5,26,6,"And the Egyptians dealt ill with us, and afflicted us, and laid upon us hard bondage:"
05026007,5,26,7,"and we cried unto Jehovah, the God of our fathers, and Jehovah heard our voice, and saw our affliction, and our toil, and our oppression;"
05026008,5,26,8,"and Jehovah brought us forth out of Egypt with a mighty hand, and with an outstretched arm, and with great terribleness, and with signs, and with wonders;"
05026009,5,26,9,"and he hath brought us into this place, and hath given us this land, a land flowing with milk and honey."
05026010,5,26,10,"And now, behold, I have brought the first of the fruit of the ground, which thou, O Jehovah, hast given me. And thou shalt set it down before Jehovah thy God, and worship before Jehovah thy God:"
05026011,5,26,11,"and thou shalt rejoice in all the good which Jehovah thy God hath given unto thee, and unto thy house, thou, and the Levite, and the sojourner that is in the midst of thee."
05026012,5,26,12,"When thou hast made an end of tithing all the tithe of thine increase in the third year, which is the year of tithing, then thou shalt give it unto the Levite, to the sojourner, to the fatherless, and to the widow, that they may eat within thy gates, and be filled."
05026013,5,26,13,"And thou shalt say before Jehovah thy God, I have put away the hallowed things out of my house, and also have given them unto the Levite, and unto the sojourner, to the fatherless, and to the widow, according to all thy commandment which thou hast commanded me: I have not transgressed any of thy commandments, neither have I forgotten them:"
05026014,5,26,14,"I have not eaten thereof in my mourning, neither have I put away thereof, being unclean, nor given thereof for the dead: I have hearkened to the voice of Jehovah my God; I have done according to all that thou hast commanded me."
05026015,5,26,15,"Look down from thy holy habitation, from heaven, and bless thy people Israel, and the ground which thou hast given us, as thou swarest unto our fathers, a land flowing with milk and honey."
05026016,5,26,16,"This day Jehovah thy God commandeth thee to do these statutes and ordinances: thou shalt therefore keep and do them with all thy heart, and with all thy soul."
05026017,5,26,17,"Thou hast avouched Jehovah this day to be thy God, and that thou wouldest walk in his ways, and keep his statutes, and his commandments, and his ordinances, and hearken unto his voice:"
05026018,5,26,18,"and Jehovah hath avouched thee this day to be a people for his own possession, as he hath promised thee, and that thou shouldest keep all his commandments;"
05026019,5,26,19,"and to make thee high above all nations that he hath made, in praise, and in name, and in honor; and that thou mayest be a holy people unto Jehovah thy God, as he hath spoken."
05027001,5,27,1,"And Moses and the elders of Israel commanded the people, saying, Keep all the commandment which I command you this day."
05027002,5,27,2,"And it shall be on the day when ye shall pass over the Jordan unto the land which Jehovah thy God giveth thee, that thou shalt set thee up great stones, and plaster them with plaster:"
05027003,5,27,3,"and thou shalt write upon them all the words of this law, when thou art passed over; that thou mayest go in unto the land which Jehovah thy God giveth thee, a land flowing with milk and honey, as Jehovah, the God of thy fathers, hath promised thee."
05027004,5,27,4,"And it shall be, when ye are passed over the Jordan, that ye shall set up these stones, which I command you this day, in mount Ebal, and thou shalt plaster them with plaster."
05027005,5,27,5,"And there shalt thou build an altar unto Jehovah thy God, an altar of stones: thou shalt lift up no iron `tool' upon them."
05027006,5,27,6,Thou shalt build the altar of Jehovah thy God of unhewn stones; and thou shalt offer burnt-offerings thereon unto Jehovah thy God:
05027007,5,27,7,"and thou shalt sacrifice peace-offerings, and shalt eat there; and thou shalt rejoice before Jehovah thy God."
05027008,5,27,8,And thou shalt write upon the stones all the words of this law very plainly.
05027009,5,27,9,"And Moses and the priests the Levites spake unto all Israel, saying, Keep silence, and hearken, O Israel: this day thou art become the people of Jehovah thy God."
05027010,5,27,10,"Thou shalt therefore obey the voice of Jehovah thy God, and do his commandments and his statutes, which I command thee this day."
05027011,5,27,11,"And Moses charged the people the same day, saying,"
05027012,5,27,12,"These shall stand upon mount Gerizim to bless the people, when ye are passed over the Jordan: Simeon, and Levi, and Judah, and Issachar, and Joseph, and Benjamin."
05027013,5,27,13,"And these shall stand upon mount Ebal for the curse: Reuben, Gad, and Asher, and Zebulun, Dan, and Naphtali."
05027014,5,27,14,"And the Levites shall answer, and say unto all the men of Israel with a loud voice,"
05027015,5,27,15,"Cursed be the man that maketh a graven or molten image, an abomination unto Jehovah, the work of the hands of the craftsman, and setteth it up in secret. And all the people shall answer and say, Amen."
05027016,5,27,16,"Cursed be he that setteth light by his father or his mother. And all the people shall say, Amen."
05027017,5,27,17,"Cursed be he that removeth his neighbor's landmark. And all the people shall say, Amen."
05027018,5,27,18,"Cursed be he that maketh the blind to wander out of the way. And all the people shall say, Amen."
05027019,5,27,19,"Cursed be he that wresteth the justice `due' to the sojourner, fatherless, and widow. And all the people shall say, Amen."
05027020,5,27,20,"Cursed be he that lieth with his father's wife, because he hath uncovered his father's skirt. And all the people shall say, Amen."
05027021,5,27,21,"Cursed be he that lieth with any manner of beast. And all the people shall say, Amen."
05027022,5,27,22,"Cursed be he that lieth with his sister, the daughter of his father, or the daughter of his mother. And all the people shall say, Amen."
05027023,5,27,23,"Cursed be he that lieth with his mother-in-law. And all the people shall say, Amen."
05027024,5,27,24,"Cursed be he that smiteth his neighbor in secret. And all the people shall say, Amen."
05027025,5,27,25,"Cursed be he that taketh a bribe to slay an innocent person. And all the people shall say, Amen."
05027026,5,27,26,"Cursed be he that confirmeth not the words of this law to do them. And all the people shall say, Amen."
05028001,5,28,1,"And it shall come to pass, if thou shalt hearken diligently unto the voice of Jehovah thy God, to observe to do all his commandments which I command thee this day, that Jehovah thy God will set thee on high above all the nations of the earth:"
05028002,5,28,2,"and all these blessings shall come upon thee, and overtake thee, if thou shalt hearken unto the voice of Jehovah thy God."
05028003,5,28,3,"Blessed shalt thou be in the city, and blessed shalt thou be in the field."
05028004,5,28,4,"Blessed shall be the fruit of thy body, and the fruit of thy ground, and the fruit of thy beasts, the increase of thy cattle, and the young of thy flock."
05028005,5,28,5,Blessed shall be thy basket and thy kneading-trough.
05028006,5,28,6,"Blessed shalt thou be when thou comest in, and blessed shalt thou be when thou goest out."
05028007,5,28,7,"Jehovah will cause thine enemies that rise up against thee to be smitten before thee: they shall come out against thee one way, and shall flee before thee seven ways."
05028008,5,28,8,"Jehovah will command the blessing upon thee in thy barns, and in all that thou puttest thy hand unto; and he will bless thee in the land which Jehovah thy God giveth thee."
05028009,5,28,9,"Jehovah will establish thee for a holy people unto himself, as he hath sworn unto thee; if thou shalt keep the commandments of Jehovah thy God, and walk in his ways."
05028010,5,28,10,And all the peoples of the earth shall see that thou art called by the name of Jehovah; and they shall be afraid of thee.
05028011,5,28,11,"And Jehovah will make thee plenteous for good, in the fruit of thy body, and in the fruit of thy cattle, and in the fruit of thy ground, in the land which Jehovah sware unto thy fathers to give thee."
05028012,5,28,12,"Jehovah will open unto thee his good treasure the heavens, to give the rain of thy land in its season, and to bless all the work of thy hand: and thou shalt lend unto many nations, and thou shalt not borrow."
05028013,5,28,13,"And Jehovah will make thee the head, and not the tail; and thou shalt be above only, and thou shalt not be beneath; if thou shalt hearken unto the commandments of Jehovah thy God, which I command thee this day, to observe and to do `them',"
05028014,5,28,14,"and shalt not turn aside from any of the words which I command you this day, to the right hand, or to the left, to go after other gods to serve them."
05028015,5,28,15,"But it shall come to pass, if thou wilt not hearken unto the voice of Jehovah thy God, to observe to do all his commandments and his statutes which I command thee this day, that all these curses shall come upon thee, and overtake thee."
05028016,5,28,16,"Cursed shalt thou be in the city, and cursed shalt thou be in the field."
05028017,5,28,17,Cursed shall be thy basket and thy kneading-trough.
05028018,5,28,18,"Cursed shall be the fruit of thy body, and the fruit of thy ground, the increase of thy cattle, and the young of thy flock."
05028019,5,28,19,"Cursed shalt thou be when thou comest in, and cursed shalt thou be when thou goest out."
05028020,5,28,20,"Jehovah will send upon thee cursing, discomfiture, and rebuke, in all that thou puttest thy hand unto to do, until thou be destroyed, and until thou perish quickly; because of the evil of thy doings, whereby thou hast forsaken me."
05028021,5,28,21,"Jehovah will make the pestilence cleave unto thee, until he have consumed thee from off the land, whither thou goest in to possess it."
05028022,5,28,22,"Jehovah will smite thee with consumption, and with fever, and with inflammation, and with fiery heat, and with the sword, and with blasting, and with mildew; and they shall pursue thee until thou perish."
05028023,5,28,23,"And thy heaven that is over thy head shall be brass, and the earth that is under thee shall be iron."
05028024,5,28,24,"Jehovah will make the rain of thy land powder and dust: from heaven shall it come down upon thee, until thou be destroyed."
05028025,5,28,25,"Jehovah will cause thee to be smitten before thine enemies; thou shalt go out one way against them, and shalt flee seven ways before them: and thou shalt be tossed to and from among all the kingdoms of the earth."
05028026,5,28,26,"And thy dead body shall be food unto all birds of the heavens, and unto the beasts of the earth; and there shall be none to frighten them away."
05028027,5,28,27,"Jehovah will smite thee with the boil of Egypt, and with the emerods, and with the scurvy, and with the itch, whereof thou canst not be healed."
05028028,5,28,28,"Jehovah will smite thee with madness, and with blindness, and with astonishment of heart;"
05028029,5,28,29,"and thou shalt grope at noonday, as the blind gropeth in darkness, and thou shalt not prosper in thy ways: and thou shalt be only oppressed and robbed alway, and there shall be none to save thee."
05028030,5,28,30,"Thou shalt betroth a wife, and another man shall lie with her: thou shalt build a house, and thou shalt not dwell therein: thou shalt plant a vineyard, and shalt not use the fruit thereof."
05028031,5,28,31,"Thine ox shall be slain before thine eyes, and thou shalt not eat thereof: thine ass shall be violently taken away from before thy face, and shall not be restored to thee: thy sheep shall be given unto thine enemies, and thou shalt have none to save thee."
05028032,5,28,32,"Thy sons and thy daughters shall be given unto another people; and thine eyes shall look, and fail with longing for them all the day: and there shall be nought in the power of thy hand."
05028033,5,28,33,"The fruit of thy ground, and all thy labors, shall a nation which thou knowest not eat up; and thou shalt be only oppressed and crushed alway;"
05028034,5,28,34,so that thou shalt be mad for the sight of thine eyes which thou shalt see.
05028035,5,28,35,"Jehovah will smite thee in the knees, and in the legs, with a sore boil, whereof thou canst not be healed, from the sole of thy foot unto the crown of thy head."
05028036,5,28,36,"Jehovah will bring thee, and thy king whom thou shalt set over thee, unto a nation that thou hast not known, thou nor thy fathers; and there shalt thou serve other gods, wood and stone."
05028037,5,28,37,"And thou shalt become an astonishment, a proverb, and a byword, among all the peoples whither Jehovah shall lead thee away."
