N-gram,Count,Book
A Psalm of David,57,19
For the Chief Musician,53,19
his lovingkindness endureth for,32,19
lovingkindness endureth for ever,32,19
For his lovingkindness endureth,30,19
be put to shame,26,19
the name of Jehovah,19,19
Chief Musician set to,17,19
the Chief Musician set,17,19
A Song of Ascents,15,19
the children of men,14,19
will give thanks unto,14,19
I will give thanks,13,19
the workers of iniquity,13,19
all the day long,12,19
for ever and ever,12,19
them that fear him,12,19
give thanks unto Jehovah,11,19
give thanks unto thee,11,19
in the day of,11,19
of the sons of,11,19
the sons of Korah,11,19
A Psalm of Asaph,10,19
Psalm of the sons,10,19
the voice of my,10,19
Blessed is the man,9,19
O Jehovah my God,9,19
in the midst of,9,19
the hand of the,9,19
unto thee O Jehovah,9,19
A Psalm of the,8,19
Oh give thanks unto,8,19
ends of the earth,8,19
in the house of,8,19
put to shame and,8,19
that rise up against,8,19
the ends of the,8,19
the house of Jehovah,8,19
them be put to,8,19
I will sing praises,7,19
Let them be put,7,19
The voice of Jehovah,7,19
according to thy word,7,19
is the man that,7,19
not be put to,7,19
the Chief Musician on,7,19
the God of Jacob,7,19
with my whole heart,7,19
But as for me,6,19
Chief Musician on stringed,6,19
Jehovah O my soul,6,19
Musician on stringed instruments,6,19
do I take refuge,6,19
from the hand of,6,19
give thanks unto thy,6,19
have mercy upon me,6,19
in the land of,6,19
my rock and my,6,19
of the Most High,6,19
of the hand of,6,19
that take refuge in,6,19
the God of my,6,19
the upright in heart,6,19
voice of my supplications,6,19
Bless Jehovah O my,5,19
But thou O Jehovah,5,19
For thou art my,5,19
From this time forth,5,19
God of my salvation,5,19
Have mercy upon me,5,19
I am poor and,5,19
I shall not be,5,19
Jehovah God of hosts,5,19
Make a joyful noise,5,19
O Jehovah God of,5,19
Song of Ascents of,5,19
Thou art my God,5,19
a joyful noise unto,5,19
and have mercy upon,5,19
and the fulness thereof,5,19
at the presence of,5,19
forth and for evermore,5,19
good For his lovingkindness,5,19
he is good For,5,19
his wonderful works to,5,19
is good For his,5,19
kings of the earth,5,19
made heaven and earth,5,19
me O Jehovah for,5,19
me according to thy,5,19
of the earth shall,5,19
of the wicked shall,5,19
shall be put to,5,19
shall inherit the land,5,19
shall not be moved,5,19
sing praises unto thee,5,19
thanks unto thee O,5,19
thanks unto thy name,5,19
the God of Israel,5,19
the day of my,5,19
the land of the,5,19
the poor and needy,5,19
the sons of men,5,19
this time forth and,5,19
thy face from me,5,19
thy face to shine,5,19
thy name for ever,5,19
time forth and for,5,19
to the children of,5,19
unto the voice of,5,19
will I sing praises,5,19
will cut them off,5,19
will sing praises unto,5,19
