10006021,10,6,21,"And David said to Michal, I was dancing before the Lord, who put me over your father and all his sons, to make me a ruler over the people of the Lord, over his people Israel: and I will go on playing before the Lord;"
10006022,10,6,22,"And I will do even worse than this, and make myself even lower in your eyes: but the servant-girls of whom you were talking will give me honour."
10006023,10,6,23,"And Michal, Saul's daughter, had no child till the day of her death."
10007001,10,7,1,"Now when the king was living in his house, and the Lord had given him rest from war on every side;"
10007002,10,7,2,"The king said to Nathan the prophet, See now, I am living in a house of cedar, but the ark of God is housed inside the curtains of a tent."
10007003,10,7,3,"And Nathan said to the king, Go and do whatever is in your heart; for the Lord is with you."
10007004,10,7,4,"Now that night the word of the Lord came to Nathan, saying,"
10007005,10,7,5,"Go and say to my servant David, The Lord says, Are you to be the builder of a house, a living-place for me?"
10007006,10,7,6,"For from the day when I took the children of Israel up out of Egypt till this day, I have had no house, but have gone from place to place in a tent."
10007007,10,7,7,"In all the places where I went with all the children of Israel, did I ever say to any of the judges of Israel, to whom I gave the care of my people Israel, Why have you not made me a house of cedar?"
10007008,10,7,8,"Then say these words to my servant David, The Lord of armies says, I took you from the fields, from keeping the sheep, so that you might be a ruler over my people, over my people Israel:"
10007009,10,7,9,"And I have been with you wherever you went, cutting off before you all those who were against you; and I will make your name great, like the name of the greatest ones of the earth."
10007010,10,7,10,"And I will make a resting-place for my people Israel, planting them there, so that they may be living in the place which is theirs, and never again be moved; and never again will they be troubled by evil men as they were at the first,"
10007011,10,7,11,From the time when I put judges over my people Israel; and I will give you peace from all who are against you. And the Lord says to you that he will make you the head of a line of kings.
10007012,10,7,12,"And when the time comes for you to go to rest with your fathers, I will put in your place your seed after you, the offspring of your body, and I will make his kingdom strong."
10007013,10,7,13,"He will be the builder of a house for my name, and I will make the seat of his authority certain for ever."
10007014,10,7,14,"I will be to him a father and he will be to me a son: if he does wrong, I will give him punishment with the rod of men and with the blows of the children of men;"
10007015,10,7,15,"But my mercy will not be taken away from him, as I took it from him who was before you."
10007016,10,7,16,And your family and your kingdom will keep their place before me for ever: the seat of your authority will never be overturned.
10007017,10,7,17,So Nathan gave David an account of all these words and this vision.
10007018,10,7,18,"Then David the king went in and took his seat before the Lord, and said, Who am I, O Lord God, and what is my family, that you have been my guide till now?"
10007019,10,7,19,"And this was only a small thing to you, O Lord God; but your words have even been about the far-off future of your servant's family, O Lord God!"
10007020,10,7,20,"What more may David say to you? for you have knowledge of your servant, O Lord God."
10007021,10,7,21,"Because of your word and from your heart, you have done all this great work, and let your servant see it."
10007022,10,7,22,"Truly you are great, O Lord God: there is no one like you and no other God but you, as is clear from everything which has come to our ears."
10007023,10,7,23,"And what other nation in the earth, like your people Israel, did a god go out to take for himself, to be his people, and to make a name for himself, and to do great and strange things for them, driving out a nation and its gods from before his people?"
10007024,10,7,24,"But you took and made strong for yourself your people Israel, to be your people for ever; and you, Lord, became their God."
10007025,10,7,25,"And now, O Lord God, may the word which you have said about your servant and about his family, be made certain for ever, and may you do as you have said!"
10007026,10,7,26,"And let your name be made great for ever, and let men say, The Lord of armies is God over Israel: and let the family of David your servant be made strong before you!"
10007027,10,7,27,"For you, O Lord of armies, the God of Israel, have clearly said to your servant, I will make you the head of a family of kings: and so it has come into your servant's heart to make this prayer to you."
10007028,10,7,28,"And now, O Lord God, you are God and your words are true and you have said you will give your servant this good thing;"
10007029,10,7,29,"So may it be your pleasure to give your blessing to the family of your servant, so that it may go on for ever before you: (for you, O Lord God, have said it,) and may your blessing be on your servant's family line for ever!"
10008001,10,8,1,And it came about after this that David made an attack on the Philistines and overcame them; and David took the authority of the mother-town from the hands of the Philistines.
10008002,10,8,2,"And he overcame the Moabites, and he had them measured with a line when they were stretched out on the earth; marking out two lines for death and one full line for life. So the Moabites became servants to David and gave him offerings."
10008003,10,8,3,"And David overcame Hadadezer, the son of Rehob, king of Zobah, when he went to make his power seen by the River."
10008004,10,8,4,"And David took from him one thousand, seven hundred horsemen and twenty thousand footmen: and David had the leg-muscles of the horses cut, only keeping enough of them for a hundred war-carriages."
10008005,10,8,5,"And when the Aramaeans of Damascus came to the help of Hadadezer, king of Zobah, David put to the sword twenty-two thousand of the Aramaeans."
10008006,10,8,6,And David put armed forces in Aram of Damascus: and the Aramaeans became servants to David and gave him offerings. And the Lord made David overcome wherever he went.
10008007,10,8,7,And David took their gold body-covers from the servants of Hadadezer and took them to Jerusalem.
10008008,10,8,8,"And from Tebah and Berothai, towns of Hadadezer, King David took a great store of brass."
10008009,10,8,9,"And when Tou, king of Hamath, had news that David had overcome all the army of Hadadezer,"
10008010,10,8,10,"He sent his son Hadoram to David, with words of peace and blessing, because he had overcome Hadadezer in the fight, for Hadadezer had wars with Tou; and Hadoram took with him vessels of silver and gold and brass:"
10008011,10,8,11,"These King David made holy to the Lord, together with the silver and gold which he had taken from the nations he had overcome--"
10008012,10,8,12,"The nations of Edom and Moab, and the children of Ammon and the Philistines and the Amalekites and the goods he had taken from Hadadezer, the son of Rehob, king of Zobah."
10008013,10,8,13,"And David got great honour for himself, when he came back, by the destruction of Edom in the valley of Salt, to the number of eighteen thousand men."
10008014,10,8,14,"And he put armed forces in Edom; all through Edom he had armed forces stationed, and all the Edomites became servants to David. And the Lord made David overcome wherever he went."
10008015,10,8,15,"And David was king over all Israel, judging and giving right decisions for all his people."
10008016,10,8,16,"And Joab, the son of Zeruiah, was chief of the army; and Jehoshaphat, the son of Ahilud, was keeper of the records;"
10008017,10,8,17,"And Zadok and Abiathar, the son of Ahimelech, the son of Ahitub, were priests; and Seraiah was the scribe;"
10008018,10,8,18,"And Benaiah, the son of Jehoiada, was over the Cherethites and the Pelethites; and David's sons were priests."
10009001,10,9,1,"And David said, Is there still anyone of Saul's family living, so that I may be a friend to him, because of Jonathan?"
10009002,10,9,2,"Now there was of Saul's people a servant named Ziba, and they sent him to David; and the king said to him, Are you Ziba? And he said, I am."
10009003,10,9,3,"And the king said, Is there anyone of Saul's family still living, to whom I may be a friend in God's name? And Ziba said, There is a son of Jonathan, whose feet are damaged."
10009004,10,9,4,"And the king said to him, Where is he? And Ziba said to the king, He is in the house of Machir, the son of Ammiel, in Lo-debar."
10009005,10,9,5,"Then King David sent, and had him taken from Lo-debar, from the house of Machir, the son of Ammiel."
10009006,10,9,6,"And Mephibosheth, the son of Jonathan, came to David, and falling down on his face, gave him honour. And David said, Mephibosheth. And answering he said, Your servant is here."
10009007,10,9,7,"And David said to him, Have no fear: for truly I will be good to you, because of your father Jonathan, and I will give back to you all the land which was Saul's; and you will have a place at my table at all times."
10009008,10,9,8,"And he went down on his face before the king, and said, What is your servant, for you to take note of a dead dog such as I am?"
10009009,10,9,9,"Then the king sent for Ziba, Saul's servant, and said to him, All the property of Saul and of his family I have given to your master's son."
10009010,10,9,10,"And you and your sons and your servants are to take care of the land for him, and get in the fruit of it, so that your master's son may have food: but Mephibosheth, your master's son, will have a place at my table at all times. Now Ziba had fifteen sons and twenty servants."
10009011,10,9,11,"Then Ziba said to the king, Every order which you have given to your servant will be done. As for Mephibosheth, he had a place at David's table, like one of the king's sons."
10009012,10,9,12,And Mephibosheth had a young son named Mica. And all the people living in the house of Ziba were servants to Mephibosheth.
10009013,10,9,13,So Mephibosheth went on living in Jerusalem; for he took all his meals at the king's table; and he had not the use of his feet.
10010001,10,10,1,"Now after this, death came to the king of the children of Ammon, and Hanun, his son, became king in his place."
10010002,10,10,2,"And David said, I will be a friend to Hanun, the son of Nahash, as his father was a friend to me. So David sent his servants, to give him words of comfort on account of his father. And David's servants came into the land of the children of Ammon."
10010003,10,10,3,"But the chiefs of the children of Ammon said to Hanun their lord, Does it seem to you that David is honouring your father by sending comforters to you? has he not sent his servants to go through the town and make secret observation of it, and overcome it?"
10010004,10,10,4,"So Hanun took David's servants, and after cutting off half the hair on their chins, and cutting off the skirts of their robes up to the middle, he sent them away."
10010005,10,10,5,"When David had news of it, he sent men out with the purpose of meeting them on their way, for the men were greatly shamed: and the king said, Go to Jericho till your hair is long again, and then come back."
10010006,10,10,6,"And when the children of Ammon saw that they had made themselves hated by David, they sent to the Aramaeans of Beth-rehob and Zobah, and got for payment twenty thousand footmen, and they got from the king of Maacah a thousand men, and from Tob twelve thousand."
10010007,10,10,7,"And hearing of this, David sent Joab and all the army and the best fighting-men."
10010008,10,10,8,"And the children of Ammon came out and put their forces in position at the way into the town: and the Aramaeans of Zobah and of Rehob, with the men of Tob and Maacah, were by themselves in the field."
10010009,10,10,9,"Now when Joab saw that their forces were in position against him in front and at his back, he took the best of the men of Israel and put them in line against the Aramaeans;"
10010010,10,10,10,"And the rest of the people he put in position against the children of Ammon, with Abishai, his brother, at their head."
10010011,10,10,11,"And he said, If the Aramaeans are stronger and get the better of me, then you are to come to my help; but if the children of Ammon get the better of you, I will come to your help."
10010012,10,10,12,"Take heart, and let us be strong for our people and for the towns of our God, and may the Lord do what seems good to him."
10010013,10,10,13,"Then Joab and the people with him went forward to the fight against the Aramaeans, and they went in flight before him."
10010014,10,10,14,"And when the children of Ammon saw the flight of the Aramaeans, they themselves went in flight from Abishai, and came into the town. So Joab went back from fighting the children of Ammon and came to Jerusalem."
10010015,10,10,15,"And when the Aramaeans saw that Israel had overcome them, they got themselves together."
10010016,10,10,16,"And Hadadezer sent for the Aramaeans who were on the other side of the River: and they came to Helam, with Shobach, the captain of Hadadezer's army, at their head."
10010017,10,10,17,"And word of this was given to David: and he got all Israel together and went over Jordan and came to Helam. And the Aramaeans put their forces in position against David, and made an attack on him."
10010018,10,10,18,"And the Aramaeans went in flight before Israel; and David put to the sword the men of seven hundred Aramaean war-carriages and forty thousand footmen, and Shobach, the captain of the army, was wounded, and came to his death there."
10010019,10,10,19,"And when all the kings who were servants of Hadadezer saw that they were overcome by Israel, they made peace with Israel and became their servants. So the Aramaeans, in fear, gave no more help to the children of Ammon."
10011001,10,11,1,"Now in the spring, at the time when kings go out to war, David sent Joab and his servants and all Israel with him; and they made waste the land of the children of Ammon, and took up their position before Rabbah, shutting it in. But David was still at Jerusalem."
10011002,10,11,2,"Now one evening, David got up from his bed, and while he was walking on the roof of the king's house, he saw from there a woman bathing; and the woman was very beautiful."
10011003,10,11,3,"And David sent to get knowledge who the woman was. And one said, Is this not Bath-sheba, the daughter of Eliam and wife of Uriah the Hittite?"
10011004,10,11,4,"And David sent and took her; and she came to him, and he took her to his bed: (for she had been made clean;) then she went back to her house."
10011005,10,11,5,And the woman became with child; and she sent word to David that she was with child.
10011006,10,11,6,"And David sent to Joab saying, Send Uriah the Hittite to me. And Joab sent Uriah to David."
10011007,10,11,7,"And when Uriah came to him, David put questions to him about how Joab and the people were, and how the war was going."
10011008,10,11,8,"And David said to Uriah, Go down to your house and let your feet be washed. And Uriah went away from the king's house, and an offering from the king was sent after him."
10011009,10,11,9,"But Uriah took his rest at the door of the king's house, with all the servants of his lord, and did not go down to his house."
10011010,10,11,10,"And when word was given to David that Uriah had not gone down to his house, David said to Uriah, Have you not come from a journey? why did you not go down to your house?"
10011011,10,11,11,"And Uriah said to David, Israel and Judah with the ark are living in tents, and my lord Joab and the other servants of my lord are sleeping in the open field; and am I to go to my house and take food and drink, and go to bed with my wife? By the living Lord, and by the life of your soul, I will not do such a thing."
10011012,10,11,12,"And David said to Uriah, Be here today, and after that I will let you go. So Uriah was in Jerusalem that day and the day after."
10011013,10,11,13,"And when David sent for him, he took meat and drink with him, and David made him the worse for drink: and when evening came, he went to rest on his bed with the servants of his lord, but he did not go down to his house."
10011014,10,11,14,"Now in the morning, David gave Uriah a letter to take to Joab."
10011015,10,11,15,"And in the letter he said, Take care to put Uriah in the very front of the line, where the fighting is most violent, and go back from him, so that he may be overcome and put to death."
10011016,10,11,16,"So while Joab was watching the town, he put Uriah in the place where it was clear to him the best fighters were."
10011017,10,11,17,"And the men of the town went out and had a fight with Joab: and a number of David's men came to their death in the fight, and with them Uriah the Hittite."
10011018,10,11,18,Then Joab sent David news of everything which had taken place in the war:
10011019,10,11,19,"And he gave orders to the man who took the news, saying, After you have given the king all the news about the war,"
10011020,10,11,20,"If the king is angry and says, Why did you go so near the town for the fight? was it not certain that their archers would be on the wall?"
10011021,10,11,21,"Who put Abimelech, the son of Jerubbaal, to death? did not a woman send a great stone down on him from the wall, putting him to death at Thebez? why did you go so near the wall? Then say to him, Your servant Uriah the Hittite is among the dead."
10011022,10,11,22,"So the man went, and came to David, and gave him all the news which Joab had sent him to give; then David was angry with Joab and said, Why did you go so near the town for the fight? was it not certain that their archers would be on the wall? who put Abimelech, the son of Jerubbaal, to death? did not a woman send a great stone down on him from the wall, putting him to death at Thebez? why did you go so near the wall?"
10011023,10,11,23,"And the man said to David, Truly the men got the better of us, and came out against us into the open country, but we sent them back to the very doors of the town."
10011024,10,11,24,"And the archers sent their arrows at your servants from the wall, and some of the king's servants are dead, and among them is your servant Uriah the Hittite."
10011025,10,11,25,"Then David said to the man, Go and say to Joab, Do not let this be a grief to you; for one man may come to his death by the sword like another: put up an even stronger fight against the town, and take it: and do you put heart into him."
10011026,10,11,26,"And when the wife of Uriah had news that her husband was dead, she gave herself up to weeping for him."
10011027,10,11,27,"And when the days of weeping were past, David sent for her, and took her into his house, and she became his wife and gave him a son. But the Lord was not pleased with the thing David had done."
10012001,10,12,1,"And the Lord sent Nathan to David. And Nathan came to him and said, There were two men in the same town: one a man of great wealth, and the other a poor man."
10012002,10,12,2,The man of wealth had great numbers of flocks and herds;
10012003,10,12,3,"But the poor man had only one little she-lamb, which he had got and taken care of: from its birth it had been with him like one of his children; his meat was its food, and from his cup it took its drink, resting in his arms, and it was like a daughter to him."
10012004,10,12,4,"Now a traveller came to the house of the man of wealth, but he would not take anything from his flock or his herd to make a meal for the traveller who had come to him, but he took the poor man's lamb and made it ready for the man who had come."
10012005,10,12,5,"And David was full of wrath against that man; and he said to Nathan, By the living Lord, death is the right punishment for the man who has done this:"
10012006,10,12,6,"And he will have to give back four times the value of the lamb, because he has done this and because he had no pity."
10012007,10,12,7,"And Nathan said to David, You are that man. The Lord God of Israel says, I made you king over Israel, putting holy oil on you, and I kept you safe from the hands of Saul;"
10012008,10,12,8,"I gave you your master's daughter and your master's wives for yourself, and I gave you the daughters of Israel and Judah; and if that had not been enough, I would have given you such and such things."
10012009,10,12,9,"Why then have you had no respect for the word of the Lord, doing what is evil in his eyes? You have put Uriah the Hittite to death with the sword, and have taken his wife to be your wife; you have put him to death with the sword of the children of Ammon."
10012010,10,12,10,"So now the sword will never be turned away from your family; because you have had no respect for me, and have taken the wife of Uriah the Hittite to be your wife."
10012011,10,12,11,"The Lord says, From those of your family I will send evil against you, and before your very eyes I will take your wives and give them to your neighbour, and he will take your wives to his bed by the light of this sun."
10012012,10,12,12,You did it secretly; but I will do this thing before all Israel and in the light of the sun.
10012013,10,12,13,"And David said to Nathan, Great is my sin against the Lord. And Nathan said to David, The Lord has put away your sin; death will not come on you."
10012014,10,12,14,"But still, because you have had no respect for the Lord, death will certainly overtake the child who has newly come to birth."
10012015,10,12,15,"Then Nathan went back to his house. And the hand of the Lord was on David's son, the child of Uriah's wife, and it became very ill."
10012016,10,12,16,"So David made prayer to God for the child; and he took no food day after day, and went in and, stretching himself out on the earth, was there all night."
10012017,10,12,17,"And the chief men of his house got up and went to his side to make him get up from the earth, but he would not; and he would not take food with them."
10012018,10,12,18,"And then on the seventh day the child's death took place. And David's servants were in fear of giving him the news of the child's death: for they said, Truly, while the child was still living he gave no attention when we said anything to him: what will he do to himself if we give him word that the child is dead?"
10012019,10,12,19,"But when David saw that his servants were talking together quietly, he was certain that the child was dead: and he said to his servants, Is the child dead? and they said, He is."
10012020,10,12,20,"Then David got up from the earth, and after washing and rubbing himself with oil and changing his clothing, he went into the house of the Lord and gave worship: then he went back to his house, and at his order they put food before him and he had a meal."
10012021,10,12,21,"Then his servants said to him, Why have you been acting in this way? you were weeping and going without food while the child was still living; but when the child was dead, you got up and had a meal."
10012022,10,12,22,"And he said, While the child was still living I went without food and gave myself up to weeping: for I said, Who is able to say that the Lord will not have mercy on me and give the child life?"
10012023,10,12,23,"But now that the child is dead there is no reason for me to go without food; am I able to make him come back to life? I will go to him, but he will never come back to me."
10012024,10,12,24,"And David gave comfort to his wife Bath-sheba, and he went in to her and had connection with her: and she had a son to whom she gave the name Solomon. And he was dear to the Lord."
10012025,10,12,25,"And he sent word by Nathan the prophet, who gave him the name Jedidiah, by the word of the Lord."
10012026,10,12,26,"Now Joab was fighting against Rabbah, in the land of the children of Ammon, and he took the water-town."
10012027,10,12,27,"And Joab sent men to David, saying, I have made war against Rabbah and have taken the water-town."
10012028,10,12,28,"So now, get the rest of the people together, and put them in position against the town and take it, for if I take it, it will be named after my name."
10012029,10,12,29,Then David got all the people together and went to Rabbah and made war on it and took it.
10012030,10,12,30,"And he took the crown of Milcom from his head; the weight of it was a talent of gold, and in it were stones of great price; and it was put on David's head. And he took a great store of goods from the town."
10012031,10,12,31,"And he took the people out of the town and put them to work with wood-cutting instruments, and iron grain-crushers, and iron axes, and at brick-making: this he did to all the towns of the children of Ammon. Then David and all the people went back to Jerusalem."
10013001,10,13,1,"Now after this, it came about that Absalom, David's son, had a beautiful sister, whose name was Tamar; and David's son Amnon was in love with her."
10013002,10,13,2,"And he was so deeply in love that he became ill because of his sister Tamar; for she was a virgin, and so it seemed hard to Amnon to do anything to her."
10013003,10,13,3,"But Amnon had a friend whose name was Jonadab, the son of Shimeah, David's brother: and Jonadab was a very wise man."
10013004,10,13,4,"And he said to him, O son of the king, why are you getting thinner day by day? will you not say what your trouble is? And Amnon said to him, I am in love with Tamar, my brother Absalom's sister."
